review,cleaned_review,cleaned_review_stemmed,nama desa wisata,provinsi
2 malam bersama teman dan kolega dari Sarawak di Sungai Utik yang luarbiasa,malam teman kolega sarawak sungai utik luarbiasa,malam teman kolega sarawak sungai utik luarbiasa,Desa Wisata Sungai Utik,Kalimantan Barat
Sangat bagus tempat wisatanya,bagus wisatanya,bagus wisata,Desa Wisata Sungai Utik,Kalimantan Barat
"Menyenangkan, belajar banyak dan ingin kembali lagi",menyenangkan belajar,senang ajar,Desa Wisata Sungai Utik,Kalimantan Barat
Amazing 👌🏻🤟🏻🥰,amazing,amazing,Desa Wisata Sungai Utik,Kalimantan Barat
"Terdapat komunitas adat Dayak Iban yang memiliki beragam budaya, ada dan tradisi yang turun temurun.
Gawai adalah salah satu perayaan adat bagi suku Dayak yang memiliki tujuan untuk bersyulur atas hasil yang diberikan bumi kepada manusia.
Biasanya Gawai dilakukan pasca panen, serta memiliki tujuan yang erat kaitannya dengan kekeluargaan",komunitas adat dayak iban memiliki beragam budaya tradisi turun temurun gawai salah perayaan adat suku dayak memiliki tujuan bersyulur hasil bumi manusia gawai pasca panen memiliki tujuan erat kaitannya kekeluargaan,komunitas adat dayak iban milik agam budaya tradisi turun turun gawai salah raya adat suku dayak milik tuju bersyulur hasil bumi manusia gawai pasca panen milik tuju erat kait keluarga,Desa Wisata Sungai Utik,Kalimantan Barat
Tempat yang nyaman untuk menginap. Suasana pegunungan sejuk,nyaman menginap suasana pegunungan sejuk,nyaman inap suasana gunung sejuk,Desa Wisata Sungai Utik,Kalimantan Barat
"Desember 2022, saya sedang melakukan touring motor Temajuk - Ngabang - Kapuas Hulu - Nanga Badau terus menyusur jalan paralel perbatasan yang baru dibangun hingga Entikong, Jagoi, Aruk dan kembali ke Temajuk.

Selain pengalaman offroad di jalan paralel yg masih 90% tanah dan sepi, singgah dan menginap selama 5 hari di Sungai Utik adalah salah satu pengalaman hidup yang sangat membekas dan menghangatkan hati.

Saya datang tanpa ada kenalan sama sekali sebelumnya di Utik, hanya bermodal cerita dan ketertarikan akan komunitas ini serta hubungan mereka dengan adat dan alam. Saya kemudian disiapkan bilik di rumah pak Kades Raymandus, serta mendapat banyak kearifan dari cerita-cerita langsung oleh Apay Janggut. Apay adalah tokoh yang konsisten menjaga hutan dan adat selama puluhan tahun, hingga komunitas Utik mendapat penghargaan dari UN di New York pada 2019.

Saya dilibatkan juga dan dianggap seperti saudara sendiri saat perayaan malam tahun baru yang berlangsung semalam suntuk di rumah betang. Berbagai makanan dan minuman disajikan, bergoyang bersama dan ditutup dengan mandi di sungai pada dini hari.

Sungguh pengalaman hidup amat manis. Saya belajar banyak disini.",desember touring motor temajuk ngabang kapuas hulu nanga badau menyusur jalan paralel perbatasan dibangun entikong jagoi aruk temajuk pengalaman offroad jalan paralel tanah sepi singgah menginap sungai utik salah pengalaman hidup membekas menghangatkan hati kenalan utik bermodal cerita ketertarikan komunitas hubungan adat alam disiapkan bilik rumah kades raymandus kearifan cerita cerita apay janggut apay tokoh konsisten menjaga hutan adat puluhan tahun komunitas utik penghargaan un new york dilibatkan dianggap saudara perayaan malam tahun semalam suntuk rumah betang makanan minuman disajikan bergoyang ditutup mandi sungai sungguh pengalaman hidup manis belajar,desember touring motor tajuk ngabang kapuas hulu nanga badau susur jalan paralel batas bangun entikong jago aruk tajuk alam offroad jalan paralel tanah sepi singgah inap sungai utik salah alam hidup bekas hangat hati kenal utik modal cerita tari komunitas hubung adat alam siap bilik rumah kades raymandus arif cerita cerita apay janggut apay tokoh konsisten jaga hutan adat puluh tahun komunitas utik harga un new york libat anggap saudara raya malam tahun malam suntuk rumah betang makan minum saji goyang tutup mandi sungai sungguh alam hidup manis ajar,Desa Wisata Sungai Utik,Kalimantan Barat
Sip,sip,sip,Desa Wisata Sungai Utik,Kalimantan Barat
Luarbiasa dan unik kebudayaan di sini. Rumah panjang sangat asli. Orang Dayak Iban menjaga hutan mereka.,luarbiasa unik kebudayaan rumah asli dayak iban menjaga hutan,luarbiasa unik budaya rumah asli dayak iban jaga hutan,Desa Wisata Sungai Utik,Kalimantan Barat
Keren banget,keren banget,keren banget,Desa Wisata Sungai Utik,Kalimantan Barat
Keren,keren,keren,Desa Wisata Sungai Utik,Kalimantan Barat
"Keren lah pokoknya, udah 2 kali kesini...nggak.nyesel",keren pokoknya kesini menyesal,keren pokok kesini sesal,Desa Wisata Sungai Utik,Kalimantan Barat
terima kasih google,terima kasih,terima kasih,Desa Wisata Sungai Utik,Kalimantan Barat
"Menyediakan wisata bird watching, dapat melihat Hornbill, dan beberapa jenis songbird.",menyediakan wisata biru watching hornbill jenis songbird,sedia wisata biru watching hornbill jenis songbird,Desa Wisata Sungai Utik,Kalimantan Barat
Suka sekali masih sangat terjaga lingkungan dan hutannya,suka terjaga lingkungan hutannya,suka jaga lingkung hutan,Desa Wisata Sungai Utik,Kalimantan Barat
Pengalaman yang luar biasa ✨,pengalaman,alam,Desa Wisata Sungai Utik,Kalimantan Barat
"Rumah Panjang suku Dayak Iban, Dusun Sungai Utik, Desa Batu Lintang, Kecamatan Embaloh Hulu, Kabuapaten Kapuas Hulu, Kalimantan Barat.

Original cultured in West Borneo...

Have communally protected customary and cultural areas...",rumah suku dayak iban dusun sungai utik desa batu lintang kecamatan embaloh hulu kabuapaten kapuas hulu kalimantan barat original cultured west borneo have communally protected customary and cultural areas,rumah suku dayak iban dusun sungai utik desa batu lintang camat embaloh hulu kabuapaten kapuas hulu kalimantan barat original cultured west borneo have communally protected customary and cultural areas,Desa Wisata Sungai Utik,Kalimantan Barat
Terbaik,terbaik,baik,Desa Wisata Sungai Utik,Kalimantan Barat
Beradat dan Berbudaya 👍,beradat berbudaya,adat budaya,Desa Wisata Sungai Utik,Kalimantan Barat
Rumah Betang Cagar Budaya yang dihuni Suku Dayak Iban,rumah betang cagar budaya dihuni suku dayak iban,rumah betang cagar budaya huni suku dayak iban,Desa Wisata Sungai Utik,Kalimantan Barat
Tempat dengan adat istiadat dan budaya yang masih terjaga... Bahkan sampai dapat penghargaan di luar negeri 👍👍,adat istiadat budaya terjaga penghargaan negeri,adat istiadat budaya jaga harga negeri,Desa Wisata Sungai Utik,Kalimantan Barat
"Sungai utik luar biasa sekali,adat dan budayanya masih sangat kental,jaga terus hutan kita. hutan Kalimantan jantungnya Borneo,kalau bukan kita siapa lagi.jangan biarkan orang lain mengambil alih tempat tinggal kita ❤️❤️‍🔥",sungai utik adat budayanya kental jaga hutan hutan kalimantan jantungnya borneo biarkan mengambil alih tinggal,sungai utik adat budaya kental jaga hutan hutan kalimantan jantung borneo biar ambil alih tinggal,Desa Wisata Sungai Utik,Kalimantan Barat
Masih asri kita juga bisa menginap disini,asri menginap,asri inap,Desa Wisata Sungai Utik,Kalimantan Barat
Suatu saat ingin kembali kesana...😊,kesana,kesana,Desa Wisata Sungai Utik,Kalimantan Barat
Kampung yang menarik untuk dikunjungi,kampung menarik dikunjungi,kampung tarik kunjung,Desa Wisata Sungai Utik,Kalimantan Barat
"Tempat yg sangat indah, selama 5 hari disana saya sangat senang",indah disana senang,indah sana senang,Desa Wisata Sungai Utik,Kalimantan Barat
"Dusun Sungai Utik Desa Batu Lintang Kec Embaloh Hulu, merupakan masyarakat yang mempertahankan kelestarian alam berupa hutan dan budayanya.
Memiliki keahlian juga dalam tenun dan membuat anyaman.
Terdapat rumah panjang yang memiliki 40an bilik yg diisi sekitar 80an KK.",dusun sungai utik desa batu lintang kec embaloh hulu masyarakat mempertahankan kelestarian alam hutan budayanya memiliki keahlian tenun anyaman rumah memiliki an bilik diisi an kakak,dusun sungai utik desa batu lintang kec embaloh hulu masyarakat tahan lestari alam hutan budaya milik ahli tenun anyam rumah milik an bilik isi an kakak,Desa Wisata Sungai Utik,Kalimantan Barat
Belum pernah kesungai utik semoga ada rejeki,kesungai utik semoga rejeki,sungai utik moga rejeki,Desa Wisata Sungai Utik,Kalimantan Barat
Masyarakat nya baik2 welcome terhadap tamu dari luar,masyarakat welcome tamu,masyarakat welcome tamu,Desa Wisata Sungai Utik,Kalimantan Barat
"Pengalaman di rumah betang. Salah satu rumah kayu yg masih ada. Panjang 78 m lebar 50 m mungkin. Udara yg masih seger, asri, hampir 100% petani. Dihuni komunitas dayak iban yg ramah. Tiap malam ada acara kongkow2 dgn minum air nira, seger menurut teman saya yg menikmatinya. Banyak dikunjungi turis asing dan lokal utk suasana yg unik. Namun demikian, perlu pembenahan manajemen agar lebih baik, salam hormat buat pak apay janggot, pak kades reamudus, kawan baik pak regang dan pak inam. Terima kasih utk pengalaman 5 malam di dusun sungai utik.",pengalaman rumah betang salah rumah kayu lebar udara segar asri petani dihuni komunitas dayak iban ramah malam acara kongkow minum air nira segar teman menikmatinya dikunjungi turis asing lokal suasana unik pembenahan manajemen hormat apay janggot kades reamudus kawan regang inam terima kasih pengalaman malam dusun sungai utik,alam rumah betang salah rumah kayu lebar udara segar asri tani huni komunitas dayak iban ramah malam acara kongkow minum air nira segar teman nikmat kunjung turis asing lokal suasana unik benah manajemen hormat apay janggot kades reamudus kawan regang inam terima kasih alam malam dusun sungai utik,Desa Wisata Sungai Utik,Kalimantan Barat
Indah penuh dengan kedamaian,indah penuh kedamaian,indah penuh damai,Desa Wisata Sungai Utik,Kalimantan Barat
"Masyarakatnya ramah, suasana rumah betang yang damai, sungainya jernih",masyarakatnya ramah suasana rumah betang damai sungainya jernih,masyarakat ramah suasana rumah betang damai sungai jernih,Desa Wisata Sungai Utik,Kalimantan Barat
Baru aja liat di YT Kristan Hansen.. keren dan itu rumah yg warna biru tempat anak2 duduk.,yt kristan hansen keren rumah warna biru anak duduk,yt kristan hansen keren rumah warna biru anak duduk,Desa Wisata Sungai Utik,Kalimantan Barat
"Keren
Unik
Budaya
Ramah
Indah
Hijau
Ingin rasanya pergi kesana apalah daya ekonomi ku tidaklah sebaik kalian #INDONESIA 🇲🇨🇲🇨🇲🇨 BEAUTIFUL",keren unik budaya ramah indah hijau pergi kesana apalah daya ekonomi ku indonesia beautiful,keren unik budaya ramah indah hijau pergi kesana apa daya ekonomi ku indonesia beautiful,Desa Wisata Sungai Utik,Kalimantan Barat
Wilayah ekowisata yang bagus,wilayah ekowisata bagus,wilayah ekowisata bagus,Desa Wisata Sungai Utik,Kalimantan Barat
"Jalan yg bagus, pemandangan yg hijau, nyaman di pandang.",jalan bagus pemandangan hijau nyaman pandang,jalan bagus pandang hijau nyaman pandang,Desa Wisata Sungai Utik,Kalimantan Barat
"Luar biasa friendly masyarakat dayak Iban sungai utik dengan rumah panjangnya, banyak ilmu yang didapat dari kearifan lokalnya...",friendly masyarakat dayak iban sungai utik rumah panjangnya ilmu kearifan lokalnya,friendly masyarakat dayak iban sungai utik rumah panjang ilmu arif lokal,Desa Wisata Sungai Utik,Kalimantan Barat
Ini tentang toleransi utk merayakn kemerdekaan RI.,toleransi merayakn kemerdekaan ri,toleransi merayakn merdeka ri,Desa Wisata Sungai Utik,Kalimantan Barat
experience yang luar biasa bisa live in disini,experience live,experience live,Desa Wisata Sungai Utik,Kalimantan Barat
Kampung budaya authentic,kampung budaya authentic,kampung budaya authentic,Desa Wisata Sungai Utik,Kalimantan Barat
"Masyarakat Hutan Adat Iban Menua Sungai Utik, mengelola hutan adat turun temurun secara lestari. Hutan adalah bapak kami, tanah adalah ibu kami, air adalah darah kami. Merupakan filosofi yang dijunjung tinggi oleh mereka. Mari dukung pelestarian hutan adat sungai utik.",masyarakat hutan adat iban menua sungai utik mengelola hutan adat turun temurun lestari hutan tanah air darah filosofi dijunjung tinggi mari dukung pelestarian hutan adat sungai utik,masyarakat hutan adat iban tua sungai utik kelola hutan adat turun turun lestari hutan tanah air darah filosofi junjung tinggi mari dukung lestari hutan adat sungai utik,Desa Wisata Sungai Utik,Kalimantan Barat
tempatnya sangat bagus,tempatnya bagus,tempat bagus,Desa Wisata Sungai Utik,Kalimantan Barat
Keindahan rumah budaya,keindahan rumah budaya,indah rumah budaya,Desa Wisata Sungai Utik,Kalimantan Barat
"Jangan lupa mampir ya ke Langkau Asap, lokasi simpang mupa",lupa mampir langkau asap lokasi simpang mupa,lupa mampir langkau asap lokasi simpang mupa,Desa Wisata Sungai Utik,Kalimantan Barat
Tempat yg asri dan indah dg hutan yg sangat dilindungi dan masyarakat adat yg sangat ramah n welcome banget sama pendatang.budaya yg sangat luar biasa.salut banget sama warganya yg jiwa gotong royongnya msh sangat tinggi,asri indah hutan dilindungi masyarakat adat ramah welcome banget pendatang budaya salut banget warganya jiwa gotong royongnya tinggi,asri indah hutan lindung masyarakat adat ramah welcome banget datang budaya salut banget warga jiwa gotong royong tinggi,Desa Wisata Sungai Utik,Kalimantan Barat
Sungai utik Is The Best,sungai utik is the best,sungai utik is the best,Desa Wisata Sungai Utik,Kalimantan Barat
"Sudah lama tidak pulang kampung halaman, saya jadi rindu",pulang kampung halaman rindu,pulang kampung halaman rindu,Desa Wisata Sungai Utik,Kalimantan Barat
"Tempat yang paling nyaman untuk refresing, warganya ramah-ramah, setiap kali kesini selalu teringat dengan kampung halaman",nyaman refresing warganya ramah ramah kesini kampung halaman,nyaman refresing warga ramah ramah kesini kampung halaman,Desa Wisata Sungai Utik,Kalimantan Barat
"Salam, aku udah lama pengen berangkat ke sini.
Tertarik sama hutan dan sungai yg masih terjaga, sekalian pengen ketemu sama apai janggut.
#sungai_utik
#kapuas_hulu
🙏",pengin berangkat tertarik hutan sungai terjaga pengin ketemu apai janggut sungai utik kapuas hulu,pengin berangkat tarik hutan sungai jaga pengin ketemu apa janggut sungai utik kapuas hulu,Desa Wisata Sungai Utik,Kalimantan Barat
Rumah Betang Asli di kecamatan Embaloh Hulu. Rumah tradisional suku dayak yang masih ditempati hingga kini,rumah betang asli kecamatan embaloh hulu rumah tradisional suku dayak ditempati,rumah betang asli camat embaloh hulu rumah tradisional suku dayak tempat,Desa Wisata Sungai Utik,Kalimantan Barat
Terdapat situs warisan dunia. Ada rumah betang suku Dayak Ivan yg masih memegang teguh budaya sukunya.,situs warisan dunia rumah betang suku dayak ivan memegang teguh budaya sukunya,situs waris dunia rumah betang suku dayak ivan pegang teguh budaya suku,Desa Wisata Sungai Utik,Kalimantan Barat
"Salam budaya
Air jernih dan masyarakat adat yg santun",budaya air jernih masyarakat adat santun,budaya air jernih masyarakat adat santun,Desa Wisata Sungai Utik,Kalimantan Barat
