review,cleaned_review,cleaned_review_stemmed,review_text,rating,author,date,nama desa wisata,provinsi
Butuh perhatian,butuh perhatian,butuh perhati,Butuh perhatian,5,sang Jendral810,2026-04-25T14:26:13.077Z,Desa Wisata Sungai Sekonyer,Kalimantan Tengah
Sebenarnya lokasi bagus cuma kurang perawatan,lokasi bagus perawatan,lokasi bagus awat,Sebenarnya lokasi bagus cuma kurang perawatan,5,ROFIK ROFIK,2026-04-22T06:48:39.046Z,Desa Wisata Sungai Sekonyer,Kalimantan Tengah
Mantp,mantp,mantp,Mantp,1,Amin Bulian,2026-04-19T17:39:06.393Z,Desa Wisata Sungai Sekonyer,Kalimantan Tengah
Seperti kembali ke masa kecil di desa transmigrasi,desa transmigrasi,desa transmigrasi,Seperti kembali ke masa kecil di desa transmigrasi,3,Erni Sujanto,2025-12-27T08:47:59.699Z,Desa Wisata Sungai Sekonyer,Kalimantan Tengah
"Desa wisata, bukan puncak musim liburan jadi agak Kurang terawat..",desa wisata puncak musim liburan terawat,desa wisata puncak musim libur awat,"Desa wisata, bukan puncak musim liburan jadi agak Kurang terawat..",4,ali masruf,2025-10-26T00:57:55.168Z,Desa Wisata Sungai Sekonyer,Kalimantan Tengah
Sangat menyenangkan 😊 dimana bisa melihat orang utan secara langsung dan banyak lagi,menyenangkan dimana utan,senang mana utan,Sangat menyenangkan 😊 dimana bisa melihat orang utan secara langsung dan banyak lagi,5,RATNA SARI,2025-09-09T04:42:53.755Z,Desa Wisata Sungai Sekonyer,Kalimantan Tengah
"Pengalaman yg seru dan menakjubkan. Menyusuri Sungai Sekonyer seperti berada di Amazone, suara hutan dan alam yg menenangkan. Bikin betah",pengalaman seru menakjubkan menyusuri sungai sekonyer amazone suara hutan alam menenangkan bikin betah,alam seru takjub susur sungai sekonyer amazone suara hutan alam tenang bikin betah,"Pengalaman yg seru dan menakjubkan. Menyusuri Sungai Sekonyer seperti berada di Amazone, suara hutan dan alam yg menenangkan. Bikin betah",5,Amalia Hashem,2025-07-18T04:08:05.228Z,Desa Wisata Sungai Sekonyer,Kalimantan Tengah
Bona experiència,bona experi ncia,bona experi ncia,Bona experiència,4,Maurici Ananos,2025-07-18T01:12:49.025Z,Desa Wisata Sungai Sekonyer,Kalimantan Tengah
Sya blm pernah ksni.....pngen seskli nyoba....😁😁,kesini pengin seskli mencoba,kesini pengin seskli coba,Sya blm pernah ksni.....pngen seskli nyoba....😁😁,5,Dhani JR,2024-12-28T16:16:17.829Z,Desa Wisata Sungai Sekonyer,Kalimantan Tengah
Maravilloso,maravilloso,maravilloso,Maravilloso,5,Sandra Santana,2024-08-08T12:26:03.454Z,Desa Wisata Sungai Sekonyer,Kalimantan Tengah
Desa yang asri ditengah2 sungai dan hutan udara yang segar menambah syahdu suasananya,desa asri ditengah sungai hutan udara segar menambah syahdu suasananya,desa asri tengah sungai hutan udara segar tambah syahdu suasana,Desa yang asri ditengah2 sungai dan hutan udara yang segar menambah syahdu suasananya,5,usman maulana Ismail,2024-08-06T13:32:15.649Z,Desa Wisata Sungai Sekonyer,Kalimantan Tengah
Tempat yg asri,asri,asri,Tempat yg asri,5,farid kumala,2024-07-26T14:43:27.640Z,Desa Wisata Sungai Sekonyer,Kalimantan Tengah
Tetap jaga kelestariannya,jaga kelestariannya,jaga lestari,Tetap jaga kelestariannya,5,ajho abel,2024-07-04T05:19:30.810Z,Desa Wisata Sungai Sekonyer,Kalimantan Tengah
Menyenangkan,menyenangkan,senang,Menyenangkan,5,dwiie lone,2024-06-17T03:33:50.419Z,Desa Wisata Sungai Sekonyer,Kalimantan Tengah
"Pengalaman pertama kali one day trip ke tanjung puting,, dan seseru ituuu. .sewa kapal kapasitas 30 orang,berangkat jam 10 pagi dari pelabuhan kumai, perjalanan di atas kapal kurang lebih 2.5 jam,, tiba di perhentian pertama desa wisata sungai sekoyer dan makan siang di atas kapal saat kapal bersandar di desa ini. .",pengalaman one day trip tanjung puting seseru sewa kapal kapasitas berangkat jam pagi pelabuhan kumai perjalanan kapal jam perhentian desa wisata sungai sekoyer makan siang kapal kapal bersandar desa,alam one day trip tanjung puting seru sewa kapal kapasitas berangkat jam pagi labuh kumai jalan kapal jam henti desa wisata sungai sekoyer makan siang kapal kapal sandar desa,"Pengalaman pertama kali one day trip ke tanjung puting,, dan seseru ituuu. .sewa kapal kapasitas 30 orang,berangkat jam 10 pagi dari pelabuhan kumai, perjalanan di atas kapal kurang lebih 2.5 jam,, tiba di perhentian pertama desa wisata sungai sekoyer dan makan siang di atas kapal saat kapal bersandar di desa ini. .",5,wina Pnt,2024-06-02T01:03:35.513Z,Desa Wisata Sungai Sekonyer,Kalimantan Tengah
"Desa Wisata Sungai Sekonyer, terletak di Taman Nasional Tanjung Puting, Kalimantan Tengah, adalah destinasi unik yang menawarkan pengalaman alam dan budaya yang luar biasa. Dikenal sebagai gerbang utama menuju habitat alami orangutan, desa ini menarik banyak wisatawan yang ingin melihat satwa langka dan menikmati keindahan hutan tropis Borneo.

Perjalanan menyusuri Sungai Sekonyer dengan klotok, perahu tradisional, adalah salah satu daya tarik utama. Sepanjang perjalanan, pengunjung dapat melihat orangutan, bekantan, burung eksotis, dan satwa liar lainnya di habitat aslinya. Pemandangan hutan bakau yang rimbun dan air sungai yang tenang menambah kesan mendalam akan keindahan alam yang alami.

Desa Wisata Sungai Sekonyer juga menawarkan interaksi budaya dengan penduduk lokal. Wisatawan dapat belajar tentang kehidupan sehari-hari masyarakat setempat, tradisi, dan kerajinan tangan khas Kalimantan. Pengalaman ini memberikan wawasan tentang cara hidup yang harmonis dengan alam dan memperkaya pemahaman akan budaya lokal.

Fasilitas di desa ini cukup memadai, dengan homestay yang nyaman dan makanan lokal yang lezat. Penduduk desa sangat ramah dan membantu, menciptakan suasana yang hangat dan menyambut bagi para pengunjung.

Secara keseluruhan, Desa Wisata Sungai Sekonyer adalah destinasi yang sempurna bagi pecinta alam dan budaya. Dengan pemandangan yang memukau dan pengalaman interaksi dengan satwa dan masyarakat lokal, desa ini menawarkan petualangan yang tak terlupakan dan mendalam di jantung Borneo Pengalaman yang tidak terlupakan",desa wisata sungai sekonyer terletak taman nasional tanjung puting kalimantan tengah destinasi unik menawarkan pengalaman alam budaya dikenal gerbang utama habitat alami orangutan desa menarik wisatawan satwa langka menikmati keindahan hutan tropis borneo perjalanan menyusuri sungai sekonyer klotok perahu tradisional salah daya tarik utama perjalanan pengunjung orangutan bekantan burung eksotis satwa liar habitat aslinya pemandangan hutan bakau rimbun air sungai tenang menambah kesan mendalam keindahan alam alami desa wisata sungai sekonyer menawarkan interaksi budaya penduduk lokal wisatawan belajar kehidupan sehari masyarakat tradisi kerajinan tangan khas kalimantan pengalaman wawasan hidup harmonis alam memperkaya pemahaman budaya lokal fasilitas desa memadai homestay nyaman makanan lokal lezat penduduk desa ramah membantu menciptakan suasana hangat menyambut pengunjung desa wisata sungai sekonyer destinasi sempurna pecinta alam budaya pemandangan memukau pengalaman interaksi satwa masyarakat lokal desa menawarkan petualangan terlupakan mendalam jantung borneo pengalaman terlupakan,desa wisata sungai sekonyer letak taman nasional tanjung puting kalimantan tengah destinasi unik tawar alam alam budaya kenal gerbang utama habitat alami orangutan desa tarik wisatawan satwa langka nikmat indah hutan tropis borneo jalan susur sungai sekonyer klotok perahu tradisional salah daya tarik utama jalan unjung orangutan bekantan burung eksotis satwa liar habitat asli pandang hutan bakau rimbun air sungai tenang tambah kesan dalam indah alam alami desa wisata sungai sekonyer tawar interaksi budaya duduk lokal wisatawan ajar hidup hari masyarakat tradisi rajin tangan khas kalimantan alam wawas hidup harmonis alam kaya paham budaya lokal fasilitas desa pada homestay nyaman makan lokal lezat duduk desa ramah bantu cipta suasana hangat sambut unjung desa wisata sungai sekonyer destinasi sempurna cinta alam budaya pandang pukau alam interaksi satwa masyarakat lokal desa tawar tualang lupa dalam jantung borneo alam lupa,"Desa Wisata Sungai Sekonyer, terletak di Taman Nasional Tanjung Puting, Kalimantan Tengah, adalah destinasi unik yang menawarkan pengalaman alam dan budaya yang luar biasa. Dikenal sebagai gerbang utama menuju habitat alami orangutan, desa ini menarik banyak wisatawan yang ingin melihat satwa langka dan menikmati keindahan hutan tropis Borneo.

Perjalanan menyusuri Sungai Sekonyer dengan klotok, perahu tradisional, adalah salah satu daya tarik utama. Sepanjang perjalanan, pengunjung dapat melihat orangutan, bekantan, burung eksotis, dan satwa liar lainnya di habitat aslinya. Pemandangan hutan bakau yang rimbun dan air sungai yang tenang menambah kesan mendalam akan keindahan alam yang alami.

Desa Wisata Sungai Sekonyer juga menawarkan interaksi budaya dengan penduduk lokal. Wisatawan dapat belajar tentang kehidupan sehari-hari masyarakat setempat, tradisi, dan kerajinan tangan khas Kalimantan. Pengalaman ini memberikan wawasan tentang cara hidup yang harmonis dengan alam dan memperkaya pemahaman akan budaya lokal.

Fasilitas di desa ini cukup memadai, dengan homestay yang nyaman dan makanan lokal yang lezat. Penduduk desa sangat ramah dan membantu, menciptakan suasana yang hangat dan menyambut bagi para pengunjung.

Secara keseluruhan, Desa Wisata Sungai Sekonyer adalah destinasi yang sempurna bagi pecinta alam dan budaya. Dengan pemandangan yang memukau dan pengalaman interaksi dengan satwa dan masyarakat lokal, desa ini menawarkan petualangan yang tak terlupakan dan mendalam di jantung Borneo Pengalaman yang tidak terlupakan",5,Akhmad Fajar,2024-05-16T14:31:30.566Z,Desa Wisata Sungai Sekonyer,Kalimantan Tengah
saya salah satu dari desa itu saya tinggal di RT 4 jadi di situ tempat para makluk hutan pernah ada orang hutan sampai di RT kita karena ingin mencari makan saya berasal dari desa sungai bedaun kabupaten kota waringin barat di sana banyak turis yang berkunjung,salah desa tinggal rt situ makluk hutan hutan rt mencari makan berasal desa sungai bedaun kabupaten kota waringin barat turis berkunjung,salah desa tinggal rt situ makluk hutan hutan rt cari makan asal desa sungai bedaun kabupaten kota waringin barat turis kunjung,saya salah satu dari desa itu saya tinggal di RT 4 jadi di situ tempat para makluk hutan pernah ada orang hutan sampai di RT kita karena ingin mencari makan saya berasal dari desa sungai bedaun kabupaten kota waringin barat di sana banyak turis yang berkunjung,5,Alfi celluler,2024-03-18T17:43:36.054Z,Desa Wisata Sungai Sekonyer,Kalimantan Tengah
Tempat singgah sebentar sebelum lanjut jalan lagi ke kamp kamp penangkaran Orangutan di Tanjung Puting. Dan di dermaga sini juga menjadi tempat bermalam bagi klotok-klotok yang membawa pengunjung ke Taman Nasional Tanjung Puting menyusuri sungai Sekonyer.,singgah sebentar jalan kamp kamp penangkaran orangutan tanjung puting dermaga bermalam klotok klotok membawa pengunjung taman nasional tanjung puting menyusuri sungai sekonyer,singgah sebentar jalan kamp kamp tangkar orangutan tanjung puting dermaga malam klotok klotok bawa unjung taman nasional tanjung puting susur sungai sekonyer,Tempat singgah sebentar sebelum lanjut jalan lagi ke kamp kamp penangkaran Orangutan di Tanjung Puting. Dan di dermaga sini juga menjadi tempat bermalam bagi klotok-klotok yang membawa pengunjung ke Taman Nasional Tanjung Puting menyusuri sungai Sekonyer.,4,rizky hermawan,2024-01-07T01:24:17.643Z,Desa Wisata Sungai Sekonyer,Kalimantan Tengah
"Desa sekonyer, adalah salah satu desa yang berdekatan dengan taman nasional tanjung puting. Desa yang masih kental dengan adatbudaya jaman dulu.",desa sekonyer salah desa berdekatan taman nasional tanjung puting desa kental adatbudaya jaman,desa sekonyer salah desa dekat taman nasional tanjung puting desa kental adatbudaya jaman,"Desa sekonyer, adalah salah satu desa yang berdekatan dengan taman nasional tanjung puting. Desa yang masih kental dengan adatbudaya jaman dulu.",5,Darista “Darista”,2023-12-24T09:08:31.194Z,Desa Wisata Sungai Sekonyer,Kalimantan Tengah
Tempat healing yang menyenangkan,healing menyenangkan,healing senang,Tempat healing yang menyenangkan,5,Amelinda Rosidah Kusuma Rini,2023-12-19T04:06:46.756Z,Desa Wisata Sungai Sekonyer,Kalimantan Tengah
Desaku kelahiranku,desaku kelahiranku,desa lahir,Desaku kelahiranku,5,Dea Dea kasih wulan dari,2023-11-10T09:15:29.863Z,Desa Wisata Sungai Sekonyer,Kalimantan Tengah
Okay,okay,okay,Okay,3,Yam Hiong,2023-09-04T14:33:38.843Z,Desa Wisata Sungai Sekonyer,Kalimantan Tengah
"Bisa sebagai tempat persinggahan para wisatawan asal bisa mengelola dengan baik. SDM perlu banyak pembinaan untuk meningkatkan pengetahuan dan ketrampilan. Semoga kedepannya lebih maju dan lebih baik lagi.
Semangat 💪🏽💪🏽💪🏽",persinggahan wisatawan mengelola sdm pembinaan meningkatkan pengetahuan ketrampilan semoga kedepannya maju semangat,singgah wisatawan kelola sdm bina tingkat tahu ketrampilan moga depan maju semangat,"Bisa sebagai tempat persinggahan para wisatawan asal bisa mengelola dengan baik. SDM perlu banyak pembinaan untuk meningkatkan pengetahuan dan ketrampilan. Semoga kedepannya lebih maju dan lebih baik lagi.
Semangat 💪🏽💪🏽💪🏽",4,Endro Budi,2023-08-04T13:53:29.671Z,Desa Wisata Sungai Sekonyer,Kalimantan Tengah
Está bien,est bien,est bien,Está bien,4,Ruben García Ruiz,2023-07-08T01:13:32.812Z,Desa Wisata Sungai Sekonyer,Kalimantan Tengah
Pelestarian orang hutan dan banyak dikunjungi wisatawan asing dan lokal,pelestarian hutan dikunjungi wisatawan asing lokal,lestari hutan kunjung wisatawan asing lokal,Pelestarian orang hutan dan banyak dikunjungi wisatawan asing dan lokal,5,Najib 71,2023-07-03T03:12:09.325Z,Desa Wisata Sungai Sekonyer,Kalimantan Tengah
Semoga desaku menjadi lebih maju lagi Aamiin,semoga desaku maju amin,moga desa maju amin,Semoga desaku menjadi lebih maju lagi Aamiin,5,Fitriya ayu,2023-06-14T09:27:59.948Z,Desa Wisata Sungai Sekonyer,Kalimantan Tengah
Desa sisi sungai dalam zona penyanggah Taman Nasional Tanjung Puting,desa sisi sungai zona penyanggah taman nasional tanjung puting,desa sisi sungai zona sanggah taman nasional tanjung puting,Desa sisi sungai dalam zona penyanggah Taman Nasional Tanjung Puting,5,fairlee surya,2023-03-16T22:33:12.798Z,Desa Wisata Sungai Sekonyer,Kalimantan Tengah
Einzigartig...,einzigartig,einzigartig,Einzigartig...,5,Ronny Haselbeck,2023-02-04T06:15:25.541Z,Desa Wisata Sungai Sekonyer,Kalimantan Tengah
Desa wisata yg masih alami,desa wisata alami,desa wisata alami,Desa wisata yg masih alami,5,jon ttg,2022-10-08T23:20:56.583Z,Desa Wisata Sungai Sekonyer,Kalimantan Tengah
Menambah wawasan dan tantangan yang sangat indah di dalam kawasan taman nasional tanjung puting,menambah wawasan tantangan indah kawasan taman nasional tanjung puting,tambah wawas tantang indah kawasan taman nasional tanjung puting,Menambah wawasan dan tantangan yang sangat indah di dalam kawasan taman nasional tanjung puting,1,Abu Bornean,2022-10-08T01:38:31.778Z,Desa Wisata Sungai Sekonyer,Kalimantan Tengah
Riverside live,riverside live,riverside live,Riverside live,4,Yuliza Yusuf,2022-05-18T04:22:17.485Z,Desa Wisata Sungai Sekonyer,Kalimantan Tengah
Semoga akses jalan darat kedepannya jauh lebih baik..,semoga akses jalan darat kedepannya,moga akses jalan darat depan,Semoga akses jalan darat kedepannya jauh lebih baik..,5,Angin biru,2022-03-02T06:38:48.391Z,Desa Wisata Sungai Sekonyer,Kalimantan Tengah
"Tempat yg tenang.
Masyarakat yg ramah.",tenang masyarakat ramah,tenang masyarakat ramah,"Tempat yg tenang.
Masyarakat yg ramah.",5,Wahyu Rahman,2021-12-18T10:01:22.905Z,Desa Wisata Sungai Sekonyer,Kalimantan Tengah
Desa wisataku yg indah,desa wisataku indah,desa wisata indah,Desa wisataku yg indah,4,Yadi Rimu,2021-10-18T14:48:12.137Z,Desa Wisata Sungai Sekonyer,Kalimantan Tengah
