review,cleaned_review,cleaned_review_stemmed,nama desa wisata,provinsi
"Disini saya ikut Shooting Film bareng masyarakat di Gampong Nusa, mereka ramah-ramah sekali, kalau di ajak shooting juga pada happy semua. Terimakasih Warga Gampong Nusa",shooting film bareng masyarakat gampong nusa ramah ramah ajak shooting happy terimakasih warga gampong nusa,shooting film bareng masyarakat gampong nusa ramah ramah ajak shooting happy terimakasih warga gampong nusa,Gampong Nusa,Aceh
Gampong nusa kecamatan Lhoknga,gampong nusa kecamatan lhoknga,gampong nusa camat lhoknga,Gampong Nusa,Aceh
"tempat bersih di perkampungan dengan view sawah dan gunung,cocok untuk bersantai dengan keluarga",bersih perkampungan view sawah gunung cocok bersantai keluarga,bersih kampung view sawah gunung cocok santa keluarga,Gampong Nusa,Aceh
Nusa Indah...,nusa indah,nusa indah,Gampong Nusa,Aceh
Ok lah,ok,ok,Gampong Nusa,Aceh
Viewnya akan more amazing kalau datang kesini lagi musim padi di sawah 🍃,viewnya more amazing kesini musim padi sawah,viewnya more amazing kesini musim padi sawah,Gampong Nusa,Aceh
"Desa nya sangat indah, pemandangan nya luar biasa. Serta masyarakat nya ramah2 sama pengunjung. Thx desa nusa",desa indah pemandangan masyarakat ramah pengunjung thx desa nusa,desa indah pandang masyarakat ramah unjung thx desa nusa,Gampong Nusa,Aceh
Ini tempat yang cocok untuk berimajinasi dan bagus untuk berlibur,cocok berimajinasi bagus berlibur,cocok imajinasi bagus libur,Gampong Nusa,Aceh
"Cocok bagi yg ingin wisata tradisional, ada home stay, murah, tdk jauh dari kota",cocok wisata tradisional home stay murah kota,cocok wisata tradisional home stay murah kota,Gampong Nusa,Aceh
"Tempatnya adem, damai dan bersih",tempatnya adem damai bersih,tempat adem damai bersih,Gampong Nusa,Aceh
"Desa yang indah dengan pemandangan alam pegunungan hijau tinggi menjulang, areal persawahan hijau, sungai yg mengalir dan masyarakat yang ramah. Anda bisa mengadakan family gatering dengan berkemah, bermain disungai, berfoto di spot spot indah yg baanyak ada didesa Nusa. Anda juga bisa menginap di home stay yg ada disediakan didesa ini yg dikelola oleh kelompok masyarakat desa Nusa. Selamat menikmati liburan ataau petualangan didesa ini...",desa indah pemandangan alam pegunungan hijau tinggi menjulang areal persawahan hijau sungai mengalir masyarakat ramah mengadakan family gatering berkemah bermain disungai berfoto spot spot indah baanyak didesa nusa menginap home stay disediakan didesa dikelola kelompok masyarakat desa nusa selamat menikmati liburan ataau petualangan didesa,desa indah pandang alam gunung hijau tinggi julang areal sawah hijau sungai alir masyarakat ramah ada family gatering kemah main sungai foto spot spot indah baanyak desa nusa inap home stay sedia desa kelola kelompok masyarakat desa nusa selamat nikmat libur ataau tualang desa,Gampong Nusa,Aceh
Kampung wisata Nusa,kampung wisata nusa,kampung wisata nusa,Gampong Nusa,Aceh
Destinasi utk mengenang kedahsyatan tsunami 26 desember 2004 yang melanda Aceh dan beberapa negara lain menelan korban ratusan ribu orang.,destinasi mengenang kedahsyatan tsunami desember melanda aceh negara menelan korban ratusan ribu,destinasi kenang dahsyat tsunami desember landa aceh negara tel korban ratus ribu,Gampong Nusa,Aceh
Best,best,best,Gampong Nusa,Aceh
"Saya bangga melihat keindahan alam Gampong Nusa, Lhoknga,Aceh Besar, tempatnya begitu indah dan selalu terawat dengan rapi..saya selalu terkesan Gampong Nusa yang merupakan tempat ayahku dan Abangnya yg pernah menetap hingga kami sampai sa'at ini terjalin silaturahmi yang kuat dengan keluarga tempat ayahku tinggal",bangga keindahan alam gampong nusa lhoknga aceh tempatnya indah terawat rapi terkesan gampong nusa ayahku abangnya menetap sa at terjalin silaturahmi kuat keluarga ayahku tinggal,bangga indah alam gampong nusa lhoknga aceh tempat indah awat rapi kes gampong nusa ayah abang tetap sa at jalin silaturahmi kuat keluarga ayah tinggal,Gampong Nusa,Aceh
"Bagus, pengelola juga ramah... Aceh keren..👍",bagus pengelola ramah aceh keren,bagus kelola ramah aceh keren,Gampong Nusa,Aceh
Great village life,great village life,great village life,Gampong Nusa,Aceh
Alam nya indah,alam indah,alam indah,Gampong Nusa,Aceh
"Kampung hijau, bersih, udara sejuk dan bagus untuk berita keluarga.",kampung hijau bersih udara sejuk bagus berita keluarga,kampung hijau bersih udara sejuk bagus berita keluarga,Gampong Nusa,Aceh
Amazing,amazing,amazing,Gampong Nusa,Aceh
"Desa wisata yg diinisiasi oleh masyarakatnya.. tdk hanya ""menjual"" pemandangan namun juga local wisdom dan budaya2 Aceh termasuk makanannya (kuliner Aceh). Mrk juga punya homestay, kesenian local oleh anak2 muda, handycraft dr recycle sampah, punya event tahunan (Nusa Festival) dan lain-lain... (foto2 menyusul yaa hehehe)",desa wisata diinisiasi masyarakatnya menjual pemandangan local wisdom budaya aceh makanannya kuliner aceh homestay kesenian local anak muda handycraft recycle sampah event tahunan nusa festival foto menyusul hehehe,desa wisata inisiasi masyarakat jual pandang local wisdom budaya aceh makan kuliner aceh homestay seni local anak muda handycraft recycle sampah event tahun nusa festival foto susul hehehe,Gampong Nusa,Aceh
"Desa Wisata Terbaik Nasional 2021
#aceh",desa wisata terbaik nasional aceh,desa wisata baik nasional aceh,Gampong Nusa,Aceh
Asri dan nyaman.,asri nyaman,asri nyaman,Gampong Nusa,Aceh
Mantap,mantap,mantap,Gampong Nusa,Aceh
Sangat mempesona,mempesona,pesona,Gampong Nusa,Aceh
"Bagus, ada klip lagu di sana ...",bagus klip lagu,bagus klip lagu,Gampong Nusa,Aceh
"Masyarakatnya sangat ramah, tempat belajar mengelola desa wisata",masyarakatnya ramah belajar mengelola desa wisata,masyarakat ramah ajar kelola desa wisata,Gampong Nusa,Aceh
Alami dan perlu dibenahi sarana dan prasarana utk menunjang giat pariwisata,alami dibenahi sarana prasarana menunjang giat pariwisata,alami benah sarana prasarana tunjang giat pariwisata,Gampong Nusa,Aceh
Gampong wisata dengan keramahan penduduknya.,gampong wisata keramahan penduduknya,gampong wisata ramah duduk,Gampong Nusa,Aceh
"Desa Wisata Terbaik tahun ini untuk Provinsi Aceh.

Suasanyanya sejuk, segar, dan bersih. Keramahan warganya luar biasa. Memiliki program wisata tentatif yang sangat menarik, memgutamakan potensi budaya Aceh dan kolaborasi antar warga.

Semoga kedepan Desa ini semakin baik, menemukan potensi-potensi lainnya dari desa, sehingga menjadi magnet wisatawan saat berkunjung ke Aceh.",desa wisata terbaik tahun provinsi aceh suasanyanya sejuk segar bersih keramahan warganya memiliki program wisata tentatif menarik memgutamakan potensi budaya aceh kolaborasi warga semoga kedepan desa menemukan potensi potensi desa magnet wisatawan berkunjung aceh,desa wisata baik tahun provinsi aceh suasanyanya sejuk segar bersih ramah warga milik program wisata tentatif tarik memgutamakan potensi budaya aceh kolaborasi warga moga depan desa temu potensi potensi desa magnet wisatawan kunjung aceh,Gampong Nusa,Aceh
memiliki pemandangan yang indah,memiliki pemandangan indah,milik pandang indah,Gampong Nusa,Aceh
Yg penasaran kunjungi aja🤭,penasaran kunjungi,penasaran kunjung,Gampong Nusa,Aceh
Sangat rekomendasi untuk dikunjungi,rekomendasi dikunjungi,rekomendasi kunjung,Gampong Nusa,Aceh
"Desa wisata ini menyediakan berbagai paket wisata yang dapat dinikmati oleh anda bersama rekan dan keluarga.

Tersedia 43 homestay yang dapat anda tempati bersama rombongan. Dimana anda dapat menikmati berlibur sambil mempelajari kebiasaan dan kearifan lokal yang ada di desa wisata ini.

Selamat berkunjung dan nikmati keramahan warga desa ini dengan segenap keunikan yang tidak anda dapatkan di destinasi wisata lainnya.",desa wisata menyediakan paket wisata dinikmati rekan keluarga tersedia homestay tempati rombongan dimana menikmati berlibur mempelajari kebiasaan kearifan lokal desa wisata selamat berkunjung nikmati keramahan warga desa segenap keunikan dapatkan destinasi wisata,desa wisata sedia paket wisata nikmat rekan keluarga sedia homestay tempat rombong mana nikmat libur ajar biasa arif lokal desa wisata selamat kunjung nikmat ramah warga desa segenap uni dapat destinasi wisata,Gampong Nusa,Aceh
lebih alami..,alami,alami,Gampong Nusa,Aceh
"Langit biru, pegunungan nan hijau. Rumpit ilalang menguning. Air sungai mengalir jernih",langit biru pegunungan nan hijau rumpit ilalang menguning air sungai mengalir jernih,langit biru gunung nan hijau rumpit ilalang kuning air sungai alir jernih,Gampong Nusa,Aceh
"Gampong yang tertata dengan baik, bersih, dan asri. Ada spot terbaru yang disiapkan. Untuk masuk kesini, pengunjung cukup membayar 5ribu saja. Ada guest house juga yang disediakan bagi yang ingin staycation. Keripik oen temurui sebagai salah satu pilihan cemilan khas disini.",gampong tertata bersih asri spot terbaru disiapkan kesini pengunjung membayar ribu guest house disediakan staycation keripik oen temurui salah pilihan cemilan khas,gampong tata bersih asri spot baru siap kesini unjung bayar ribu guest house sedia staycation keripik oen temurui salah pilih cemilan khas,Gampong Nusa,Aceh
Lokasi Desanya masih alami & asri,lokasi desanya alami asri,lokasi desa alami asri,Gampong Nusa,Aceh
"Tempat Wisata yang Worth Its banget !!!!
Rugi kalau jalan-jalan ke Banda Aceh atau Aceh Besar tapi gak singgah ke Gampong Nusa. Gampong Nusa kian mendunia. Hmm,  banyak wisatawan yang mengunjungi wisata ini. Dan yang paling utama, tempat ini bukan tempat wisata biasa.  Tapi banyak nilai-nilai Kebudayaan Aceh yang masih dilestarikan disini. Jangan Lupa Mampir :')",wisata worth its banget rugi jalan jalan banda aceh aceh singgah gampong nusa gampong nusa kian mendunia hmm wisatawan mengunjungi wisata utama wisata nilai nilai kebudayaan aceh dilestarikan lupa mampir,wisata worth its banget rugi jalan jalan banda aceh aceh singgah gampong nusa gampong nusa kian dunia hmm wisatawan unjung wisata utama wisata nilai nilai budaya aceh lestari lupa mampir,Gampong Nusa,Aceh
Desa yang menjadi bahan percontohan untuk desa lain,desa bahan percontohan desa,desa bahan contoh desa,Gampong Nusa,Aceh
"Desa Wisata yang dibangun dari nol sejak delapan tahun silam, yang tidak ada apa-apanya kini mulai mendapat nama di masyarakat, khususnya wisatawan baik lokal dan mancanegara. Ada apa saja di Gampong Nusa ini? Sebaiknya datang dan nikmati sendiri akan lebih terasa 😁",desa wisata dibangun nol delapan tahun silam apanya nama masyarakat wisatawan lokal mancanegara gampong nusa nikmati,desa wisata bangun nol delapan tahun silam apa nama masyarakat wisatawan lokal mancanegara gampong nusa nikmat,Gampong Nusa,Aceh
Gampong droe,gampong droe,gampong droe,Gampong Nusa,Aceh
"Masyarakat nya ramah
Kulinernya khas aceh bgt
Luar biasa untul desa wisata ini",masyarakat ramah kulinernya khas aceh banget untul desa wisata,masyarakat ramah kuliner khas aceh banget untul desa wisata,Gampong Nusa,Aceh
Kampong Top buat dikunjung,kampong top dikunjung,kampong top kunjung,Gampong Nusa,Aceh
Oke,oke,oke,Gampong Nusa,Aceh
Gampong percontohan,gampong percontohan,gampong contoh,Gampong Nusa,Aceh
Nice,nice,nice,Gampong Nusa,Aceh
Nice place,nice place,nice place,Gampong Nusa,Aceh
good,good,good,Gampong Nusa,Aceh
