review,cleaned_review,cleaned_review_stemmed,nama desa wisata,provinsi
Sudah tutup permanen,tutup permanen,tutup permanen,Kampung Ketupat,Kalimantan Selatan
Perlu ditata lagi agar menjadi daya tarik wisatawan,ditata daya tarik wisatawan,tata daya tarik wisatawan,Kampung Ketupat,Kalimantan Selatan
"Kira-kira karena harga masuk ke area bayar dan lumanyan mahal, jadinya sepi ini tempat. Padahal tempat wisata untuk rakyat (tapi bayar) 🤔
Semoga saja Pemerintah Daerah bisa benar-benar bisa diperbaiki dibagian mananya ini !! gar kiranya tempat wisata rakyat bisa ramaipberkunjung dan rakyat benar-benar puas dengan tempat tersebut. Merdeka Banjarmasin Bungas 💪🫡🇮🇩",harga area bayar lumanyan mahal sepi wisata rakyat bayar semoga pemerintah daerah diperbaiki dibagian mananya gar wisata rakyat ramaipberkunjung rakyat puas merdeka banjarmasin bungas,harga area bayar lumanyan mahal sepi wisata rakyat bayar moga perintah daerah baik bagi mana gar wisata rakyat ramaipberkunjung rakyat puas merdeka banjarmasin bungas,Kampung Ketupat,Kalimantan Selatan
Tempat bersantai di kota Banjarmasin dengan pemandangan sungai,bersantai kota banjarmasin pemandangan sungai,santa kota banjarmasin pandang sungai,Kampung Ketupat,Kalimantan Selatan
Seperti foodcourt makanannbisa dibeli di stan makanan,foodcourt makanannbisa dibeli stan makanan,foodcourt makanannbisa beli stan makan,Kampung Ketupat,Kalimantan Selatan
Underrated tempat nya,underrated,underrated,Kampung Ketupat,Kalimantan Selatan
lumayan,lumayan,lumayan,Kampung Ketupat,Kalimantan Selatan
Sunyi tanpa pengunjung. Yg jualan cuma sedikit. Suasana nyaman  bersih dan rindang,sunyi pengunjung jualan suasana nyaman bersih rindang,sunyi unjung jual suasana nyaman bersih rindang,Kampung Ketupat,Kalimantan Selatan
"Kampung Ketupat di Sungai Baru, Banjarmasin Tengah, awalnya dikenal sebagai sentra produksi ketupat harian oleh warga setempat. Kawasan ini kemudian dikembangkan menjadi destinasi wisata tematik yang mengusung konsep budaya dan kuliner khas Banjar. Dilengkapi dengan fasilitas seperti amfiteater, stan makanan, dan spot foto, tempat ini sempat ramai dikunjungi.

Namun, kawasan ini mengalami penurunan aktivitas karena pengelolaan yang buruk, termasuk masalah pembayaran pegawai dan kurangnya perawatan fasilitas. Hal ini menyebabkan area tersebut terbengkalai dan rawan disalahgunakan. Pada awal 2025, pemerintah kota mencoba menghidupkan kembali Kampung Ketupat dengan manajemen baru dan menghadirkan berbagai kuliner lokal tanpa memungut biaya masuk, sebagai upaya revitalisasi kawasan budaya dan ekonomi masyarakat sekitar.",kampung ketupat sungai banjarmasin tengah dikenal sentra produksi ketupat harian warga kawasan dikembangkan destinasi wisata tematik mengusung konsep budaya kuliner khas banjar dilengkapi fasilitas amfiteater stan makanan spot foto ramai dikunjungi kawasan mengalami penurunan aktivitas pengelolaan buruk pembayaran pegawai kurangnya perawatan fasilitas menyebabkan area terbengkalai rawan disalahgunakan pemerintah kota mencoba menghidupkan kampung ketupat manajemen menghadirkan kuliner lokal memungut biaya upaya revitalisasi kawasan budaya ekonomi masyarakat,kampung ketupat sungai banjarmasin tengah kenal sentra produksi ketupat hari warga kawasan kembang destinasi wisata tematik usung konsep budaya kuliner khas banjar lengkap fasilitas amfiteater stan makan spot foto ramai kunjung kawasan alami turun aktivitas kelola buruk bayar pegawai kurang awat fasilitas sebab area bengkalai rawan disalahgunakan perintah kota coba hidup kampung ketupat manajemen hadir kuliner lokal mungut biaya upaya revitalisasi kawasan budaya ekonomi masyarakat,Kampung Ketupat,Kalimantan Selatan
infonya menarik,infonya menarik,info tarik,Kampung Ketupat,Kalimantan Selatan
"Biasa saja, gak ada yg special.. dilarang bawa makanan dari luar untuk dimakan di situ, bakal dimarahin sama salah satu ibu2 penjual makanan...",special dilarang bawa makanan dimakan situ dimarahi salah penjual makanan,special larang bawa makan makan situ marah salah jual makan,Kampung Ketupat,Kalimantan Selatan
Tenant jajanan nya banyak,tenant jajanan,tenant jajan,Kampung Ketupat,Kalimantan Selatan
"Parkir luas, bersih, aman, nyaman.",parkir luas bersih aman nyaman,parkir luas bersih aman nyaman,Kampung Ketupat,Kalimantan Selatan
"Singgah dikampung ketupat, ternyata yang dicari ketupat kandangan tidak ada, suasana enak di pinggir sungai , makanan lengkap",singgah dikampung ketupat dicari ketupat kandangan suasana pinggir sungai makanan lengkap,singgah kampung ketupat cari ketupat kandang suasana pinggir sungai makan lengkap,Kampung Ketupat,Kalimantan Selatan
Tempat nya blum selesai direnovasi. Tapi masuk nya gratis kok dan bnyak berbagai macam menu makanan dan minuman. Tidak terlalu ramai sih mungkin krna baru dibuka lgi jdi bnyk yg blum tau.,selesai direnovasi gratis menu makanan minuman ramai dibuka tau,selesai renovasi gratis menu makan minum ramai buka tau,Kampung Ketupat,Kalimantan Selatan
"Suasana cukup menyenangkan dan ramai pengunjung saat sore weekend. Ada sejumlah tenan makan/minum, harganya relatif terjangkau.. juga snack, aksesoris dan jajanan oleh2. Faktor kebersihan perlu lebih diperhatikan pihak pengelola, terutama di lokasi gazebo dan teater panggung.",suasana menyenangkan ramai pengunjung sore weekend tenan makan minum harganya relatif terjangkau snack aksesoris jajanan faktor kebersihan diperhatikan pengelola lokasi gazebo teater panggung,suasana senang ramai unjung sore weekend tenan makan minum harga relatif jangkau snack aksesoris jajan faktor bersih perhati kelola lokasi gazebo teater panggung,Kampung Ketupat,Kalimantan Selatan
"Tempat nyaman buat ajak keluarga bersantai di sini.
Masuk ke sini gratis dan bisa cari tempat duduk yang sudah di sediakan tanpa harus membayarnya.... Bisa pesan makanan di tempat2 yang sudah di sediakan..",nyaman ajak keluarga bersantai gratis cari duduk sediakan membayarnya pesan makanan sediakan,nyaman ajak keluarga santa gratis cari duduk sedia bayar pesan makan sedia,Kampung Ketupat,Kalimantan Selatan
"Masuk free, banyak stand makanan yg terjangkau, toilet ada. Parkir berbayar.",free stand makanan terjangkau toilet parkir berbayar,free stand makan jangkau toilet parkir bayar,Kampung Ketupat,Kalimantan Selatan
Bagus harus di  bersihkan dan di perbaiki,bagus bersihkan perbaiki,bagus sih baik,Kampung Ketupat,Kalimantan Selatan
Energinya dominan negative..perlu diselamati😄,energinya dominan negative diselamati,energi dominan negative selamat,Kampung Ketupat,Kalimantan Selatan
"Baguss,,",bagus,bagus,Kampung Ketupat,Kalimantan Selatan
"Keren sih tempatnya. Tp klo hrs byr 20k per orang saat weekend, kyknya agak kemahalan yaa. Bayangin misal ada keluarga dgn3 orang anak mau santai malam mingguan hrs ngrogoh kocek 100 ribu buat masuknya aja. Belum buat makan dan minumnya.  Saya aja kesini pas ada event masuk gratis. Pakai syarat follow IG dan koment dipostingannya.

Jam buka 10-22. Tapi paa kesana jam 10 lewat, baru 1 atau 2 aja yg buka. Trs yg jaga loket juga gak tau kalau ada promo gratis masuk.

Alhamdulillah, pas berkeliling keliling lokasi lumayan menyenangkan. Semoga bisa terus dirawat. Pengen banget sebenarnya, kesana pas malam hari. Kyknya bakalan semakin keren krn banyak lampu hiasan z.",keren tempatnya kalo byr kak weekend kayaknya kemahalan bayangkan keluarga anak santai malam mingguan ngrogoh kocek ribu masuknya makan minumnya kesini pas event gratis pakai syarat follow ig komentar dipostingannya jam buka paa kesana jam buka jaga loket tau promo gratis alhamdulillah pas berkeliling keliling lokasi lumayan menyenangkan semoga dirawat pengin banget kesana pas malam kayaknya keren lampu hiasan,keren tempat kalo byr kak weekend kayak mahal bayang keluarga anak santai malam minggu ngrogoh kocek ribu masuk makan minum kesini pas event gratis pakai syarat follow ig komentar dipostingannya jam buka paa kesana jam buka jaga loket tau promo gratis alhamdulillah pas keliling keliling lokasi lumayan senang moga rawat pengin banget kesana pas malam kayak keren lampu hias,Kampung Ketupat,Kalimantan Selatan
Viw nya cantik tp agak sepi. Gabisa bawa makanan dari luar. Jadi kalo mau punya acara ultah kecil2 an kayaknya gabisa deh. Padahal di dalem makanan nya ga rekomendet bgt,viw cantik sepi bawa makanan kalo acara ultah an kayaknya dalem makanan rekomendet banget,viw cantik sepi bawa makan kalo acara ultah an kayak dalem makan rekomendet banget,Kampung Ketupat,Kalimantan Selatan
Salah satu tempat wisata di Banjarmasin,salah wisata banjarmasin,salah wisata banjarmasin,Kampung Ketupat,Kalimantan Selatan
Banyak pembuat ketupat di sini,pembuat ketupat,buat ketupat,Kampung Ketupat,Kalimantan Selatan
Bagus,bagus,bagus,Kampung Ketupat,Kalimantan Selatan
"Tmptnya lumayan bgus tuk fto""..sntai""..ga blh bwa mknn dn mnumn hrus bli ddlm area..tiket cm 5rb per org..tuk mknn mnumn ckup mrogoh kocek..trllu mhal..biar rame pngunjung hrga mknn mnumn tlong disesuaikn ajalh",tmptnya lumayan bagus foto sntai bwa mknn mnumn beli area tiket ribu mknn mnumn mrogoh kocek trllu mhal biar rame pngunjung hrga mknn mnumn tlong disesuaikn ajalh,tmptnya lumayan bagus foto sntai bwa mknn mnumn beli area tiket ribu mknn mnumn mrogoh kocek trllu mhal biar rame pngunjung hrga mknn mnumn tlong disesuaikn ajalh,Kampung Ketupat,Kalimantan Selatan
"Kesini biaya masuk kemaren cuma Rp. 5.000, anak di bawah 5 tahun gratis.

Tempatnya ikonik, bersih, ada jual makanan juga, spot foto bagus.

Mungkin bisa ditingkatkan lagi soal perawatan rumput-rumput liarnya.",kesini biaya kemarin rp anak tahun gratis tempatnya ikonik bersih jual makanan spot foto bagus ditingkatkan perawatan rumput rumput liarnya,kesini biaya kemarin rp anak tahun gratis tempat ikonik bersih jual makan spot foto bagus tingkat awat rumput rumput liar,Kampung Ketupat,Kalimantan Selatan
"Gak pernah msk k sini, cuman makan bakaran aja di warung seberang jalan 🤭",kak cuman makan bakaran warung seberang jalan,kak cuman makan bakar warung seberang jalan,Kampung Ketupat,Kalimantan Selatan
Biasa saja tidak ada yang menarik,menarik,tarik,Kampung Ketupat,Kalimantan Selatan
"tempatnya bagus, adem, cuman mulai dtumbuhi bnyak rumput, harus d bersihkan secara berkala",tempatnya bagus adem cuman dtumbuhi rumput bersihkan berkala,tempat bagus adem cuman dtumbuhi rumput sih kala,Kampung Ketupat,Kalimantan Selatan
"Sangat mnyenangkan berkunjung dikampung ketupat , lingkungan bersih dan enak untuk nongkrong bersama keluarga🫶🏻🥰",mnyenangkan berkunjung dikampung ketupat lingkungan bersih nongkrong keluarga,mnyenangkan kunjung kampung ketupat lingkung bersih nongkrong keluarga,Kampung Ketupat,Kalimantan Selatan
Tambahin lagi arena bermain mya Biar Tidak sia sia tempat bermain dan Hiburanya,tambahkan arena bermain mya biar sia sia bermain hiburanya,tambah arena main mya biar sia sia main hiburanya,Kampung Ketupat,Kalimantan Selatan
harga masuk terjangkau dengan voucher 5.000 dan pemandangannya juga indah💗💗💗💗💗,harga terjangkau voucher pemandangannya indah,harga jangkau voucher pandang indah,Kampung Ketupat,Kalimantan Selatan
"Tempat bagus nyaman juga, hanya saja di WC tidak ada cermin dan juga tidak bisa membawa makanan luar ke dalam. Tapi makanan yang di jual di dalam juga sudah banyak dan enak.",bagus nyaman wc cermin membawa makanan makanan jual,bagus nyaman wc cermin bawa makan makan jual,Kampung Ketupat,Kalimantan Selatan
"Tempatnya cukup nyaman, banyak tempat untuk berteduh dan santai. Cocok jika datang bersama keluarga besar, atau bisa dijadikan sebagai referensi tempat wisata untuk memperkenalkan budaya Banjar.",tempatnya nyaman berteduh santai cocok keluarga dijadikan referensi wisata memperkenalkan budaya banjar,tempat nyaman teduh santai cocok keluarga jadi referensi wisata kenal budaya banjar,Kampung Ketupat,Kalimantan Selatan
Sekarang harganya lebih murah cuma 5 rb bisa nongkrong cantik dikampung ketupat. Makanan dan minuman nya enak2 semua. Oke lah,harganya murah ribu nongkrong cantik dikampung ketupat makanan minuman oke,harga murah ribu nongkrong cantik kampung ketupat makan minum oke,Kampung Ketupat,Kalimantan Selatan
tempatnya bagus bgt! cocok buat nyantai dan harga tiketnya sudah murah cuma 5.000 ajaa mulai bulan oktober ini. terus makanan dan minumannya enak2 semua dengan harga yang ramah di kantong 😃. dan di bagian amfiteater bisa di gunakan untuk acara2 besar dan untuk pemakaian tempat nya tidak di kenakan biayaa atau gratiss gais!!! syaratnya cuma beli makanan dan minuman di kampung ketupat 😍,tempatnya bagus banget cocok nyantai harga tiketnya murah oktober makanan minumannya harga ramah kantong amfiteater acara pemakaian kenakan biayaa gratis gais syaratnya beli makanan minuman kampung ketupat,tempat bagus banget cocok nyantai harga tiket murah oktober makan minum harga ramah kantong amfiteater acara pakai kena biayaa gratis gais syarat beli makan minum kampung ketupat,Kampung Ketupat,Kalimantan Selatan
ini tempat sangat baguuus  untuk spots poto bagus bangeet dan sekarang sudah murah kaliii masuk nya cumaa 5K aja lu,bagus spots poto bagus banget murah cumaa kak lu,bagus spots poto bagus banget murah cumaa kak lu,Kampung Ketupat,Kalimantan Selatan
"Tempatnya sangat cocok untuk Quality Time dan harga tiketnya sangat terjangkau cuma Rp5000 aja sekarang, belum lagi makanan dan minuman nya enak enak, Pokoknya okee buat di jadiin daftar pilihan wisata di Banjarmasin",tempatnya cocok quality time harga tiketnya terjangkau rp makanan minuman pokoknya okee jadikan daftar pilihan wisata banjarmasin,tempat cocok quality time harga tiket jangkau rp makan minum pokok okee jadi daftar pilih wisata banjarmasin,Kampung Ketupat,Kalimantan Selatan
"Tempat nya bagus, instagramable banget buat foto² dan harga tiket nya worth it bgt buat pelajar dan mahasiswa",bagus instagramable banget foto harga tiket worth banget pelajar mahasiswa,bagus instagramable banget foto harga tiket worth banget ajar mahasiswa,Kampung Ketupat,Kalimantan Selatan
overall sdh bagus..,overall bagus,overall bagus,Kampung Ketupat,Kalimantan Selatan
Sangat memuaskan dan juga adanya penampilan di sana memperindah suasana tempat tersebut,memuaskan penampilan memperindah suasana,muas tampil indah suasana,Kampung Ketupat,Kalimantan Selatan
Salah satu Destinasi wisata unggulan kita Banjarmasin,salah destinasi wisata unggulan banjarmasin,salah destinasi wisata unggul banjarmasin,Kampung Ketupat,Kalimantan Selatan
"Salah satu pilihan baru buat nongkrong di Banjarmasin. Nama tempatnya sih Kampung Ketupat, tapi jangan cari ketupat ya di sana 😀
Tempat ini adalah pujasera dengan konsep outdoor, yang letaknya di tepi sungai, di tengah kota, tepatnya di samping jembatan arah ke Pal 1. Tempatnya masih baru, bersih, dan apik. Banyak macam2 kedai makanan, sayangnya tidak seluruhnya buka saat kesana, weekday sepulang kerja. Masuknya bayar ya ini, htm nya @10rb rupiah, yang tiketnya bisa ditukar dengan segelas es teh.",salah pilihan nongkrong banjarmasin nama tempatnya kampung ketupat cari ketupat pujasera konsep outdoor letaknya tepi sungai tengah kota tepatnya samping jembatan arah pal tempatnya bersih apik kedai makanan sayangnya buka kesana weekday sepulang masuknya bayar htm rupiah tiketnya ditukar segelas es teh,salah pilih nongkrong banjarmasin nama tempat kampung ketupat cari ketupat pujasera konsep outdoor letak tepi sungai tengah kota tepat samping jembatan arah pal tempat bersih apik kedai makan sayang buka kesana weekday pulang masuk bayar htm rupiah tiket tukar gelas es teh,Kampung Ketupat,Kalimantan Selatan
Bagus buat santai sambil memandang sungai,bagus santai memandang sungai,bagus santai pandang sungai,Kampung Ketupat,Kalimantan Selatan
Lumayan,lumayan,lumayan,Kampung Ketupat,Kalimantan Selatan
"Tempatnya bagus, banyak spot foto, banyak tempat untuk bersantai, ada pesawatan, dll. Mungkin yg jadi pertimbangan banyak orang yaitu harga tiketnya. Saya sabtu kemarin kesini 20rb, struknya bisa ditukar minuman free (saya dapat teh es), kalo soal makan disana saya belum pernah karena ngiranya disana ada jual  ketupat kandangan wkwk.",tempatnya bagus spot foto bersantai pesawatan dll pertimbangan harga tiketnya sabtu kemarin kesini ribu struknya ditukar minuman free teh es kalo makan disana ngiranya disana jual ketupat kandangan wkwk,tempat bagus spot foto santa pesawat dll timbang harga tiket sabtu kemarin kesini ribu struknya tukar minum free teh es kalo makan sana ngiranya sana jual ketupat kandang wkwk,Kampung Ketupat,Kalimantan Selatan
Tempat baru sepertinya datang saat malam toko makanannya sdh byk yg tutup.,malam toko makanannya tutup,malam toko makan tutup,Kampung Ketupat,Kalimantan Selatan
Masih banyak yang belum termanfaatkan view ny...mungkin kl malam lebih asik..,termanfaatkan view malam asik,manfaat view malam asik,Kampung Ketupat,Kalimantan Selatan
"Bersih, instgramable, banyak makanan, sejuk,",bersih instgramable makanan sejuk,bersih instgramable makan sejuk,Kampung Ketupat,Kalimantan Selatan
"Masuk bayar 20rb-25rb mahal banget, gak mau sih saya karna dari luar terlihat biasa aja, masuk aja bayar nya mahal belum lagi beli makanan didalam, orang orang bakalan mikir 2x sih kalau kesini",bayar ribu ribu mahal banget bayar mahal beli makanan didalam mikir kesini,bayar ribu ribu mahal banget bayar mahal beli makan dalam mikir kesini,Kampung Ketupat,Kalimantan Selatan
"Kalau boleh kasih saran, harga hari kerja atau hari libur 5k an hja insya allah rami tu, jadi org kwa jajan di tempat tanpa kepikiran harga masuk yg agak mahal, amun bnyk pengunjungnya jdi lakas ja mutar duitnya🤗 dan untuk harga makannya sedang hja sih",kasih saran harga libur kak an hja insya allah rami kwa jajan kepikiran harga mahal amun pengunjungnya lakas mutar duitnya harga makannya hja,kasih saran harga libur kak an hja insya allah rami kwa jajan pikir harga mahal amun unjung lakas mutar duit harga makan hja,Kampung Ketupat,Kalimantan Selatan
"Untuk tempatnya cukup bagus dan asri jika ingin mendapatkan nuansa yg cukup tenang di wilayah perkotaan, banyak spot"" foto yg bagus, tapi sayangnya untuk tiket masuk dengan Harga 20k/orang cukup mahal.",tempatnya bagus asri nuansa tenang wilayah perkotaan spot foto bagus sayangnya tiket harga kak mahal,tempat bagus asri nuansa tenang wilayah kota spot foto bagus sayang tiket harga kak mahal,Kampung Ketupat,Kalimantan Selatan
"Tempatnya bagus, semoga makin dikembangkan lagi. Dan semoga tiket masuknya bisa lebih murah lagi.",tempatnya bagus semoga dikembangkan semoga tiket masuknya murah,tempat bagus moga kembang moga tiket masuk murah,Kampung Ketupat,Kalimantan Selatan
Tiketnya terhitung mahal,tiketnya terhitung mahal,tiket hitung mahal,Kampung Ketupat,Kalimantan Selatan
"Agak kaget aja ketika masuk sama keluarga bayar Rp 86.000 be4.
Saya rasa pasti banyak yg jera dan tidak datang lagi.",kaget keluarga bayar rp be jera,kaget keluarga bayar rp be jera,Kampung Ketupat,Kalimantan Selatan
Sepi,sepi,sepi,Kampung Ketupat,Kalimantan Selatan
tempat nya enak sejuk adem dan lingkungan nya bersih dan desain bangunan nya sangat bagus,sejuk adem lingkungan bersih desain bangunan bagus,sejuk adem lingkung bersih desain bangun bagus,Kampung Ketupat,Kalimantan Selatan
Tempatnya instagramable dan makanannya enak  murahhh...,tempatnya instagramable makanannya murah,tempat instagramable makan murah,Kampung Ketupat,Kalimantan Selatan
"Sebagai tempat wisata baru sudah cukup bagus, untuk sarannya agar tempat duduknya saja yang hanya perlu di tambah",wisata bagus sarannya duduknya,wisata bagus saran duduk,Kampung Ketupat,Kalimantan Selatan
"Mudahan awet, biayanya dinaikana lagi kalo bisa wkwk
biar gak kayak tempat2 lainnya yg rame nya cuma diawal, mungkin karena murah bahkan gratis kali ya",mudahan awet biayanya dinaikana kalo wkwk biar kayak rame diawal murah gratis,mudah awet biaya dinaikana kalo wkwk biar kayak rame awal murah gratis,Kampung Ketupat,Kalimantan Selatan
Harga tiket agak mahal,harga tiket mahal,harga tiket mahal,Kampung Ketupat,Kalimantan Selatan
"Terlalu mahal tiket masuknya, 20rb/org di weekend,
biasa aja buat foto².
Dengan harga tiket masuk segitu TDK sebanding dgn wahananya yg biasa aja.
Daripada kepuhunan jar...
Kalau tiket hari biasa 5rb, dan weekend 10rb masih ok lah.",mahal tiket masuknya ribu weekend foto harga tiket segitu sebanding wahananya kepuhunan jar tiket ribu weekend ribu ok,mahal tiket masuk ribu weekend foto harga tiket segitu banding wahana kepuhunan jar tiket ribu weekend ribu ok,Kampung Ketupat,Kalimantan Selatan
Alhmadulillah ksampaian.. jauh² mulai sampit,alhmadulillah ksampaian sampit,alhmadulillah ksampaian sampit,Kampung Ketupat,Kalimantan Selatan
"Bagus, konsepnya keren serba bambu, agak mahal ya kalo weeken k sini sama keluarga, lumayan tiket masuk 1 org 20k, blm jajannya lo, tapi kebersihannya kereen semoga tetep selalu bersih",bagus konsepnya keren serba bambu mahal kalo weeken kak keluarga lumayan tiket kak jajannya lo kebersihannya keren semoga bersih,bagus konsep keren serba bambu mahal kalo weeken kak keluarga lumayan tiket kak jajan lo bersih keren moga bersih,Kampung Ketupat,Kalimantan Selatan
Teduh.. Syahdu.. Merindu..,teduh syahdu merindu,teduh syahdu rindu,Kampung Ketupat,Kalimantan Selatan
Menikmati kuliner sambil denger suara burung yg indah di bawah teduhnya pohon Kampung Ketupat,menikmati kuliner dengar suara burung indah teduhnya pohon kampung ketupat,nikmat kuliner dengar suara burung indah teduh pohon kampung ketupat,Kampung Ketupat,Kalimantan Selatan
"Wisata untuk ikon kampung ketupat cukup bagus,  bersih dengan harga tiket 20rb perorang (Senin Sampai Jumat) 25rb(Sabtu-Minggu) + free minuman, untuk parkir sdh E-Parkir dgn tarif Motor 3rb dan mobil 5rb ,tapi wisata ini menurut saya terlalu mahal untuk tempat wisata yg cuma untuk tempat ""foto2"" dan untuk nongkrong terkesan belum siap untuk menjadi tempat wisata Ikon Kampung Ketupat. Semoga kedepannya harga tiket masuk di revisi atau fasilitas direvisi kembali",wisata ikon kampung ketupat bagus bersih harga tiket ribu perorang senin jumat ribu sabtu minggu free minuman parkir parkir tarif motor ribu mobil ribu wisata mahal wisata foto nongkrong terkesan wisata ikon kampung ketupat semoga kedepannya harga tiket revisi fasilitas direvisi,wisata ikon kampung ketupat bagus bersih harga tiket ribu orang senin jumat ribu sabtu minggu free minum parkir parkir tarif motor ribu mobil ribu wisata mahal wisata foto nongkrong kes wisata ikon kampung ketupat moga depan harga tiket revisi fasilitas revisi,Kampung Ketupat,Kalimantan Selatan
"Kampung katupat ,siring banjarmasin",kampung katupat siring banjarmasin,kampung katupat siring banjarmasin,Kampung Ketupat,Kalimantan Selatan
"Masuk ke wisata ini tempat parkirnya lumayan luas, untuk tiket masuk bayar di loket ( bayar parkir juga termasuk jd nanti di parkiran tidak perlu bayar lg)
Kampung ketupat ini di dominasi bangunan yg terbuat dari bambu/ paring, lokasinya jg tidak jauh dari siring
Disini ada tersedia stand2 untuk memesan makanan, dri tiket yg kita dapat bisa ditukarkan dengan sebotol air mineral
Tp sepertinya tempat untuk kita duduk yg agak kurang, krn areanya luas jd kadang capek jg berkeliling, banyak spot untuk berfoto juga
Anda sebaiknya menyiapkan uang pas untuk bayar makanan di stannya, atau gak bahar pakai Qris lewat DANA atau brimo kalo gak mau susah
Wc nya juga tersedia, dengan dipisah yg cwo atau cwe",wisata parkirnya lumayan luas tiket bayar loket bayar parkir parkiran bayar kampung ketupat dominasi bangunan terbuat bambu paring lokasinya siring tersedia stand memesan makanan tiket ditukarkan sebotol air mineral duduk areanya luas kadang capek berkeliling spot berfoto uang pas bayar makanan stannya bahar pakai qris dana brimo kalo susah wc tersedia dipisah cowok cewek,wisata parkir lumayan luas tiket bayar loket bayar parkir parkir bayar kampung ketupat dominasi bangun buat bambu paring lokasi siring sedia stand mes makan tiket tukar botol air mineral duduk area luas kadang capek keliling spot foto uang pas bayar makan stan bahar pakai qris dana brimo kalo susah wc sedia pisah cowok cewek,Kampung Ketupat,Kalimantan Selatan
Lokasinya baik..cocok buat sore nyantai bersama orang terkasih dan keluarga..,lokasinya cocok sore nyantai terkasih keluarga,lokasi cocok sore nyantai kasih keluarga,Kampung Ketupat,Kalimantan Selatan
enak buat santai dan foto²,santai foto,santai foto,Kampung Ketupat,Kalimantan Selatan
Tempatnya lumayan bagus harga tiket masuk cukup mahal,tempatnya lumayan bagus harga tiket mahal,tempat lumayan bagus harga tiket mahal,Kampung Ketupat,Kalimantan Selatan
"kasih bintang 3 dulu🙏🏼

Tempat nya bagus dan banyak bejualan makanan, tapi sayang HTM nya kemahalan 🙈
semoga ada kebijakan untuk menurunkan HTM",kasih bagus bejualan makanan sayang htm kemahalan semoga kebijakan menurunkan htm,kasih bagus bejualan makan sayang htm mahal moga bijak turun htm,Kampung Ketupat,Kalimantan Selatan
"Tempatnya tidak begitu luas, dan harga tiket masuk cukup mahal ( 25rb per org dihari jumat-minggu.  Senin-kamis 20rb ) . Parkir bayar  motor 3rb, parkir mobil 5rb.",tempatnya luas harga tiket mahal ribu dihari jumat minggu senin kamis ribu parkir bayar motor ribu parkir mobil ribu,tempat luas harga tiket mahal ribu hari jumat minggu senin kamis ribu parkir bayar motor ribu parkir mobil ribu,Kampung Ketupat,Kalimantan Selatan
