review,cleaned_review,cleaned_review_stemmed,nama desa wisata,provinsi
"FUN, PLAY and LEARN

Lumayan luas areal mangrove di Kampung Terih, Nongsa.
🔰
Yuk belajar sambil wisata diakhir pekan. Kamu jg bisa cobain sensasi mendayung perahu mengitari pantainya. Jgn takut, karena tersedia life jacket untuk safety kamu. Suka makan kepiting? Pas banget, order sekalian minta dimasakin sesuai selera. Asyik kan...
〰〰〰〰〰〰〰〰〰〰〰〰〰〰〰〰〰
Endi dah 2X main kemari. Gak pernah bosen, sampai petang, malah pingin datang lagi & lagi.
🔜
Kamu kapan?",fun play and learn lumayan luas areal mangrove kampung terih nongsa yuk belajar wisata diakhir pekan coba sensasi mendayung perahu mengitari pantainya takut tersedia life jacket safety suka makan kepiting pas banget order dimasakin sesuai selera asyik endi main kemari bosan petang pengin,fun play and learn lumayan luas areal mangrove kampung terih nongsa yuk ajar wisata akhir pekan coba sensasi dayung perahu kitar pantai takut sedia life jacket safety suka makan kepiting pas banget order dimasakin sesuai selera asyik endi main kemari bosan petang pengin,Kampung Terih,Kepulauan Riau
Tempat yang asri dan gratis masuk,asri gratis,asri gratis,Kampung Terih,Kepulauan Riau
Damai dan dekat dgn laut,damai laut,damai laut,Kampung Terih,Kepulauan Riau
Seafoodnya Mantul...,seafoodnya mantul,seafoodnya mantul,Kampung Terih,Kepulauan Riau
Debest,debest,debest,Kampung Terih,Kepulauan Riau
Makanan seafoodnya cukup enak. lebih di tata lagi lebih rapi agar lebih banyak yang datang.,makanan seafoodnya tata rapi,makan seafoodnya tata rapi,Kampung Terih,Kepulauan Riau
Lumayan bagus,lumayan bagus,lumayan bagus,Kampung Terih,Kepulauan Riau
Beautyfull sunset,beautyfull sunset,beautyfull sunset,Kampung Terih,Kepulauan Riau
Gak Usah Jauh2 dr Batu Besar,batu,batu,Kampung Terih,Kepulauan Riau
"Pantai tersebut sangat cocok banget untuk berhibur, jalan-jalan dan lain-lain",pantai cocok banget berhibur jalan jalan,pantai cocok banget hibur jalan jalan,Kampung Terih,Kepulauan Riau
Nice destination..ada tempat sarapannya,nice destination sarapannya,nice destination sarap,Kampung Terih,Kepulauan Riau
Nyaman,nyaman,nyaman,Kampung Terih,Kepulauan Riau
"Wisata mangrove terbaik, ada paintball dan kuliner nyaa mantul banget, jgn lupa ada ketam makbiah di sini gaesss",wisata mangrove terbaik paintball kuliner mantul banget lupa ketam makbiah gaesss,wisata mangrove baik paintball kuliner mantul banget lupa ketam makbiah gaesss,Kampung Terih,Kepulauan Riau
Cocok buat santai berkeluarga . Ada tmpat penangkaran penyu jg ada tempat ber main air soft gun .,cocok santai berkeluarga tmpat penangkaran penyu ber main air soft gun,cocok santai keluarga tmpat tangkar penyu ber main air soft gun,Kampung Terih,Kepulauan Riau
"Kampung wisata yang sangat Alami, disana kita dapat merasakan keseharian hidup sebagai nelayan, menyusuri hutan manggrove yg masih alami, dan menikmati lezatnya Masakan khas Melayu yg berasal dari tangkapan laut nelayan kampung terih 🤠😍",kampung wisata alami disana merasakan keseharian hidup nelayan menyusuri hutan manggrove alami menikmati lezatnya masakan khas melayu berasal tangkapan laut nelayan kampung terih,kampung wisata alami sana rasa hari hidup nelayan susur hutan manggrove alami nikmat lezat masakan khas melayu asal tangkap laut nelayan kampung terih,Kampung Terih,Kepulauan Riau
"Loaokasinya sangat asri, kampungnya bersih, viewnya bagus, warganya ramah",loaokasinya asri kampungnya bersih viewnya bagus warganya ramah,loaokasinya asri kampung bersih viewnya bagus warga ramah,Kampung Terih,Kepulauan Riau
Perfect place,perfect place,perfect place,Kampung Terih,Kepulauan Riau
"Sore yang indah , penduduk yang ramah , juga tersedia rajungan. 👌",sore indah penduduk ramah tersedia rajungan,sore indah duduk ramah sedia rajungan,Kampung Terih,Kepulauan Riau
Kecantikan kampung tua,kecantikan kampung tua,cantik kampung tua,Kampung Terih,Kepulauan Riau
Good view,good view,good view,Kampung Terih,Kepulauan Riau
"Gak banyak pilihan makanan, sebaiknya bawa bekal, spot2 kurang menunjang dan fasilitas umum/toilet yg kurang bersih",pilihan makanan bawa bekal spot menunjang fasilitas umum toilet bersih,pilih makan bawa bekal spot tunjang fasilitas umum toilet bersih,Kampung Terih,Kepulauan Riau
Kampung nan asri dan sejuk udara nya,kampung nan asri sejuk udara,kampung nan asri sejuk udara,Kampung Terih,Kepulauan Riau
"Panoramanya luas, sudah dikelola jyga jadi rapi,",panoramanya luas dikelola jyga rapi,panorama luas kelola jyga rapi,Kampung Terih,Kepulauan Riau
