review,cleaned_review,cleaned_review_stemmed,nama desa wisata,provinsi
View lumayan bagus dan restoran seafood nya harga terjangkau,view lumayan bagus restoran seafood harga terjangkau,view lumayan bagus restoran seafood harga jangkau,Kampung Terih,Kepulauan Riau
"Cantik banget pas sore! Cocok buat foto-foto sambil lihat sunset,
gue juga main di RAJAWIN ternyata dapet untung

langsung aja buka googe RAJAWIN, gampang.
RAJAWIN * * *",cantik banget pas sore cocok foto foto sunset gue main rajawin untung buka googe rajawin gampang rajawin,cantik banget pas sore cocok foto foto sunset gue main rajawin untung buka googe rajawin gampang rajawin,Kampung Terih,Kepulauan Riau
Mantapp,mantap,mantap,Kampung Terih,Kepulauan Riau
Kampung yg hidden gem 😍,kampung hidden gem,kampung hidden gem,Kampung Terih,Kepulauan Riau
"Tempat ini cocok dikunjungi,selain kuliner seafood disini juga ada tempat bermain paintball",cocok dikunjungi kuliner seafood bermain paintball,cocok kunjung kuliner seafood main paintball,Kampung Terih,Kepulauan Riau
Seafood enak harga merakyat,seafood harga merakyat,seafood harga rakyat,Kampung Terih,Kepulauan Riau
Mantap,mantap,mantap,Kampung Terih,Kepulauan Riau
Makanan seafood enak,makanan seafood,makan seafood,Kampung Terih,Kepulauan Riau
"Ada tempat makan seafood enak, ada coffeshop kekinian dan punya view mantap , bagusnya kesini sore hari",makan seafood coffeshop kekinian view mantap bagusnya kesini sore,makan seafood coffeshop kini view mantap bagus kesini sore,Kampung Terih,Kepulauan Riau
Ga diragukan lagi lah kalo kesini. Semuanya the best,diragukan kalo kesini the best,ragu kalo kesini the best,Kampung Terih,Kepulauan Riau
Tempat yang bagus untuk wisata air dan adventure di wilayah Batam,bagus wisata air adventure wilayah batam,bagus wisata air adventure wilayah batam,Kampung Terih,Kepulauan Riau
Tempat makan sea food enak di lidah,makan sea food lidah,makan sea food lidah,Kampung Terih,Kepulauan Riau
"Suasana tenang,ada caffe dan permainan paintball,ada beberapa rumah makan seafood diatas laut,cocok buat yg tidak suka tempat yang tidak terlalu ramai.akses jalan bagus,melewati area pemakaman.",suasana tenang caffe permainan paintball rumah makan seafood diatas laut cocok suka ramai akses jalan bagus melewati area pemakaman,suasana tenang caffe main paintball rumah makan seafood atas laut cocok suka ramai akses jalan bagus lewat area makam,Kampung Terih,Kepulauan Riau
Lumayan bagus veewnya...,lumayan bagus veewnya,lumayan bagus veewnya,Kampung Terih,Kepulauan Riau
Desa yg bersih...,desa bersih,desa bersih,Kampung Terih,Kepulauan Riau
Beughhh,beughhh,beughhh,Kampung Terih,Kepulauan Riau
Masuknya gratis.  Sayang kurang dirawat. Padahal punya potensi yang cukuo bagus sebagai destinasi wisata kuliner.,masuknya gratis sayang dirawat potensi cukuo bagus destinasi wisata kuliner,masuk gratis sayang rawat potensi cukuo bagus destinasi wisata kuliner,Kampung Terih,Kepulauan Riau
Pemandangnya bagus,pemandangnya bagus,pandang bagus,Kampung Terih,Kepulauan Riau
"Kota Batam memiliki  beberapa destinasi wisata yang menarik wisatawan mancanegara maupun domestik, Kota Batam dinilai sebagai penyumbang wisatawan peringkat kedua setelah Bali. Kawasan Nongsa merupakan bagian dari kecamatan Nongsa yang dalam rencana tata ruang wilayah pembangunan Pulau Batam, ditetapkan peruntukkannya bagi pengembangan wisata. Kawasan Nongsa saat ini telah dikembangkan secara terbatas sebagai kawasan wisata/ resort dengan daya tarik wisata pantai dan lapangan golf. Pengembangan Desa Wisata Kampung Terih, Kelurahan Sambau, Kecamatan Nongsa, Kota Batam merupakan upaya memberikan alternatif tujuan wisata di Kawasan Nongsa. Pengembangan desa wisata dapat memberikan manfaat ekonomi dan pendapatan bagi masyarakat desa, serta meningkatkan partisipasi masyarakat dalam pembangunan desa.  Desa Wisata Kampung Terih memiliki peluang cukup besar untuk meningkatkan kesejahteraan masyarakat setempat. Potensi alam, budaya, dan masyarakat setempat dapat dimanfaatkan untuk mengembangkan berbagai produk dan jasa wisata yang menarik bagi wisatawan.
Desa yang lolos masuk ke 300 besar desa wisata pada nominasi Anugerah Desa Wisata (ADWI) tahun 2022 yang diselenggarakan oleh Kementrian Pariwisata dan Ekonomi Kreatif (Kemenparekraf), yang ternyata  pada tahun 2021 masuk ke 100 besar. Bahkan pada tahun 2018, Desa ini menyabet Juara 1 Anugerah Pesona Indonesia kategori Tujuan Wisata Baru terpopuler. Desa ini bernama Kampung Terih. Dan pada 10 Desember 2017 predikat Desa Wisata untuk Kampung Terih resmi diluncurkan.",kota batam memiliki destinasi wisata menarik wisatawan mancanegara domestik kota batam dinilai penyumbang wisatawan peringkat bali kawasan nongsa kecamatan nongsa rencana tata ruang wilayah pembangunan pulau batam ditetapkan peruntukkannya pengembangan wisata kawasan nongsa dikembangkan terbatas kawasan wisata resort daya tarik wisata pantai lapangan golf pengembangan desa wisata kampung terih kelurahan sambau kecamatan nongsa kota batam upaya alternatif tujuan wisata kawasan nongsa pengembangan desa wisata manfaat ekonomi pendapatan masyarakat desa meningkatkan partisipasi masyarakat pembangunan desa desa wisata kampung terih memiliki peluang meningkatkan kesejahteraan masyarakat potensi alam budaya masyarakat dimanfaatkan mengembangkan produk jasa wisata menarik wisatawan desa lolos desa wisata nominasi anugerah desa wisata adwi tahun diselenggarakan kementrian pariwisata ekonomi kreatif kemenparekraf tahun tahun desa menyabet juara anugerah pesona indonesia kategori tujuan wisata terpopuler desa bernama kampung terih desember predikat desa wisata kampung terih resmi diluncurkan,kota batam milik destinasi wisata tarik wisatawan mancanegara domestik kota batam nilai sumbang wisatawan peringkat bal kawasan nongsa camat nongsa rencana tata ruang wilayah bangun pulau batam tetap untuk kembang wisata kawasan nongsa kembang batas kawasan wisata resort daya tarik wisata pantai lapang golf kembang desa wisata kampung terih lurah sambau camat nongsa kota batam upaya alternatif tuju wisata kawasan nongsa kembang desa wisata manfaat ekonomi dapat masyarakat desa tingkat partisipasi masyarakat bangun desa desa wisata kampung terih milik peluang tingkat sejahtera masyarakat potensi alam budaya masyarakat manfaat kembang produk jasa wisata tarik wisatawan desa lolos desa wisata nominasi anugerah desa wisata adwi tahun selenggara tri pariwisata ekonomi kreatif kemenparekraf tahun tahun desa sabet juara anugerah pesona indonesia kategori tuju wisata populer desa nama kampung terih desember predikat desa wisata kampung terih resmi luncur,Kampung Terih,Kepulauan Riau
"Salah satu kampung tua di Batam. Tidak terlalu luas, tapi merupakan salah satu sudut terbaik menikmati cakrawala kota Batam.",salah kampung tua batam luas salah sudut terbaik menikmati cakrawala kota batam,salah kampung tua batam luas salah sudut baik nikmat cakrawala kota batam,Kampung Terih,Kepulauan Riau
Makanann disana enak ... Pantai nya asri banget .. recommended,makanann disana pantai asri banget recommended,makanann sana pantai asri banget recommended,Kampung Terih,Kepulauan Riau
Kurang menarik,menarik,tarik,Kampung Terih,Kepulauan Riau
"Ada beberapa restoran seafood di dekat sini tapi yang biasa kami datangi Resto Seafood Anak Nelayan karena tempatnya enak di tepi laut, harganya bersahabat, rasa masakannya enak (rekomen gonggong sama ikan asam pedas) terus juga beberapa kali minta antar ke rumah kelong tengah lautnya buat mancing seharian (bayar 60k sudah diantar jemput). Benar-benar mantap buat healing 👍💛",restoran seafood datangi resto seafood anak nelayan tempatnya tepi laut harganya bersahabat masakannya rekomen gonggong ikan asam pedas rumah kelong tengah lautnya mancing seharian bayar kak diantar jemput mantap healing,restoran seafood datang resto seafood anak nelayan tempat tepi laut harga sahabat masakan rekomen gonggong ikan asam pedas rumah kelong tengah laut mancing hari bayar kak antar jemput mantap healing,Kampung Terih,Kepulauan Riau
Ada tempat seafood yg enak. Harga terjangkau,seafood harga terjangkau,seafood harga jangkau,Kampung Terih,Kepulauan Riau
Bagus untuk dikunjungi,bagus dikunjungi,bagus kunjung,Kampung Terih,Kepulauan Riau
"Kampung tua di sambau batam, bersih kampungnya, menuju kampung ini melewati perkuburan muslim dan cina",kampung tua sambau batam bersih kampungnya kampung melewati perkuburan muslim cina,kampung tua sambau batam bersih kampung kampung lewat kubur muslim cina,Kampung Terih,Kepulauan Riau
Bagus,bagus,bagus,Kampung Terih,Kepulauan Riau
Pemandangan yang indah,pemandangan indah,pandang indah,Kampung Terih,Kepulauan Riau
"Tempat kurang bersih,,,,dan kurang terawat,,,gk sesuai dengan fhoto.",bersih terawat sesuai foto,bersih awat sesuai foto,Kampung Terih,Kepulauan Riau
"Lumayan tempat bersih,rasa sesuai lidah",lumayan bersih sesuai lidah,lumayan bersih sesuai lidah,Kampung Terih,Kepulauan Riau
bagus,bagus,bagus,Kampung Terih,Kepulauan Riau
Sudah close,close,close,Kampung Terih,Kepulauan Riau
Tempat nya bersih,bersih,bersih,Kampung Terih,Kepulauan Riau
Seafood restoran,seafood restoran,seafood restoran,Kampung Terih,Kepulauan Riau
"Wisata kampung pesisir yg sangat rekomendasi, masakan laut kampung menjadi andalan sembari makan di atas laut dan hembusan angin laut. Berlunjung di sini memajukan perekonomian masyarkat pesisir yg nantinya akan melindungi wilayah pesisir dari perusakan.",wisata kampung pesisir rekomendasi masakan laut kampung andalan sembari makan laut hembusan angin laut berlunjung memajukan perekonomian masyarkat pesisir melindungi wilayah pesisir perusakan,wisata kampung pesisir rekomendasi masakan laut kampung andal sembari makan laut hembus angin laut berlunjung maju ekonomi masyarkat pesisir lindung wilayah pesisir rusa,Kampung Terih,Kepulauan Riau
cocok untuk makan seafood karena ada beberapa resto seafood,cocok makan seafood resto seafood,cocok makan seafood resto seafood,Kampung Terih,Kepulauan Riau
"Tempat wisata kuliner, cocok untuk anda yg budged sedang 2 saja",wisata kuliner cocok budged,wisata kuliner cocok budged,Kampung Terih,Kepulauan Riau
"Lokasi tidak terlalu jauh dr kampung tua Melayu,dengan View laut bisa melihat daerah Batam center",lokasi kampung tua melayu view laut daerah batam center,lokasi kampung tua melayu view laut daerah batam center,Kampung Terih,Kepulauan Riau
"View nya bagus, bersih. Harga juga oke
Sayang jalan masuk nya aja horor, dekt pemakaman",view bagus bersih harga oke sayang jalan horor pemakaman,view bagus bersih harga oke sayang jalan horor makam,Kampung Terih,Kepulauan Riau
Sea food enak,sea food,sea food,Kampung Terih,Kepulauan Riau
"Loved it! Delicious

Serius kalau rasa, boleh lah tempat ini",loved delicious serius,loved delicious serius,Kampung Terih,Kepulauan Riau
Pelayanan mantap,pelayanan mantap,layan mantap,Kampung Terih,Kepulauan Riau
"Desa wisata yang menarik, sudah bolak-balik ke Nongsa puluhan kali tapi baru nemu desa wisata Kampung Terih.",desa wisata menarik bolak nongsa puluhan nemu desa wisata kampung terih,desa wisata tarik bolak nongsa puluh nemu desa wisata kampung terih,Kampung Terih,Kepulauan Riau
"Banyak paku menuju lokasi, harga mehong, rasa standar..",paku lokasi harga mehong standar,paku lokasi harga mehong standar,Kampung Terih,Kepulauan Riau
Mantappp.....,mantap,mantap,Kampung Terih,Kepulauan Riau
"Kampung nelayan yg asri, bersih dan masakannya enak murah meriah",kampung nelayan asri bersih masakannya murah meriah,kampung nelayan asri bersih masakan murah riah,Kampung Terih,Kepulauan Riau
"Kuliner enak murah meriah dengan viewnya yg memanjakan mata, bisa buat wisata kemping",kuliner murah meriah viewnya memanjakan wisata kemping,kuliner murah riah viewnya manja wisata kemping,Kampung Terih,Kepulauan Riau
Lumayan,lumayan,lumayan,Kampung Terih,Kepulauan Riau
"Suasananya bagus, cuma sudah mulai tidak terawat dan kurang pengunjung. Perlu perbaikan sarana pra sarana.",suasananya bagus terawat pengunjung perbaikan sarana pra sarana,suasana bagus awat unjung baik sarana pra sarana,Kampung Terih,Kepulauan Riau
Menyenangkan,menyenangkan,senang,Kampung Terih,Kepulauan Riau
"masakannya enak, rekomendasi untuk bawa keluarga",masakannya rekomendasi bawa keluarga,masakan rekomendasi bawa keluarga,Kampung Terih,Kepulauan Riau
Sedap nya makan di Seafood Makcik,sedap makan seafood makcik,sedap makan seafood makcik,Kampung Terih,Kepulauan Riau
"Tenang, bagus. Makanannya enak dan murah.",tenang bagus makanannya murah,tenang bagus makan murah,Kampung Terih,Kepulauan Riau
Nyaman .dan menunya enak,nyaman menunya,nyaman menu,Kampung Terih,Kepulauan Riau
Cooolss,cooolss,cooolss,Kampung Terih,Kepulauan Riau
"Bagus, seperti pedesaan.. Cm ayamnya tolong dikondisikan, buang kotoran dimana"" soalnya",bagus pedesaan ayamnya tolong dikondisikan buang kotoran dimana,bagus desa ayam tolong kondisi buang kotor mana,Kampung Terih,Kepulauan Riau
Salah satu objek wisata terupdate dan ramai dikunjungi dengan fasilitas terbaik buat nongkrong dan ngobrol sama pasangan maupun wahana hiburan lainnya yg keren.sok langsung aja datang ke desa wisata kampung terih,salah objek wisata terupdate ramai dikunjungi fasilitas terbaik nongkrong mengobrol pasangan wahana hiburan keren sok desa wisata kampung terih,salah objek wisata terupdate ramai kunjung fasilitas baik nongkrong obrol pasang wahana hibur keren sok desa wisata kampung terih,Kampung Terih,Kepulauan Riau
Nothing special here,nothing special here,nothing special here,Kampung Terih,Kepulauan Riau
Kurang sejuk,sejuk,sejuk,Kampung Terih,Kepulauan Riau
Tempat yang indah untuk menikmati Sunset,indah menikmati sunset,indah nikmat sunset,Kampung Terih,Kepulauan Riau
Tempatnya asri nyaman untuk penginjung,tempatnya asri nyaman penginjung,tempat asri nyaman penginjung,Kampung Terih,Kepulauan Riau
"Enak masakan ikannya, ditambah lagi suasana makan di tepi laut. Rugi jika anda tidak coba. Cuma nunggu pesanan sedikit lama",masakan ikannya ditambah suasana makan tepi laut rugi coba menunggu pesanan,masakan ikan tambah suasana makan tepi laut rugi coba tunggu pesan,Kampung Terih,Kepulauan Riau
Tempat makan seafood yg enak dan murah. Seafoodnya fresh. Dan pemandangannya langsung laut. Harganya terjangkau,makan seafood murah seafoodnya fresh pemandangannya laut harganya terjangkau,makan seafood murah seafoodnya fresh pandang laut harga jangkau,Kampung Terih,Kepulauan Riau
"Entah ekspektasi saya terlalu tinggi, atau saya salah lokasi. Namun kesan saya dengan tempat ini adalah zonk. Rekomendasi di youtube dengan apa yang saya temukan di desa ini sangat berbeda, entah salahnya dimana. Altar yang menjorok ke laut yang menjadi daya tarik, seolah kehilangan daya pikatnya, apalagi warga membangun pondok2 rumah makan tepat di samping anjung. Seolah itu adalah jalan menuju pondok, bukan menuju laut. Ditambah kunjungan saya ke lokasi di kala laut surut, sehingga yang saya temukan tidak lebih dari sebidang kolam berlumpur yang mengering.",ekspektasi tinggi salah lokasi kesan zonk rekomendasi youtube temukan desa berbeda salahnya dimana altar menjorok laut daya tarik kehilangan daya pikatnya warga membangun pondok rumah makan samping anjung jalan pondok laut ditambah kunjungan lokasi laut surut temukan sebidang kolam berlumpur mengering,ekspektasi tinggi salah lokasi kesan zonk rekomendasi youtube temu desa beda salah mana altar jorok laut daya tarik hilang daya pikat warga bangun pondok rumah makan samping anjung jalan pondok laut tambah kunjung lokasi laut surut temu bidang kolam lumpur ering,Kampung Terih,Kepulauan Riau
"ada bermacam  wahana disini, tempat makan juga ada",wahana makan,wahana makan,Kampung Terih,Kepulauan Riau
Kulinernya masih ala tradisional melayu dn murah,kulinernya ala tradisional melayu murah,kuliner ala tradisional melayu murah,Kampung Terih,Kepulauan Riau
Paintball,paintball,paintball,Kampung Terih,Kepulauan Riau
"Datanglah sore2, sunsetnya keren",datanglah sore sunsetnya keren,datang sore sunsetnya keren,Kampung Terih,Kepulauan Riau
Makanannya enak harga terjangkau,makanannya harga terjangkau,makan harga jangkau,Kampung Terih,Kepulauan Riau
Wisata Baru ! Nikmati waktu bersantai bersama keluarga,wisata nikmati waktu bersantai keluarga,wisata nikmat waktu santa keluarga,Kampung Terih,Kepulauan Riau
Ok,ok,ok,Kampung Terih,Kepulauan Riau
"Pantainya jenis pantai bakau, tidak ada pasirnya, jadi kalau mau jalan jalan ke pantai yang banyak pepohonan untuk foto foto ini tempat yang bagus, tidak recomended untuk berenang, ada jual sea food yang enak dan murah dan tempatnya diatas pantai",pantainya jenis pantai bakau pasirnya jalan jalan pantai pepohonan foto foto bagus recomended berenang jual sea food murah tempatnya diatas pantai,pantai jenis pantai bakau pasir jalan jalan pantai pohon foto foto bagus recomended renang jual sea food murah tempat atas pantai,Kampung Terih,Kepulauan Riau
Pantainya kecil...ada warung seafood kecil dg saung diatas pantai lumayan murah dan nyaman,pantainya warung seafood saung diatas pantai lumayan murah nyaman,pantai warung seafood saung atas pantai lumayan murah nyaman,Kampung Terih,Kepulauan Riau
"Tempat yg nyaman buat bersantai,bareng teman ataupun keluarga... Rekomended banget pokoknya...",nyaman bersantai bareng teman keluarga rekomended banget pokoknya,nyaman santa bareng teman keluarga rekomended banget pokok,Kampung Terih,Kepulauan Riau
Cukup menghibur....!,menghibur,hibur,Kampung Terih,Kepulauan Riau
"Salah satu tempat wisata yang berada di daerah Nongsa. Kampung terih menawarkan wisata pantai yang dilengkapi fasilitas ""Saung"" makan untuk keluarga dan kerabat.

Suasana pantai.yang menghadirkan cahaya Sunset saat sore hari menambah nilai lebih wisata pantai ini.",salah wisata daerah nongsa kampung terih menawarkan wisata pantai dilengkapi fasilitas saung makan keluarga kerabat suasana pantai menghadirkan cahaya sunset sore menambah nilai wisata pantai,salah wisata daerah nongsa kampung terih tawar wisata pantai lengkap fasilitas saung makan keluarga kerabat suasana pantai hadir cahaya sunset sore tambah nilai wisata pantai,Kampung Terih,Kepulauan Riau
"Tempat makan yang ajiib.... Dikelola masyarakat lokal, salah satunya keluarga Bang Muhsin. Yang original disini ya gonggong dan kepiting nya",makan ajiib dikelola masyarakat lokal salah satunya keluarga bang muhsin original gonggong kepiting,makan ajiib kelola masyarakat lokal salah satu keluarga bang muhsin original gonggong kepiting,Kampung Terih,Kepulauan Riau
Resto kebanyakannya,resto kebanyakannya,resto banyak,Kampung Terih,Kepulauan Riau
"Asri, bersih, nuansa perkampungan melayu. Kalau saya suka datang pagi. Karna udaranya sangan segar.",asri bersih nuansa perkampungan melayu suka pagi udaranya sangan segar,asri bersih nuansa kampung melayu suka pagi udara sangan segar,Kampung Terih,Kepulauan Riau
Indah,indah,indah,Kampung Terih,Kepulauan Riau
Enak kalo mau santai disini. Rekomendasi kalo mau kesini sore hari pas cuaca cerah. Kalian bakalan dpt sunset yang keren,kalo santai rekomendasi kalo kesini sore pas cuaca cerah sunset keren,kalo santai rekomendasi kalo kesini sore pas cuaca cerah sunset keren,Kampung Terih,Kepulauan Riau
"Lokasi indah, tempat mkannya enak",lokasi indah mkannya,lokasi indah mkannya,Kampung Terih,Kepulauan Riau
"Lokasinya sangat bagus tetapi sangat disayangkan, ada beberapa spot2 yg bisa menarik kalangan muda tidak terawat lagi. Mungkin karena kurangnya dana dr pihak pengelola, ditambah lagi dengan pandemi Covid-19 semakin membuat pengunjung sepi dan semakin tidak terawat.
Bagi pencinta seafood, silahkan langsung ke tempat ini ya karena ditempat ini menjajakan beberapa makanan dan masakan laut segar yg lezat dan ramah dikantong.
Saya sangat suka tempat ini dan Saya berencana akan ke tempat ini lagi secepatnya.",lokasinya bagus disayangkan spot menarik kalangan muda terawat kurangnya dana pengelola ditambah pandemi covid pengunjung sepi terawat pencinta seafood silakan ditempat menjajakan makanan masakan laut segar lezat ramah dikantong suka berencana secepatnya,lokasi bagus sayang spot tarik kalang muda awat kurang dana kelola tambah pandemi covid unjung sepi awat cinta seafood sila tempat jaja makan masakan laut segar lezat ramah kantong suka rencana cepat,Kampung Terih,Kepulauan Riau
Pemandangan okelah... Cuma saran buat pondok makan.. Meningkatkan pelayananannya.. Biar pelanggan gk menunggu begitu lama dg penyajian pesanannya..,pemandangan okelah saran pondok makan meningkatkan pelayananannya biar pelanggan menunggu penyajian pesanannya,pandang oke saran pondok makan tingkat pelayananannya biar langgan tunggu saji pesan,Kampung Terih,Kepulauan Riau
"Perawatan tempatnya masih belum maksimal.. Boleh dikata belum dirawat dengan baik. Harga makanannya lumayan murah, tapi kalang kabut, sampai2 beberapa pesanan kami tak kunjung datang hingga kami selesai makan.",perawatan tempatnya maksimal dikata dirawat harga makanannya lumayan murah kalang kabut pesanan kunjung selesai makan,awat tempat maksimal kata rawat harga makan lumayan murah kalang kabut pesan kunjung selesai makan,Kampung Terih,Kepulauan Riau
Suasana alam perkampungan dan nyaman,suasana alam perkampungan nyaman,suasana alam kampung nyaman,Kampung Terih,Kepulauan Riau
"Kurang suka sih, karena airnya keruh",suka airnya keruh,suka air keruh,Kampung Terih,Kepulauan Riau
Masih perlu perawatan dan perbaikan untuk lebih menarik untuk pengunjung,perawatan perbaikan menarik pengunjung,awat baik tarik unjung,Kampung Terih,Kepulauan Riau
"Tempat yg cocok untuk menikmati seafood saat sunset, harga murah, citarasa lokal yg tdk kalah dg kelong, seafood segar krn diambil langsung dr keramba dipinggir laut, dekat dengan mushola👍👍",cocok menikmati seafood sunset harga murah citarasa lokal kalah kelong seafood segar diambil keramba dipinggir laut mushola,cocok nikmat seafood sunset harga murah citarasa lokal kalah kelong seafood segar ambil keramba pinggir laut mushola,Kampung Terih,Kepulauan Riau
"Suka makan kepiting? Pas banget, disini tempatnya. Bener2 fresh/ diolah saat akan disajikan & dari hasil laut sekitar mangrove. Tetap jaga kelestarian lingkungan ya, jangan tebang mangrovenya, agar kepitingnya tetap/ selalu ada & kami pasti datang lagi (Insya Allah)",suka makan kepiting pas banget tempatnya fresh diolah disajikan hasil laut mangrove jaga kelestarian lingkungan tebang mangrovenya kepitingnya insya allah,suka makan kepiting pas banget tempat fresh olah saji hasil laut mangrove jaga lestari lingkung tebang mangrovenya kepiting insya allah,Kampung Terih,Kepulauan Riau
Masih perlu dibenahi lagi,dibenahi,benah,Kampung Terih,Kepulauan Riau
Pemandangannya indah,pemandangannya indah,pandang indah,Kampung Terih,Kepulauan Riau
Welcome Home,welcome home,welcome home,Kampung Terih,Kepulauan Riau
"Cobain dah seafood nyaa,,muantapp",coba seafood muantapp,coba seafood muantapp,Kampung Terih,Kepulauan Riau
kerennn,keren,keren,Kampung Terih,Kepulauan Riau
Tempat keren....buat nginap asyik...suasana nya sepi dan adem..,keren nginap asyik suasana sepi adem,keren nginap asyik suasana sepi adem,Kampung Terih,Kepulauan Riau
"Adem disini, bagus neh buat menyepi Nyepi..",adem bagus menyepi nyepi,adem bagus nyepi nyepi,Kampung Terih,Kepulauan Riau
Pantai Bakau di Batam,pantai bakau batam,pantai bakau batam,Kampung Terih,Kepulauan Riau
Patut dicoba y,patut dicoba,patut coba,Kampung Terih,Kepulauan Riau
"Bagus, dan di sarankan utk tempat wisata, kenapa masih 3 bintang, krn masih perlu dilakukan pembenahan, dan disokong pemerintah dan swasta",bagus sarankan wisata pembenahan disokong pemerintah swasta,bagus saran wisata benah sokong perintah swasta,Kampung Terih,Kepulauan Riau
Warung see food mak cik...nyaman makanannya uuueeenakkk👍,warung food mak cik nyaman makanannya uuueeenakkk,warung food mak cik nyaman makan uuueeenakkk,Kampung Terih,Kepulauan Riau
Perjalanan  cukup melelahkan dari Bengkong menuju Kampung Terih dengan kenderaan bersepeda dengan perjalanan melalui tanjakan  naik turunnya jalanan yang dilalui.....,perjalanan melelahkan bengkong kampung terih kenderaan bersepeda perjalanan tanjakan turunnya jalanan,jalan lelah bengkong kampung terih kenderaan sepeda jalan tanjak turun jalan,Kampung Terih,Kepulauan Riau
Indahnya suasana wisata kampung terih dan mangrove xa manntullll,indahnya suasana wisata kampung terih mangrove xa manntullll,indah suasana wisata kampung terih mangrove xa manntullll,Kampung Terih,Kepulauan Riau
Baguss!!!,bagus,bagus,Kampung Terih,Kepulauan Riau
Lebih dikembangkan Lagi agar menjadi saLah satu tujuan wisata di batam👍✌,dikembangkan salah tujuan wisata batam,kembang salah tuju wisata batam,Kampung Terih,Kepulauan Riau
Nice place...,nice place,nice place,Kampung Terih,Kepulauan Riau
"Pemandangannya Bagus, kopinya enak....
Cafe  SUNMOFEE TROPICAL....

Very Recomend ....",pemandangannya bagus kopinya cafe sunmofee tropical very recomend,pandang bagus kopi cafe sunmofee tropical very recomend,Kampung Terih,Kepulauan Riau
Wisata kampung yang keren,wisata kampung keren,wisata kampung keren,Kampung Terih,Kepulauan Riau
Enak buat rekreasi keluarga,rekreasi keluarga,rekreasi keluarga,Kampung Terih,Kepulauan Riau
Okk mantap,okk mantap,okk mantap,Kampung Terih,Kepulauan Riau
"Masuknya free, tempatnya okay lahh",masuknya free tempatnya okay,masuk free tempat okay,Kampung Terih,Kepulauan Riau
