review,cleaned_review,cleaned_review_stemmed,nama desa wisata,provinsi
"Bs menambah pengetahuan ttg fungsi tanaman mangrove, tiket masuk ke dlm rawa mangrove naik kapal kecil 15rb per org, tiket motor 3rb. Ada wc ada pondok pinggir jalan akses mdh. Rekomendasi",menambah pengetahuan fungsi tanaman mangrove tiket rawa mangrove kapal ribu tiket motor ribu wc pondok pinggir jalan akses mdh rekomendasi,tambah tahu fungsi tanam mangrove tiket rawa mangrove kapal ribu tiket motor ribu wc pondok pinggir jalan akses mdh rekomendasi,Mangrove Kurau,Kepulauan Bangka Belitung
Suasana alami dan letak tidak terlalu jauh dari pusat kota,suasana alami letak pusat kota,suasana alami letak pusat kota,Mangrove Kurau,Kepulauan Bangka Belitung
Sip,sip,sip,Mangrove Kurau,Kepulauan Bangka Belitung
Mantul,mantul,mantul,Mangrove Kurau,Kepulauan Bangka Belitung
"Trek jalannya setapak penuh kenangan, trek speedboatnya penuh tantangan",trek jalannya setapak penuh kenangan trek speedboatnya penuh tantangan,trek jalan setapak penuh kenang trek speedboatnya penuh tantang,Mangrove Kurau,Kepulauan Bangka Belitung
Syuka,syuka,syuka,Mangrove Kurau,Kepulauan Bangka Belitung
seru bgt di ajak ngebut si abangnyam bikin spot jantung . lemes lutut 😄😄,seru banget ajak ngebut abangnyam bikin spot jantung lemes lutut,seru banget ajak ngebut abangnyam bikin spot jantung lemes lutut,Mangrove Kurau,Kepulauan Bangka Belitung
"Gak tau sih... Pas kesini..tampilan dpn nya kurang menarik... Trus air lagi surut... Jadi gak tau apa yg bikin menarik nya. Mudah""an pemerintah bisa bantu untuk ngembangin nya.",tau pas kesini tampilan menarik air surut tau bikin menarik mudah an pemerintah bantu ngembangin,tau pas kesini tampil tarik air surut tau bikin tarik mudah an perintah bantu ngembangin,Mangrove Kurau,Kepulauan Bangka Belitung
Bagi yg suka petualangan bisa disini. Jalan kaki atau pake boat. Tinggal pilih,suka petualangan jalan kaki pakai boat tinggal pilih,suka tualang jalan kaki pakai boat tinggal pilih,Mangrove Kurau,Kepulauan Bangka Belitung
Apresiasi untuk kelestarian hutan Mangrove,apresiasi kelestarian hutan mangrove,apresiasi lestari hutan mangrove,Mangrove Kurau,Kepulauan Bangka Belitung
Suasana masih alami,suasana alami,suasana alami,Mangrove Kurau,Kepulauan Bangka Belitung
Tempat yang menarik,menarik,tarik,Mangrove Kurau,Kepulauan Bangka Belitung
"Suasana yg pas untuk berwisata,,  tempat tenang dan banyak edukasi,,",suasana pas berwisata tenang edukasi,suasana pas wisata tenang edukasi,Mangrove Kurau,Kepulauan Bangka Belitung
Belum pernah ke mangrove,mangrove,mangrove,Mangrove Kurau,Kepulauan Bangka Belitung
Mantab,mantab,mantab,Mangrove Kurau,Kepulauan Bangka Belitung
Waw,wow,wow,Mangrove Kurau,Kepulauan Bangka Belitung
"Wisata Edukasi ""Hutan Mangrove""",wisata edukasi hutan mangrove,wisata edukasi hutan mangrove,Mangrove Kurau,Kepulauan Bangka Belitung
"Tempat nya bagus bersatu dengan alam tetapi jalannya tidak mendukung kalau mau berjalan kaki tolong pemerintah perbaiki,dan lebih seru kalau naik sepit",bagus bersatu alam jalannya mendukung berjalan kaki tolong pemerintah perbaiki seru sepit,bagus satu alam jalan dukung jalan kaki tolong perintah baik seru sepit,Mangrove Kurau,Kepulauan Bangka Belitung
jangan lupa naik boatnya. lorong waktunya udah pudar warna kayunya,lupa boatnya lorong pudar warna kayunya,lupa boatnya lorong pudar warna kayu,Mangrove Kurau,Kepulauan Bangka Belitung
Sejuk,sejuk,sejuk,Mangrove Kurau,Kepulauan Bangka Belitung
Bersih,bersih,bersih,Mangrove Kurau,Kepulauan Bangka Belitung
Keren,keren,keren,Mangrove Kurau,Kepulauan Bangka Belitung
Mantaps .,mantaps,mantaps,Mangrove Kurau,Kepulauan Bangka Belitung
Lumayan lah,lumayan,lumayan,Mangrove Kurau,Kepulauan Bangka Belitung
Wisata alam bisa membuk wawasan banyak tentang magrove,wisata alam membuk wawasan magrove,wisata alam buk wawas magrove,Mangrove Kurau,Kepulauan Bangka Belitung
"Seruuu..., yg suka banget wisata hutan disini tempatnya...!!!
Bayak atraksi2 juga di dalamnya lho, & kita bisa jumpai beberapa jembatan gantung juga & pastinya kita juga bisa menggali iLmu tentang bayknya ekowisata disana. Kereeen dech pkoknya...",seru suka banget wisata hutan tempatnya bayak atraksi dalamnya lho jumpai jembatan gantung pastinya menggali ilmu bayknya ekowisata disana keren pokoknya,seru suka banget wisata hutan tempat bayak atraksi dalam lho jumpa jembatan gantung pasti gali ilmu bayknya ekowisata sana keren pokok,Mangrove Kurau,Kepulauan Bangka Belitung
Naik menara jodo mangrove munjang desa kurau kecamatan Koba luar biasa keren mantulll mantap betul,menara jodo mangrove munjang desa kurau kecamatan koba keren mantulll mantap,menara jodo mangrove munjang desa kurau camat koba keren mantulll mantap,Mangrove Kurau,Kepulauan Bangka Belitung
So memanjakan hati dan pikiran,sok memanjakan hati pikiran,sok manja hati pikir,Mangrove Kurau,Kepulauan Bangka Belitung
Wisata hutan mangrove munjang mantap,wisata hutan mangrove munjang mantap,wisata hutan mangrove munjang mantap,Mangrove Kurau,Kepulauan Bangka Belitung
"Konservasi, edukasi n wisata.",konservasi edukasi wisata,konservasi edukasi wisata,Mangrove Kurau,Kepulauan Bangka Belitung
"Destinasi yang wahh...lingkungan nya benar"" terjaga,pemandangan nya green banget",destinasi lingkungan terjaga pemandangan green banget,destinasi lingkung jaga pandang green banget,Mangrove Kurau,Kepulauan Bangka Belitung
Sangat menguji adrenalin dan sangat memberikan pengalaman yang seru dan saya ingin kembali untuk kesini,menguji adrenalin pengalaman seru kesini,uji adrenalin alam seru kesini,Mangrove Kurau,Kepulauan Bangka Belitung
Ajip🤗,ajip,ajip,Mangrove Kurau,Kepulauan Bangka Belitung
Memuaskan.mantap,memuaskan mantap,muas mantap,Mangrove Kurau,Kepulauan Bangka Belitung
