review,cleaned_review,cleaned_review_stemmed,nama desa wisata,provinsi
"Pemandangannya indah, sejuk dipandang mata. Gorengan dicafe ini mantul..",pemandangannya indah sejuk dipandang gorengan dicafe mantul,pandang indah sejuk pandang goreng dicafe mantul,Nagari Pariangan,Sumatera Barat
Pemandangan yang lantang dan indah,pemandangan lantang indah,pandang lantang indah,Nagari Pariangan,Sumatera Barat
"Sejuk, tentram, menenangkan",sejuk tentram menenangkan,sejuk tentram tenang,Nagari Pariangan,Sumatera Barat
"Wisata panorama Nagari Tuo Pariangan, lokasi wisata yg murah meriah.....",wisata panorama nagari tuo pariangan lokasi wisata murah meriah,wisata panorama nagari tuo pariangan lokasi wisata murah riah,Nagari Pariangan,Sumatera Barat
Jalan akses,jalan akses,jalan akses,Nagari Pariangan,Sumatera Barat
"Tempatnya sejuk, nuansa Minang terasa lewat rumah2 yang masih terasa adatnya.. pemandangan sawah di atas juga indah, dibawah ada air hangat/panas alami, jalan setapak sudah baik, pekerjaan rumah untuk di pemandian air panasnya masih berkesan kotor dan kurang terawat, orang2nya ramah2..",tempatnya sejuk nuansa minang rumah adatnya pemandangan sawah indah dibawah air hangat panas alami jalan setapak pekerjaan rumah pemandian air panasnya berkesan kotor terawat ramah,tempat sejuk nuansa mang rumah adat pandang sawah indah bawah air hangat panas alami jalan setapak kerja rumah mandi air panas kesan kotor awat ramah,Nagari Pariangan,Sumatera Barat
Sangan indah dan wajib di kunjungi apa bila ke batusangkar,sangan indah wajib kunjungi batusangkar,sangan indah wajib kunjung batusangkar,Nagari Pariangan,Sumatera Barat
Desaku yang indah .,desaku indah,desa indah,Nagari Pariangan,Sumatera Barat
Bagus. Gorengan nya enak. Ada kawah daun juga,bagus gorengan kawah daun,bagus goreng kawah daun,Nagari Pariangan,Sumatera Barat
"natural, sejuk mendekati dingin, tenang cuma perlu penataan parkir dan kebersihan",natural sejuk mendekati dingin tenang penataan parkir kebersihan,natural sejuk dekat dingin tenang tata parkir bersih,Nagari Pariangan,Sumatera Barat
"Tempatnya sejuk, pemandangannya bagus, sayangnya pas datang habis hujan dan berkabut.",tempatnya sejuk pemandangannya bagus sayangnya pas habis hujan berkabut,tempat sejuk pandang bagus sayang pas habis hujan kabut,Nagari Pariangan,Sumatera Barat
"Pemandangan yang begitu indah dan orang2 yang ramah,makanan dan minuman khas teh Talua dan kopi Kawa nya sangat enak",pemandangan indah ramah makanan minuman khas teh talua kopi kawa,pandang indah ramah makan minum khas teh talua kopi kawa,Nagari Pariangan,Sumatera Barat
"Di desanya ada tempat untuk bersantai dan melihat pemandangan, hanya saja akses jalannya cukup kecil jadi agak sulit diakses dengan menggunakan mobil",desanya bersantai pemandangan akses jalannya sulit diakses mobil,desa santa pandang akses jalan sulit akses mobil,Nagari Pariangan,Sumatera Barat
"Tempat ini bagus , untuk foto foto pemandangan nya bagus 👍👍",bagus foto foto pemandangan bagus,bagus foto foto pandang bagus,Nagari Pariangan,Sumatera Barat
"Nyaman sejuk asri,...",nyaman sejuk asri,nyaman sejuk asri,Nagari Pariangan,Sumatera Barat
Desa yang sejuk nan indah klu ada penginapan yang suasana seperti ini alam desanya yang sangat asri dan sejuk....,desa sejuk nan indah penginapan suasana alam desanya asri sejuk,desa sejuk nan indah inap suasana alam desa asri sejuk,Nagari Pariangan,Sumatera Barat
"Tempatnya asyik, asri alam sawah. View sawah indah. Cuma cuaca agak HOT.",tempatnya asyik asri alam sawah view sawah indah cuaca hot,tempat asyik asri alam sawah view sawah indah cuaca hot,Nagari Pariangan,Sumatera Barat
Disuguhkan pemandangan luar biasa sambil menikmati kawa daun,disuguhkan pemandangan menikmati kawa daun,suguh pandang nikmat kawa daun,Nagari Pariangan,Sumatera Barat
"Patut dikunjungi, sederhana tapi pesona pemandangan sangat memukai bagi orang kota",patut dikunjungi sederhana pesona pemandangan memukai kota,patut kunjung sederhana pesona pandang muka kota,Nagari Pariangan,Sumatera Barat
"pemandangan nya bagus, enak buat dinikmatin sambil minum kawa daun",pemandangan bagus dinikmatin minum kawa daun,pandang bagus dinikmatin minum kawa daun,Nagari Pariangan,Sumatera Barat
nyaman bangat buat refreshing dan menjauh dari kebisingan,nyaman banget refreshing menjauh kebisingan,nyaman banget refreshing jauh bising,Nagari Pariangan,Sumatera Barat
"Mau ngopy, ya disini aja, kopi kawa desa terindah",ngopy kopi kawa desa terindah,ngopy kopi kawa desa indah,Nagari Pariangan,Sumatera Barat
Pernah ke sini. Bagus sambil minum kawa.,bagus minum kawa,bagus minum kawa,Nagari Pariangan,Sumatera Barat
"Desa dengan pemandangan indah, asri. Dan sangat nyaman.",desa pemandangan indah asri nyaman,desa pandang indah asri nyaman,Nagari Pariangan,Sumatera Barat
"Desa dengan suasana yang nyaman, tentram.",desa suasana nyaman tentram,desa suasana nyaman tentram,Nagari Pariangan,Sumatera Barat
"Pemandangan yang sangat menarik, terutama dilihat dari Top View nya.",pemandangan menarik top view,pandang tarik top view,Nagari Pariangan,Sumatera Barat
"Desanya sejuk banget,,nyaman kali ada disini...",desanya sejuk banget nyaman,desa sejuk banget nyaman,Nagari Pariangan,Sumatera Barat
"Indah desa nya, persawahan yang tertata di lereng bukit...dan panorama alamnya perbukitan dan pergunungan....sambil menikmati kopi kawah daun...dan indomie telor pas pada cuaca yang sejuk dan menyegarkan....",indah desa persawahan tertata lereng bukit panorama alamnya perbukitan pergunungan menikmati kopi kawah daun indomie telor pas cuaca sejuk menyegarkan,indah desa sawah tata lereng bukit panorama alam bukit gunung nikmat kopi kawah daun indomie telor pas cuaca sejuk segar,Nagari Pariangan,Sumatera Barat
Amazing,amazing,amazing,Nagari Pariangan,Sumatera Barat
"Pemandangan bagus bet, apalagi kalau langit lagi cerah gak ada obat siih. Cuma kalau malam dingiiin jadi harus bawa baju hangat yah kalau mau sampe malam disini, kawa nya juga rekom sih",pemandangan bagus banget langit cerah obat malam dingiiin bawa baju hangat malam kawa rekom,pandang bagus banget langit cerah obat malam dingiiin bawa baju hangat malam kawa rekom,Nagari Pariangan,Sumatera Barat
Indah sejuk dan menawan,indah sejuk menawan,indah sejuk tawan,Nagari Pariangan,Sumatera Barat
