review,cleaned_review,cleaned_review_stemmed,nama desa wisata,provinsi
Pantai batu kuda adalah pilihan tepat untuk bersantai bersama keluarga. Kita dapat menikmati indahnya pantai dan air panas alami saat air pantai surut tanpa biaya yang mahal..,pantai batu kuda pilihan bersantai keluarga menikmati indahnya pantai air panas alami air pantai surut biaya mahal,pantai batu kuda pilih santa keluarga nikmat indah pantai air panas alami air pantai surut biaya mahal,Pantai Batu Kuda,Maluku
batu kuda adalah salah satu tempat wisata yg sangat bagus dan indah😍,batu kuda salah wisata bagus indah,batu kuda salah wisata bagus indah,Pantai Batu Kuda,Maluku
"Pantai Batu Kuda, Negeri Tulehu adalah destinasi indah dengan air laut jernih dan suasana tenang. Dinamai dari batu besar berbentuk kuda di tepi pantai, tempat ini cocok untuk bersantai, berenang, atau menikmati matahari terbenam. Keindahan alam yang alami dan keramahan warga setempat menjadikannya salah satu pantai terbaik di Maluku Tengah.",pantai batu kuda negeri tulehu destinasi indah air laut jernih suasana tenang dinamai batu berbentuk kuda tepi pantai cocok bersantai berenang menikmati matahari terbenam keindahan alam alami keramahan warga menjadikannya salah pantai terbaik maluku tengah,pantai batu kuda negeri tulehu destinasi indah air laut jernih suasana tenang nama batu bentuk kuda tepi pantai cocok santa renang nikmat matahari benam indah alam alami ramah warga jadi salah pantai baik malu tengah,Pantai Batu Kuda,Maluku
"Pantai Batu Kuda menawarkan banyak eksplorasi biologi
Di pantai, terdapat retakan-retakan air panas mini melalui batu-batu karang",pantai batu kuda menawarkan eksplorasi biologi pantai retakan retakan air panas mini batu batu karang,pantai batu kuda tawar eksplorasi biologi pantai reta reta air panas mini batu batu karang,Pantai Batu Kuda,Maluku
Mantap,mantap,mantap,Pantai Batu Kuda,Maluku
"Bagus hanya di kamar mandi perlu di perbaiki & di lestarikan, bak mandi perlu di bersihkan krn gelap ketika di senter ada sempak 😩",bagus kamar mandi perbaiki lestarikan bak mandi bersihkan gelap senter sempak,bagus kamar mandi baik lestari bak mandi sih gelap senter sempak,Pantai Batu Kuda,Maluku
"Masya Allah bagus banget..

Cuma memang musholla nya gak terurus.. gak ada tempat wudhu terpisah..",masya allah bagus banget musholla terurus wudhu terpisah,masya allah bagus banget musholla urus wudhu pisah,Pantai Batu Kuda,Maluku
"Pantai yang indah..
Pantai dengan bebatuan dan karang..dari pantai ini terlihat pulau haruku dan pulau seram..lumayan berombak..banyak ikan warna warni..terdapat sumber air panas..
Banyak tempat duduk yg sediakan serta teduh..
Pisang gorengnya enak dan manis..disajikan tanpa sambal..
Mantab..",pantai indah pantai bebatuan karang pantai pulau haruku pulau seram lumayan berombak ikan warna warni sumber air panas duduk sediakan teduh pisang gorengnya manis disajikan sambal mantab,pantai indah pantai bebatuan karang pantai pulau haru pulau seram lumayan ombak ikan warna warni sumber air panas duduk sedia teduh pisang goreng manis saji sambal mantab,Pantai Batu Kuda,Maluku
"Keren berasa private beach, karang2 bagus, ada pantai ratanya juga, unik ada sumur air panasnya, minum air kelapa langsung dipetik, pemilik ramah",keren berasa private beach karang bagus pantai ratanya unik sumur air panasnya minum air kelapa dipetik pemilik ramah,keren asa private beach karang bagus pantai rata unik sumur air panas minum air kelapa petik milik ramah,Pantai Batu Kuda,Maluku
"Pantainya berkarang, tapi indah dan bagus",pantainya berkarang indah bagus,pantai karang indah bagus,Pantai Batu Kuda,Maluku
"Tiket masuk 5k/orang.
Ada air panasnya juga di sekitaran bibir pantainya",tiket kak air panasnya sekitaran bibir pantainya,tiket kak air panas sekitar bibir pantai,Pantai Batu Kuda,Maluku
"Bagus,,,tp harus dbenahi",bagus dbenahi,bagus dbenahi,Pantai Batu Kuda,Maluku
"Pemandangan Indah, namun tipe pantai berkarang,",pemandangan indah tipe pantai berkarang,pandang indah tipe pantai karang,Pantai Batu Kuda,Maluku
Airnya jernih untuk diving... Terbaik,airnya jernih diving terbaik,air jernih diving baik,Pantai Batu Kuda,Maluku
"tempatnya keren, jauh dari permukiman dan saranya semoga diperhatikan untuk toilet pengunjungnya terima kasih",tempatnya keren permukiman saranya semoga diperhatikan toilet pengunjungnya terima kasih,tempat keren mukim sara moga perhati toilet unjung terima kasih,Pantai Batu Kuda,Maluku
Sayang spor untuk mandinya kurang bagus karena pantainya banyak karang nya,sayang spor mandinya bagus pantainya karang,sayang spor mandi bagus pantai karang,Pantai Batu Kuda,Maluku
Menyelam dsana keren,menyelam disana keren,selam sana keren,Pantai Batu Kuda,Maluku
"Tiket masuk gratis, hanya bayar parkir. Tersedia mushola, warung makan, tempat pertemuan.
Terdapat mata air panas, tapi belum dimanfaatkan. Bisa di bangun kolam air panas agar menarik pengunjung",tiket gratis bayar parkir tersedia mushola warung makan pertemuan air panas dimanfaatkan bangun kolam air panas menarik pengunjung,tiket gratis bayar parkir sedia mushola warung makan temu air panas manfaat bangun kolam air panas tarik unjung,Pantai Batu Kuda,Maluku
"Airnya bersih, pemandangan nya juga indah",airnya bersih pemandangan indah,air bersih pandang indah,Pantai Batu Kuda,Maluku
Nice,nice,nice,Pantai Batu Kuda,Maluku
"Tempatnya indah,namun butuh investor untuk mengelola pantai",tempatnya indah butuh investor mengelola pantai,tempat indah butuh investor kelola pantai,Pantai Batu Kuda,Maluku
Tempat healing terdekat,healing terdekat,healing dekat,Pantai Batu Kuda,Maluku
Bagus buat camping dan acara👍👍👍,bagus camping acara,bagus camping acara,Pantai Batu Kuda,Maluku
pemandangan bangus,pemandangan bangus,pandang bangus,Pantai Batu Kuda,Maluku
"Masih sepi pengunjung, mungkin karena saya datang di hari kerja. Kebersihan bisa ditingkatkan lagi, karena masih ada sampah plastik di sana sini.",sepi pengunjung kebersihan ditingkatkan sampah plastik,sepi unjung bersih tingkat sampah plastik,Pantai Batu Kuda,Maluku
Pemandangannya indah sekali. Dengan biaya Rp. 5.000/orang.,pemandangannya indah biaya rp,pandang indah biaya rp,Pantai Batu Kuda,Maluku
Prospek tempat pariwisata masa depan,prospek pariwisata,prospek pariwisata,Pantai Batu Kuda,Maluku
"Pantai batu kuda memiliki pemandangan yang indah dengan batu karang yang menyerupai kuda sehingga membuat pengunjung tertarik untuk berfoto di pantai ini, tempatnya sangat nyaman dan sangat indah di jadikan tempat rekreasi.",pantai batu kuda memiliki pemandangan indah batu karang menyerupai kuda pengunjung tertarik berfoto pantai tempatnya nyaman indah jadikan rekreasi,pantai batu kuda milik pandang indah batu karang rupa kuda unjung tarik foto pantai tempat nyaman indah jadi rekreasi,Pantai Batu Kuda,Maluku
"Tempatnya tenang, cocok untuk weekend bersama keluarga, areal luas bisa d pakai untuk acara keluarga..",tempatnya tenang cocok weekend keluarga areal luas pakai acara keluarga,tempat tenang cocok weekend keluarga areal luas pakai acara keluarga,Pantai Batu Kuda,Maluku
Terlalu banyak ayam berkeliaran,ayam berkeliaran,ayam liar,Pantai Batu Kuda,Maluku
Pemandangan bagus.. air beniiing... Tapi sayangnya fasilitas tidak memadai. Toilet sangat kotor dan bau..... bak air juga sangat kotor...,pemandangan bagus air beniiing sayangnya fasilitas memadai toilet kotor bau bak air kotor,pandang bagus air beniiing sayang fasilitas pada toilet kotor bau bak air kotor,Pantai Batu Kuda,Maluku
"Tempatnya Adem Bersih dan nyaman
Orngny Ramah dan Baik..",tempatnya adem bersih nyaman orngny ramah,tempat adem bersih nyaman orngny ramah,Pantai Batu Kuda,Maluku
"Pantai yang cocok untuk kumpul keluarga dan salah satu spot diving. Ada kamar mandi dan kamar ganti, ada tempat parkir luas, ada tempat duduk dan pendopo.",pantai cocok kumpul keluarga salah spot diving kamar mandi kamar ganti parkir luas duduk pendopo,pantai cocok kumpul keluarga salah spot diving kamar mandi kamar ganti parkir luas duduk pendopo,Pantai Batu Kuda,Maluku
Pantainya indah,pantainya indah,pantai indah,Pantai Batu Kuda,Maluku
Kerennn,keren,keren,Pantai Batu Kuda,Maluku
Produk asli dan terpercaya,produk asli terpercaya,produk asli percaya,Pantai Batu Kuda,Maluku
Klo,kalo,kalo,Pantai Batu Kuda,Maluku
Tempat yang sangat asyik dan nyaman,asyik nyaman,asyik nyaman,Pantai Batu Kuda,Maluku
Bagis sih...cm srpi d hati biasa..belum d kelola dengan baik...retribusi terlalu mahal menurut saya,bagis srpi hati kelola retribusi mahal,bagis srpi hati kelola retribusi mahal,Pantai Batu Kuda,Maluku
Kotor sih,kotor,kotor,Pantai Batu Kuda,Maluku
tempat yang indah untuk di kunjungi..,indah kunjungi,indah kunjung,Pantai Batu Kuda,Maluku
"Tempatnya nyaman, jauh dari keramaian, pemandangannya bagus.Ada musholla.",tempatnya nyaman keramaian pemandangannya bagus musholla,tempat nyaman ramai pandang bagus musholla,Pantai Batu Kuda,Maluku
"Pantai Batu Kuda merupakan salah tempat wisata yang terletak Tulehu, Ambon Provinsi Maluku. Konon Batu Kuda ini merupakan kuda kesayangan Sapati Bhaaluwu waktu berkunjung di Kepulauan Maluku. Namun kuda itu telah membatu. Disekitar pantai terdapat Sumur Air Panas. Bahkan di tepian sekitar sumur memancar semburan air panas. Konon air tersebut terbentuk saat Sapati Bhaaluwu kehausan di tempat ini. Kemudian beliau menancapkan tongkatnya di lokasi ini. Saat itulah air keluar dari dalam tanah.",pantai batu kuda salah wisata terletak tulehu ambon provinsi maluku konon batu kuda kuda kesayangan sapati bhaaluwu waktu berkunjung kepulauan maluku kuda membatu disekitar pantai sumur air panas tepian sumur memancar semburan air panas konon air terbentuk sapati bhaaluwu kehausan beliau menancapkan tongkatnya lokasi air tanah,pantai batu kuda salah wisata letak tulehu ambon provinsi malu konon batu kuda kuda sayang sapat bhaaluwu waktu kunjung pulau malu kuda batu sekitar pantai sumur air panas tepi sumur pancar sembur air panas konon air bentuk sapat bhaaluwu haus beliau tancap tongkat lokasi air tanah,Pantai Batu Kuda,Maluku
Tempat yang indah. Poin plus ada mussolah yg bisa di pake. ☺️,indah poin plus mussolah pakai,indah poin plus mussolah pakai,Pantai Batu Kuda,Maluku
Tempatnya bagus cocok untuk buat kegiatan outdoor,tempatnya bagus cocok kegiatan outdoor,tempat bagus cocok giat outdoor,Pantai Batu Kuda,Maluku
Ada bulir bulir air panas yg menjadikan air tidak dingin,bulir bulir air panas menjadikan air dingin,bulir bulir air panas jadi air dingin,Pantai Batu Kuda,Maluku
Tempatnya sejuk,tempatnya sejuk,tempat sejuk,Pantai Batu Kuda,Maluku
Nyaman dan indah,nyaman indah,nyaman indah,Pantai Batu Kuda,Maluku
Indah,indah,indah,Pantai Batu Kuda,Maluku
Tempat ini adalah camp mrt swans/ team esport,camp mrt swans team esport,camp mrt swans team esport,Pantai Batu Kuda,Maluku
Tempat belajar vulkanologi dan geothermal yang bagus dan menyenangkan...,belajar vulkanologi geothermal bagus menyenangkan,ajar vulkanologi geothermal bagus senang,Pantai Batu Kuda,Maluku
Tempat yg aman dan nyaman,aman nyaman,aman nyaman,Pantai Batu Kuda,Maluku
Pantai ini milik pribadi dan dibuka secara umum.. Tempat ini menyuguhkan pemandangan laut dan pulau sekitar kota ambon.. Indah dipandang mata,pantai milik pribadi dibuka umum menyuguhkan pemandangan laut pulau kota ambon indah dipandang,pantai milik pribadi buka umum suguh pandang laut pulau kota ambon indah pandang,Pantai Batu Kuda,Maluku
Tempat yg nyaman untuk berlibur,nyaman berlibur,nyaman libur,Pantai Batu Kuda,Maluku
"Sangat indah pemandangan pantaix,yg sangat memanjakan mata",indah pemandangan pantaix memanjakan,indah pandang pantaix manja,Pantai Batu Kuda,Maluku
Tempat waisata yg indah di sudut pulau ambon,waisata indah sudut pulau ambon,waisata indah sudut pulau ambon,Pantai Batu Kuda,Maluku
"Tempat wisata lokal yg penuh sejarah, view bagus dan nyaman, ada musholah, ada cafe, bisa ngopi2 juga 👍🤩",wisata lokal penuh sejarah view bagus nyaman musholah cafe ngopi,wisata lokal penuh sejarah view bagus nyaman musholah cafe ngopi,Pantai Batu Kuda,Maluku
Tenang.. semilir.. buat camping ringan oke.. buat main air juga oke,tenang semilir camping ringan oke main air oke,tenang milir camping ringan oke main air oke,Pantai Batu Kuda,Maluku
Nice beach,nice beach,nice beach,Pantai Batu Kuda,Maluku
Tempat wisata pantai...banyak batu karang nya,wisata pantai batu karang,wisata pantai batu karang,Pantai Batu Kuda,Maluku
Ok,ok,ok,Pantai Batu Kuda,Maluku
Bagus...,bagus,bagus,Pantai Batu Kuda,Maluku
Good destination,good destination,good destination,Pantai Batu Kuda,Maluku
pantai berbatu karang,pantai berbatu karang,pantai batu karang,Pantai Batu Kuda,Maluku
Tempat baru yg msti dipoles ..lebh cantik lagi,msti dipoles cantik,msti poles cantik,Pantai Batu Kuda,Maluku
Tempat sekitar yg pas utk lari pagi..,pas lari pagi,pas lari pagi,Pantai Batu Kuda,Maluku
"Dive spot didaerah Tulehu, cukup ideal bagi penyelam pemula",dive spot didaerah tulehu ideal penyelam pemula,dive spot daerah tulehu ideal selam mula,Pantai Batu Kuda,Maluku
Pantainya keren dan nyaman buat refreshing.,pantainya keren nyaman refreshing,pantai keren nyaman refreshing,Pantai Batu Kuda,Maluku
Air jernih banyak karang,air jernih karang,air jernih karang,Pantai Batu Kuda,Maluku
"Untuk acara bareng2 lumayan lah. Ada tempat buat kegiatan bareng, baik indoor maupun outdoor...",acara bareng lumayan kegiatan bareng indoor outdoor,acara bareng lumayan giat bareng indoor outdoor,Pantai Batu Kuda,Maluku
Membuat saya mengerti apa itu kehidupan yg sesungguhnya,mengerti kehidupan sesungguhnya,erti hidup sungguh,Pantai Batu Kuda,Maluku
Sangat indah dengan sebutan ombak .serta lambaian nyiur pohon kelapa memberikan kesejukan yg berarti.,indah sebutan ombak lambaian nyiur pohon kelapa kesejukan,indah sebut ombak lambai nyiur pohon kelapa sejuk,Pantai Batu Kuda,Maluku
Pantai penuh kenangan,pantai penuh kenangan,pantai penuh kenang,Pantai Batu Kuda,Maluku
"Pantainya sepi pengunjung,jadi berasa private beach. Pemandangan bagus. Airnya jernih dan ada sumur sumber air panas.",pantainya sepi pengunjung berasa private beach pemandangan bagus airnya jernih sumur sumber air panas,pantai sepi unjung asa private beach pandang bagus air jernih sumur sumber air panas,Pantai Batu Kuda,Maluku
Pantainya jenis pantai berbatu... ombaknya lumayan juga.. bayar retribusi kalau jalan kaki cuma 3000. Pergi pagi2 jam 6 kalau pingin tak bayar retribusi. Huehehe,pantainya jenis pantai berbatu ombaknya lumayan bayar retribusi jalan kaki pergi pagi jam pengin bayar retribusi huehehe,pantai jenis pantai batu ombak lumayan bayar retribusi jalan kaki pergi pagi jam pengin bayar retribusi huehehe,Pantai Batu Kuda,Maluku
Seram kalo malam wkwk,seram kalo malam wkwk,seram kalo malam wkwk,Pantai Batu Kuda,Maluku
"Pantai Batu Kuda merupakan salah satu destinasi wisata yang belum terlalu banyak dikenal oleh masyarakat Kota Ambon namum kalau mau diperhatikan pantai batu kuda ini merupakan tempat wisata yang paling indah dimulai dari keindahan alam, kejernihan laut serta memiliki keindahan pantai yang luar biasa :* tunggu apa lag guys ayo kita kasana :D",pantai batu kuda salah destinasi wisata dikenal masyarakat kota ambon namum diperhatikan pantai batu kuda wisata indah keindahan alam kejernihan laut memiliki keindahan pantai tunggu lag guys ayo kasana,pantai batu kuda salah destinasi wisata kenal masyarakat kota ambon namum perhati pantai batu kuda wisata indah indah alam jernih laut milik indah pantai tunggu lag guys ayo kasana,Pantai Batu Kuda,Maluku
"Batu kuda merupakan wisata yang cocok untuk melakukan kegiatan bersama keluarga,teman dan sebagainya
Tempat bagus pemandangannya indah",batu kuda wisata cocok kegiatan keluarga teman bagus pemandangannya indah,batu kuda wisata cocok giat keluarga teman bagus pandang indah,Pantai Batu Kuda,Maluku
"Pantai batu kuda adalah salah satu pantai yg terlentak di kecemata salahutu ,kabupaten maluku tengah.
Pantai batu kuda memiliki pemandangan yang begitu indah
dan memiliki batu yang berbentuk kuda yang begitu indah.
Sehingga membuat pengunjung tertarik untuk berfoto di pantai batu kuda",pantai batu kuda salah pantai terlentak kecemata salahutu kabupaten maluku tengah pantai batu kuda memiliki pemandangan indah memiliki batu berbentuk kuda indah pengunjung tertarik berfoto pantai batu kuda,pantai batu kuda salah pantai terlentak kecemata salahutu kabupaten malu tengah pantai batu kuda milik pandang indah milik batu bentuk kuda indah unjung tarik foto pantai batu kuda,Pantai Batu Kuda,Maluku
bgs tempatnya..,bagus tempatnya,bagus tempat,Pantai Batu Kuda,Maluku
Tempatxa masih asri dan nyaman tuk semua kalangan.,tempatxa asri nyaman kalangan,tempatxa asri nyaman kalang,Pantai Batu Kuda,Maluku
Keren,keren,keren,Pantai Batu Kuda,Maluku
"Tempat yang paling indah, terletak di kota ambon",indah terletak kota ambon,indah letak kota ambon,Pantai Batu Kuda,Maluku
pantai batu kuda memiliki pemandangan yang indah dengan batu karang yang bentuknya menyerupai kuda sangat indah di jadikan sebagai tempat untuk rekreasi,pantai batu kuda memiliki pemandangan indah batu karang bentuknya menyerupai kuda indah jadikan rekreasi,pantai batu kuda milik pandang indah batu karang bentuk rupa kuda indah jadi rekreasi,Pantai Batu Kuda,Maluku
Sangat bagus dan indah pemandangannya.,bagus indah pemandangannya,bagus indah pandang,Pantai Batu Kuda,Maluku
Nice place ...,nice place,nice place,Pantai Batu Kuda,Maluku
Tempat yang romantis,romantis,romantis,Pantai Batu Kuda,Maluku
wonderful,wonderful,wonderful,Pantai Batu Kuda,Maluku
Mantap buat snorkling,mantap snorkling,mantap snorkling,Pantai Batu Kuda,Maluku
Tempat ini punya cerita tentang aku dan dia. Batu kuda beach,cerita batu kuda beach,cerita batu kuda beach,Pantai Batu Kuda,Maluku
Salah satu spot dive di maluku 👍👍👌👌,salah spot dive maluku,salah spot dive malu,Pantai Batu Kuda,Maluku
Gak  ada kudanya,kudanya,kuda,Pantai Batu Kuda,Maluku
