review,cleaned_review,cleaned_review_stemmed,nama desa wisata,provinsi
enakk warga nya sopan semua makmur,enakk warga sopan makmur,enakk warga sopan makmur,Pentingsari,
Kampung suami,kampung suami,kampung suami,Pentingsari,
"Kearifan lokal yang menyenangkan, keramahan penduduk nya yang luar biasa",kearifan lokal menyenangkan keramahan penduduk,arif lokal senang ramah duduk,Pentingsari,
"Desa wisata terbaik.
Terbaik dalam keramahan, pelayanan, makanan, dan kegiatan.
Sangat cocok untuk tempat belajar siswa dengan sistem live in di rumah host fam.",desa wisata terbaik terbaik keramahan pelayanan makanan kegiatan cocok belajar siswa sistem live rumah host fam,desa wisata baik baik ramah layan makan giat cocok ajar siswa sistem live rumah host fam,Pentingsari,
Hiburan,hiburan,hibur,Pentingsari,
"Tempatnya luas dan asri cukup bagus untuk kegiatan fun games, kamar mandi cukup banyak cuma gak semuanya air kerannya nyala kemarin pas cek yg sebelah barat. Semoga pengelolaannya lebih baik lagi 👍",tempatnya luas asri bagus kegiatan fun games kamar mandi air kerannya nyala kemarin pas cek sebelah barat semoga pengelolaannya,tempat luas asri bagus giat fun games kamar mandi air keran nyala kemarin pas cek belah barat moga kelola,Pentingsari,
"Rumah Simbahnya Zahra ada di desa inih, lingkungannya masih asri banyak pohon² besar.. O2 melimpah.. cocok banget kalo suka hiking atau sepedaan jenis MTB / Gravel",rumah simbahnya zahra desa lingkungannya asri pohon melimpah cocok banget kalo suka hiking sepedaan jenis mtb gravel,rumah simbah zahra desa lingkung asri pohon limpah cocok banget kalo suka hiking sepeda jenis mtb gravel,Pentingsari,
seru banget kesini. wisata yang bener2 seru apalagi kalau live in. enjoy here,seru banget kesini wisata seru live enjoy here,seru banget kesini wisata seru live enjoy here,Pentingsari,
"Di desa ini buat ngadain acara penanaman pohon dan bapaknya yang ngelola ramah sekali 🙏🏻😊

Cocok untuk wisata alam, yang mau camping apalagi. View-nya Kali Kuning, bisa main air juga karena tidak terlalu deras arusnya. Recommended!",desa mengadakan acara penanaman pohon bapaknya ngelola ramah cocok wisata alam camping view kuning main air deras arusnya recommended,desa ada acara tanam pohon bapak ngelola ramah cocok wisata alam camping view kuning main air deras arus recommended,Pentingsari,
Lingkungan sangat nyaman,lingkungan nyaman,lingkung nyaman,Pentingsari,
"puas dengan pelayanan pemandu nya, desa nya rapi bersih, kaya akan SDM, dan pengelolaan nya kereeennnn🤩🤩🤩",puas pelayanan pemandu desa rapi bersih kayak sdm pengelolaan keren,puas layan pandu desa rapi bersih kayak sdm kelola keren,Pentingsari,
"Lingkungan nya nyaman dan asri, kita bs belajar dlm budaya yg  jarang kita temukan ditempat lain",lingkungan nyaman asri belajar budaya jarang temukan ditempat,lingkung nyaman asri ajar budaya jarang temu tempat,Pentingsari,
"Desanya asri,alami dan suasananya enak. Lingkungannya bersih,banyak home stay. Kesana cuma mampir jajan tidak menginap.",desanya asri alami suasananya lingkungannya bersih home stay kesana mampir jajan menginap,desa asri alami suasana lingkung bersih home stay kesana mampir jajan inap,Pentingsari,
Tempat bagus.. natural village,bagus natural village,bagus natural village,Pentingsari,
"Salah satu desa wisata yang ada di Yogyakarta, lokasinga sangat dekat dengan Ledhok Sambi yang sangat terkenal. Menginap 2 malam di homestay seruni, dilayani dam dijamu dengan hangat oleh Pak Bambang dan Mbah. Serasa pulang ke rumah nenek sendiri. Sehat selalu Mbah.",salah desa wisata yogyakarta lokasinga ledhok sambi terkenal menginap malam homestay seruni dilayani dam dijamu hangat bambang mbah serasa pulang rumah nenek sehat mbah,salah desa wisata yogyakarta lokasinga ledhok sambi kenal inap malam homestay seruni layan dam jamu hangat bambang mbah serasa pulang rumah nenek sehat mbah,Pentingsari,
"Tadinya mau ke lodok sambi tapi sudah kesorean dan hampir tutup, lalu disarankan sama bpk tukang parkirnya kesini, tempatnya lumayan bagus, namun memang lebih cocok buat camping atau outbound,",lodok sambi kesorean tutup disarankan bpk tukang parkirnya kesini tempatnya lumayan bagus cocok camping outbound,lodok sambi sore tutup saran bpk tukang parkir kesini tempat lumayan bagus cocok camping outbound,Pentingsari,
"Tempat sangat alami, nyaman, udara sejuk, kamar mandi bersih",alami nyaman udara sejuk kamar mandi bersih,alami nyaman udara sejuk kamar mandi bersih,Pentingsari,
Bagus,bagus,bagus,Pentingsari,
"Daerah pentingsari seperti 2 pulau yg terpisah yg dihubungkan dng jembatan , terlihat indah masih asri dan nyaman, masyarakatnya ramah2 sopan,dan tidak ada sampah plastik sedikitpun di pulau kecil ini, perpaduan bukit dan lembah dan penghijauan yg membentang seperti paru2 dunia,tempat kemah , bisa naik hrap , bisa BELAJAR pertanian di peting , desa wisata kali kuning",daerah pentingsari pulau terpisah dihubungkan jembatan indah asri nyaman masyarakatnya ramah sopan sampah plastik sedikitpun pulau perpaduan bukit lembah penghijauan membentang paru dunia kemah hrap belajar pertanian peting desa wisata kuning,daerah pentingsari pulau pisah hubung jembatan indah asri nyaman masyarakat ramah sopan sampah plastik sedikit pulau padu bukit lembah hijau bentang paru dunia kemah hrap ajar tani peting desa wisata kuning,Pentingsari,
"Nyaman, asri, sejuk",nyaman asri sejuk,nyaman asri sejuk,Pentingsari,
"tempat saya melakukan malam keakraban untuk TITRASI 2025, sangat menakjubkan sih.",malam keakraban titrasi menakjubkan,malam akrab titrasi takjub,Pentingsari,
"Tempat yg cocok untuk makrab dan sebagainya, buat outbound juga asikk",cocok makrab outbound asikk,cocok makrab outbound asikk,Pentingsari,
"Salam dari Desa Mattone, Kalsel",desa mattone kalsel,desa mattone kalsel,Pentingsari,
"Seru banget fieldtrip di Desa Wisata Penting Sari!! saya dan teman teman saya menangkap lele di sawah, bermain bola lumpur dan mandi di sungai benar” mencerminkan kehidupan desa yang asri, menginap di homestay Pak Joko dan Bu Ambar yang sangat ramah.. Selama di Homestay Pak Joko kami makan makanan yang di masak Bu Ambar.. Sangat Enak dan bener” serasa lagi di rumah.. Selain itu Homestaynya juga bersih dan Rapih sangat nyaman untuk di tempati❤️ Saya bisa melihat kekompakan masyarakat lokal🥰🥰 Love Bu Ambar & Pak Joko semoga sehat selalu❤️",seru banget fieldtrip desa wisata sari teman teman menangkap lele sawah bermain bola lumpur mandi sungai mencerminkan kehidupan desa asri menginap homestay joko bu ambar ramah homestay joko makan makanan masak bu ambar serasa rumah homestaynya bersih rapi nyaman tempati kekompakan masyarakat lokal love bu ambar joko semoga sehat,seru banget fieldtrip desa wisata sari teman teman tangkap lele sawah main bola lumpur mandi sungai cermin hidup desa asri inap homestay joko bu ambar ramah homestay joko makan makan masak bu ambar serasa rumah homestaynya bersih rapi nyaman tempat kompak masyarakat lokal love bu ambar joko moga sehat,Pentingsari,
"desa wisata nya bagus keren, tetapi masih kurang kayak jalan untuk ke lokasi pendopo bus gabisa masuk harus jalan kaki karena lokasinya agak ke bawah, terus kalau malem arah keluar desa agak kurang penerangan... parkir nya juga terbatas di lokasi.. trs penunjuk jalan mohon ditambah... mungkin perlu ditingkatkan fasilitas bisa minta dana ke dinas pariwisata ya mungkin...",desa wisata bagus keren kayak jalan lokasi pendopo bus jalan kaki lokasinya malam arah desa penerangan parkir terbatas lokasi penunjuk jalan ditambah ditingkatkan fasilitas dana dinas pariwisata,desa wisata bagus keren kayak jalan lokasi pendopo bus jalan kaki lokasi malam arah desa terang parkir batas lokasi tunjuk jalan tambah tingkat fasilitas dana dinas pariwisata,Pentingsari,
"Suasana perkampungan yg asri. Banyak pohon, bersih, dan makanan di warung simbok ok.",suasana perkampungan asri pohon bersih makanan warung simbok ok,suasana kampung asri pohon bersih makan warung simbok ok,Pentingsari,
Asri nan berbudaya,asri nan berbudaya,asri nan budaya,Pentingsari,
"Desa wisata yang terkenal, biasa digunakan Untuk acara pembelejaran siswa atau pu. Acata gethering perusahaan, akses masuk dan laham parkir untuk rombongan bus cukup memadai",desa wisata terkenal acara pembelejaran siswa acata gethering perusahaan akses laham parkir rombongan bus memadai,desa wisata kenal acara pembelejaran siswa acata gethering usaha akses laham parkir rombong bus pada,Pentingsari,
Suasana tenang dan asr,suasana tenang asr,suasana tenang asr,Pentingsari,
"Kesini pas nengok anak camping sekolah, tempatnya lumayan bagus, nyaman, parkir juga luas..",kesini pas menengok anak camping sekolah tempatnya lumayan bagus nyaman parkir luas,kesini pas tengok anak camping sekolah tempat lumayan bagus nyaman parkir luas,Pentingsari,
"Bagus banget parkir  luas, home stay banyak, pendopo  pertemuan juga banyak, kolam ikan banyak. Cocok untuk  perkemahan, outbond, gathering, reuni dll menu makanan  murah",bagus banget parkir luas home stay pendopo pertemuan kolam ikan cocok perkemahan outbond gathering reuni dll menu makanan murah,bagus banget parkir luas home stay pendopo temu kolam ikan cocok kemah outbond gathering reuni dll menu makan murah,Pentingsari,
Area perkemahan juga...asri...,area perkemahan asri,area kemah asri,Pentingsari,
Good Place,good place,good place,Pentingsari,
Lokasi recommended untuk outbond dan kemah,lokasi recommended outbond kemah,lokasi recommended outbond kemah,Pentingsari,
"Terawat, staff Lor Sambi cekatan pasangin tenda",terawat staff lor sambi cekatan pasangin tenda,awat staff lor sambi cekat pasangin tenda,Pentingsari,
"Bagus banget , di sana saya belajar cara membuat wayang dari rumput, membuat janur , membuat batik , dan belajar memainkan gamelan. Di sana juga asri banget tempat nya adem , sejuk , dingin pokoknya.orang orangnya juga ramah banget , saya suka .",bagus banget belajar wayang rumput janur batik belajar memainkan gamelan asri banget adem sejuk dingin pokoknya orangnya ramah banget suka,bagus banget ajar wayang rumput janur batik ajar main gamelan asri banget adem sejuk dingin pokok orang ramah banget suka,Pentingsari,
worth it,worth,worth,Pentingsari,
ramah semua orang orang nya,ramah,ramah,Pentingsari,
"Desa Wisata Pentingsari terletak di lereng Gunung Merapi, di daerah Sleman, Yogyakarta. Desa ini dikenal karena keindahan alamnya yang memukau, suasana pedesaan yang masih alami, serta keunikan budaya yang ditawarkan. Di Pentingsari, pengunjung bisa menikmati berbagai aktivitas wisata seperti trekking, menikmati pemandangan alam, berinteraksi dengan penduduk lokal, serta belajar tentang pertanian organik dan kerajinan tangan tradisional.

Desa ini juga terkenal dengan konsep ""wisata edukasi,"" di mana wisatawan dapat ikut serta dalam kegiatan sehari-hari masyarakat, seperti membuat makanan tradisional atau mengikuti workshop kerajinan..",desa wisata pentingsari terletak lereng gunung merapi daerah sleman yogyakarta desa dikenal keindahan alamnya memukau suasana pedesaan alami keunikan budaya ditawarkan pentingsari pengunjung menikmati aktivitas wisata trekking menikmati pemandangan alam berinteraksi penduduk lokal belajar pertanian organik kerajinan tangan tradisional desa terkenal konsep wisata edukasi wisatawan kegiatan sehari masyarakat makanan tradisional mengikuti workshop kerajinan,desa wisata pentingsari letak lereng gunung rapi daerah sleman yogyakarta desa kenal indah alam pukau suasana desa alami uni budaya tawar pentingsari unjung nikmat aktivitas wisata trekking nikmat pandang alam interaksi duduk lokal ajar tani organik rajin tangan tradisional desa kenal konsep wisata edukasi wisatawan giat hari masyarakat makan tradisional ikut workshop rajin,Pentingsari,
"sangat menyenangkan, untuk bapak dan ibunya juga asik2, tapi kurang tempat untuk bermain jadi hanya berkumpul di beberapa tempat",menyenangkan ibunya asik bermain berkumpul,senang ibu asik main kumpul,Pentingsari,
nice,nice,nice,Pentingsari,
"tempat nya bagus,pemandangan nya udah banyak pohon"" masih asri deh Kka"" ny juga ramah"",baik penduduknya  Friendly,tempat wisata nya banyak,pokoknya the beast deh ヾ(＾-＾)ノ",bagus pemandangan pohon asri kakak ramah penduduknya friendly wisata pokoknya the beast,bagus pandang pohon asri kakak ramah duduk friendly wisata pokok the beast,Pentingsari,
Bisa diriin tenda di aliran sungai.tp pas malam byk bgt serangga yg bikin mata bengul...,diriin tenda aliran sungai pas malam banget serangga bikin bengul,diriin tenda alir sungai pas malam banget serangga bikin bengul,Pentingsari,
sangat nyaman,nyaman,nyaman,Pentingsari,
Keren sejuk enak,keren sejuk,keren sejuk,Pentingsari,
"Suasana pedesaannya sangat kental. Bagus untuk study tour anak2. Banyak yang bisa dipelajari disini mulai dari menamam padi, membuat wedang jahe dan sejenisnya serta berlatih gamelan.",suasana pedesaannya kental bagus study tour anak dipelajari menamam padi wedang jahe sejenisnya berlatih gamelan,suasana desa kental bagus study tour anak ajar tamam padi wedang jahe jenis latih gamelan,Pentingsari,
Tempat mantap untuk rekreasi dan outbond.,mantap rekreasi outbond,mantap rekreasi outbond,Pentingsari,
"Ikut Jogja International Heritage Walk 2024, trus ke sini. Desanya asri, trus banyak produk kearifan lokalnya, seruu.",jogja international heritage walk desanya asri produk kearifan lokalnya seru,jogja international heritage walk desa asri produk arif lokal seru,Pentingsari,
"Desa Wisata Pentingsari, PENTING BANGET..
Ada alat pengelolaan sampah botol plastik yg baru saya temui di dewis ini, serta alat tersebut dukungan dari suatu bank dalam aksinya mendukung program pengelolaan sampah.

Kopi madu merapi recommended, apalagi di buat kopi susu tarik.

Edukasi gamelan cukup interaktif, dengan bapak pelatih ramah"".

Bakal kangen untuk balik berkunjung maupun berwisata ke desa wisata ini, karena masih banyak spot dan atraksi wisata lain yang belum dikulik dan dicoba😍✨",desa wisata pentingsari banget alat pengelolaan sampah botol plastik temui dewis alat dukungan bank aksinya mendukung program pengelolaan sampah kopi madu merapi recommended kopi susu tarik edukasi gamelan interaktif pelatih ramah kangen berkunjung berwisata desa wisata spot atraksi wisata dikulik dicoba,desa wisata pentingsari banget alat kelola sampah botol plastik temu dewis alat dukung bank aksi dukung program kelola sampah kopi madu rapi recommended kopi susu tarik edukasi gamelan interaktif latih ramah kangen kunjung wisata desa wisata spot atraksi wisata lik coba,Pentingsari,
"Terimakasih untuk desa Dewi pentingsari atas sambutan yang diberikan, tentunya sangat pusa happy lingkungan yang masih asri dan terimakasih bakti BCA atas undangannya.  Hari ini happy bersama teman teman lainnya, bertemu dengan teman baru have fun bareng bakti BCA. Untuk tahun depan semoga diundang lagi diajak lagi terimakasih Bakti BCA...",terimakasih desa dewi pentingsari sambutan pusa happy lingkungan asri terimakasih bakti baca undangannya happy teman teman bertemu teman have fun bareng bakti baca tahun semoga diundang diajak terimakasih bakti baca,terimakasih desa dewi pentingsari sambut pusa happy lingkung asri terimakasih bakti baca undang happy teman teman temu teman have fun bareng bakti baca tahun moga undang ajak terimakasih bakti baca,Pentingsari,
Seru gokil abis,seru gila habis,seru gila habis,Pentingsari,
Mantab..Desa Bersih dan Anggun dan Asri..,mantab desa bersih anggun asri,mantab desa bersih anggun asri,Pentingsari,
"Salah satu desa wisata terbaik yang pernah dikunjungi, selain suasana pedesaannya yang sejuk, penduduknya juga ramah ramah dan banyak sentra sentra kerajinan yang bisa dikunjungi",salah desa wisata terbaik dikunjungi suasana pedesaannya sejuk penduduknya ramah ramah sentra sentra kerajinan dikunjungi,salah desa wisata baik kunjung suasana desa sejuk duduk ramah ramah sentra sentra rajin kunjung,Pentingsari,
"Berkunjung ke desa wisata ini ketika ada event Jogja International Heritage Walk.
Suasana pedesaan, asri, masih banyak dijumpai sawah dan pepohonan.",berkunjung desa wisata event jogja international heritage walk suasana pedesaan asri dijumpai sawah pepohonan,kunjung desa wisata event jogja international heritage walk suasana desa asri jumpa sawah pohon,Pentingsari,
Bagus tempat wisata sama homestay ya yaman yg bapak dan ibu ya baik banget welcome.keren buat referens badan,bagus wisata homestay yaman banget welcome keren referens badan,bagus wisata homestay yaman banget welcome keren referens badan,Pentingsari,
"Pertama kali datang ke Desa Wisata Pentingsari, Sleman untuk mengikuti JIHW. Daerahnya bersih, asri, serta penduduknya ramah. Rute untuk berjalannya lumayan menantang karena kondisi jalan yang naik-turun.",desa wisata pentingsari sleman mengikuti jihw daerahnya bersih asri penduduknya ramah rute berjalannya lumayan menantang kondisi jalan turun,desa wisata pentingsari sleman ikut jihw daerah bersih asri duduk ramah rute jalan lumayan tantang kondisi jalan turun,Pentingsari,
"Sangat Asri, Cocok untuk rombongan yang mengadakan acara disini",asri cocok rombongan mengadakan acara,asri cocok rombong ada acara,Pentingsari,
"Adem, suasananya masih natural......",adem suasananya natural,adem suasana natural,Pentingsari,
Di situ tempat saya live in Dari Sekolah Dian Harapan Jambi dan Bangka tempat nya adem tapi kalau malam sangat dingin,situ live sekolah dian harapan jambi bangka adem malam dingin,situ live sekolah dian harap jambi bangka adem malam dingin,Pentingsari,
Tempatnya bagus dan orangnya ramah2 semuaa,tempatnya bagus orangnya ramah semuaa,tempat bagus orang ramah semuaa,Pentingsari,
keren,keren,keren,Pentingsari,
mantap banget seruu,mantap banget seru,mantap banget seru,Pentingsari,
Penuh experience,penuh experience,penuh experience,Pentingsari,
Keren banget harus balik lagi!,keren banget,keren banget,Pentingsari,
Sangat menyenangkan dan seru . Pembelajaran dan ilmu yang di dapat tidak hanya belajar tetapi berlibur dengna cara yang sangat menyenangkan,menyenangkan seru pembelajaran ilmu belajar berlibur dengna menyenangkan,senang seru ajar ilmu ajar libur dengna senang,Pentingsari,
Seru dan banyak hal menarik yang bisa dipelajari dan pengalaman live experience! Bukan hanya kata-kata atau teori saja tapi bisa sambil mengalami. Semuanya ramah welcoming dan baik ❤️,seru menarik dipelajari pengalaman live experience teori mengalami ramah welcoming,seru tarik ajar alam live experience teori alami ramah welcoming,Pentingsari,
Good,good,good,Pentingsari,
Desanya keren dan hommy,desanya keren hommy,desa keren hommy,Pentingsari,
"Tempatnya tenang, asyik untuk camp",tempatnya tenang asyik camp,tempat tenang asyik camp,Pentingsari,
baguss seruu bgt homestaynya nyaman bersih orangnya ramahh makanannya enakkkkk suasananya juga enak bgt videonya juga kerenn,bagus seru banget homestaynya nyaman bersih orangnya ramahh makanannya suasananya banget videonya keren,bagus seru banget homestaynya nyaman bersih orang ramahh makan suasana banget video keren,Pentingsari,
"Tempat yang bagus, saya baru abis dari desa itu",bagus habis desa,bagus habis desa,Pentingsari,
"bagus bgt, orangnya ramah, bisa tau budaya budaya, viewnya cakep, recomended bgt deeehhhh 🫰🫰",bagus banget orangnya ramah tau budaya budaya viewnya cakep recomended banget deeehhhh,bagus banget orang ramah tau budaya budaya viewnya cakep recomended banget deeehhhh,Pentingsari,
seru bgt sukaa!warganya ramah bgt❤️❤️,seru banget suka warganya ramah banget,seru banget suka warga ramah banget,Pentingsari,
"NYAMANNN BANGETT SERUUU, bakal kangen kesinii asri bangett sejukk",nyamannn banget seru kangen kesini asri banget sejukk,nyamannn banget seru kangen kesini asri banget sejukk,Pentingsari,
"Hari pertama disini saya melihat 4 ekor anjing depan homestay, hari terakhir disini saya melihat 4 ekor teman depan homestay",ekor anjing homestay ekor teman homestay,ekor anjing homestay ekor teman homestay,Pentingsari,
"Sangat nyaman disini, aman dan tentram. Rekomen banget sih yg mau cari desa wisata di jogja. ""Berkunjunglah kembali sebagai saudara, bukan sebagai tamu"" 🥹🥹",nyaman aman tentram rekomen banget cari desa wisata jogja berkunjunglah saudara tamu,nyaman aman tentram rekomen banget cari desa wisata jogja kunjung saudara tamu,Pentingsari,
mantap untuk pengalamannya seru seruu semuaaa,mantap pengalamannya seru seru,mantap alam seru seru,Pentingsari,
Desa yg luar biasa memberi edukasi,desa edukasi,desa edukasi,Pentingsari,
Seharian berkunjung ke desa ini dan sangat menarik menyaksikan kesederhanaan masyarakat desa dalam kesehariannya dan takjub dengan kepemimpinan para penggerak desa wisata ini yg sanggup berkembang dengan baik..,seharian berkunjung desa menarik menyaksikan kesederhanaan masyarakat desa kesehariannya takjub kepemimpinan penggerak desa wisata sanggup berkembang,hari kunjung desa tarik saksi sederhana masyarakat desa hari takjub pimpin gerak desa wisata sanggup kembang,Pentingsari,
"Mari dukung desa wisata pentingsari.
Cocok utk lebih dari 5 org krn buat main gamelannya asyik",mari dukung desa wisata pentingsari cocok main gamelannya asyik,mari dukung desa wisata pentingsari cocok main gamelan asyik,Pentingsari,
"desa dengan daya tariknya tersendiri, memiliki berbagai objek wisata yang tifak biasa, masyarakat yang sangat ramah menjadi poin utama sehingga bisa menikmati dan merasakan hidup di desa dengan value dan kearifan lokalnya",desa daya tariknya tersendiri memiliki objek wisata tifak masyarakat ramah poin utama menikmati merasakan hidup desa value kearifan lokalnya,desa daya tarik sendiri milik objek wisata tifak masyarakat ramah poin utama nikmat rasa hidup desa value arif lokal,Pentingsari,
"Banyak homestay, sejuk dan ramah2. Pelayanan prima dan keren",homestay sejuk ramah pelayanan prima keren,homestay sejuk ramah layan prima keren,Pentingsari,
"Top, kreatif, alami👍",top kreatif alami,top kreatif alami,Pentingsari,
Tempatnya memamg dibuat untuk camp dan kegiatan outbond..namun jalan menuju ke sana seperti labirin,tempatnya memamg camp kegiatan outbond jalan labirin,tempat memamg camp giat outbond jalan labirin,Pentingsari,
"Ini desa wisata
Salah satu desa yg berkembang dan desanya di well maintained dan bersih
Untuk kegiatan student trip 3 hari 2 malam wuoke banget ..letaknya 45-1 jam dari jogya",desa wisata salah desa berkembang desanya well maintained bersih kegiatan student trip malam wuoke banget letaknya jam jogya,desa wisata salah desa kembang desa well maintained bersih giat student trip malam wuoke banget letak jam jogya,Pentingsari,
"Tempat untuk acara kumpul2,suasana asri,sejuk,tempat mengenalkan anak2 tentang alam.",acara kumpul suasana asri sejuk mengenalkan anak alam,acara kumpul suasana asri sejuk kenal anak alam,Pentingsari,
Tempatnya syahdu pol,tempatnya syahdu pol,tempat syahdu pol,Pentingsari,
Mau nyewa buat 15 org..Padahal warga cangkringan juga..tapi harus minimal 40 org buat sewa tempat nya,nyewa warga cangkringan minimal sewa,nyewa warga cangkring minimal sewa,Pentingsari,
Bagus sekali untuk program studi pendidikan dan kemandirian anak....,bagus program studi pendidikan kemandirian anak,bagus program studi didik mandiri anak,Pentingsari,
tempat nya bersih rapi kamar mandi memadai buat masyarakat yang menggunakan buat camping,bersih rapi kamar mandi memadai masyarakat camping,bersih rapi kamar mandi pada masyarakat camping,Pentingsari,
Desa wisata yg sungguh luar bias,desa wisata sungguh bias,desa wisata sungguh bias,Pentingsari,
Penginapan Pak Amrullah Yusuf,penginapan amrullah yusuf,inap amrullah yusuf,Pentingsari,
"Desa wisata di kaki merapi, asri banget dan rapi",desa wisata kaki merapi asri banget rapi,desa wisata kaki rapi asri banget rapi,Pentingsari,
"Desa wisata yang luar biasa pelayanannya, Desa yang Memajukan Ekonomi Rakyatnya, Rekomendasi Untuk Pelajar😊",desa wisata pelayanannya desa memajukan ekonomi rakyatnya rekomendasi pelajar,desa wisata layan desa maju ekonomi rakyat rekomendasi ajar,Pentingsari,
Sejuk dan indah,sejuk indah,sejuk indah,Pentingsari,
Akses jalan kurang memadai,akses jalan memadai,akses jalan pada,Pentingsari,
"Senang berkunjung ke Desa Penting Sari dalam rangka study tiru  Forum Badan Permusyawaratan Nagari(BPN) Kabupaten Solok
Banyak Pengalaman yang kami dapat  tentang Desa Wisata Penting Sari terbaik di Indonesia",senang berkunjung desa sari rangka study tiru forum badan permusyawaratan nagari bpn kabupaten solok pengalaman desa wisata sari terbaik indonesia,senang kunjung desa sari rangka study tiru forum badan musyawarat nagari bpn kabupaten solok alam desa wisata sari baik indonesia,Pentingsari,
bagussss,bagus,bagus,Pentingsari,
Bagus unntuk satae sama keluarga.,bagus unntuk satae keluarga,bagus unntuk satae keluarga,Pentingsari,
Bu tuting,bu tuting,bu tuting,Pentingsari,
"Tempatnya pas u kemah anak2, tp jalan ke lokasi masih kecil jadi kalau mobil berpapasan agak sulit berjalan",tempatnya pas kemah anak jalan lokasi mobil berpapasan sulit berjalan,tempat pas kemah anak jalan lokasi mobil papas sulit jalan,Pentingsari,
Menyenangkan damai di tengah pedesaan,menyenangkan damai tengah pedesaan,senang damai tengah desa,Pentingsari,
Tempat nyaman..adem bgt..asri..homestay rmh warga..,nyaman adem banget asri homestay rumah warga,nyaman adem banget asri homestay rumah warga,Pentingsari,
Sejuk,sejuk,sejuk,Pentingsari,
"Lokasi nyaman untuk kegiatan outbond,camping.fasilitas mck banyak,sumber air melimpah.",lokasi nyaman kegiatan outbond camping fasilitas mck sumber air melimpah,lokasi nyaman giat outbond camping fasilitas mck sumber air limpah,Pentingsari,
Kawasannya masih asri banget bangak pohon2 besar,kawasannya asri banget bangak pohon,kawasan asri banget bangak pohon,Pentingsari,
