review,cleaned_review,cleaned_review_stemmed,nama desa wisata,provinsi
"dewi peri atau desa wisata petingsari, dilrngkapi dengan warung makan khas desa. Warunge simbok, kapasitas bisa menampung 700 peserta acara camping",dewi peri desa wisata petingsari dilrngkapi warung makan khas desa warunge simbok kapasitas menampung peserta acara camping,dewi peri desa wisata petingsari dilrngkapi warung makan khas desa warunge simbok kapasitas tampung serta acara camping,Pentingsari,
"tempat yang pas buat melepas lelah dari hiruk pikuknya aktifitas kota,coba dech stay 1 or 2 malam di home stay yang disediakan oleh warga. suasananya benar-benar tenang dan sepi",pas melepas lelah hiruk pikuknya aktifitas kota coba stay malam home stay disediakan warga suasananya tenang sepi,pas lepas lelah hiruk pikuknya aktifitas kota coba stay malam home stay sedia warga suasana tenang sepi,Pentingsari,
"Salah satu desa wisata favorit di jogja. berada di daerah merapi. di tempat ini yang pernah kurasakan bersama tempatku mengajar adalah mengikuti kegiatan live in, kemah, fieldtrip dll.

ada lapangan ada gazebo ada permainan cocok untuk kegiatan outing dan outbound",salah desa wisata favorit jogja daerah merapi kurasakan tempatku mengajar mengikuti kegiatan live kemah fieldtrip dll lapangan gazebo permainan cocok kegiatan outing outbound,salah desa wisata favorit jogja daerah rapi rasa tempat ajar ikut giat live kemah fieldtrip dll lapang gazebo main cocok giat outing outbound,Pentingsari,
Jalan kaki pagi di desa pentingsari sangat nyaman ....jgn lupa sarapan di omahe simbok....,jalan kaki pagi desa pentingsari nyaman lupa sarapan omahe simbok,jalan kaki pagi desa pentingsari nyaman lupa sarap omahe simbok,Pentingsari,
Tempat yg nyaman utk keluarga menikmati suasana desa,nyaman keluarga menikmati suasana desa,nyaman keluarga nikmat suasana desa,Pentingsari,
"Mantap, harus mampir kalau baru di Jogja.",mantap mampir jogja,mantap mampir jogja,Pentingsari,
Tempatnya nyaman dan bersih,tempatnya nyaman bersih,tempat nyaman bersih,Pentingsari,
