review,cleaned_review,cleaned_review_stemmed,nama desa wisata,provinsi
Tempat ini lumayan bagus untuk dikunjungi sebagai tempat outbond atau kegiatan rombongan lainnya. Tempatnya sejuk dan punya banyak potensi yang bisa dikembangkan terus sebagai sebuah desa wisata. Bisa ditambahkan beberapa atraksi yang dapat menambah minat wisatawan baik lokal maupun wisatawan asing.,lumayan bagus dikunjungi outbond kegiatan rombongan tempatnya sejuk potensi dikembangkan desa wisata atraksi menambah minat wisatawan lokal wisatawan asing,lumayan bagus kunjung outbond giat rombong tempat sejuk potensi kembang desa wisata atraksi tambah minat wisatawan lokal wisatawan asing,Pentingsari,
toiletnya bersih warganya ramah,toiletnya bersih warganya ramah,toilet bersih warga ramah,Pentingsari,
Sipp.. Tempatnya asrii,sip tempatnya asrii,sip tempat asri,Pentingsari,
Kemah Saka Kalpataru Kota Yogyakarta 2024,kemah saka kalpataru kota yogyakarta,kemah saka kalpataru kota yogyakarta,Pentingsari,
Suasananya desanya sejuk,suasananya desanya sejuk,suasana desa sejuk,Pentingsari,
Di desa nya enak banget dingin sejuk pokoknya jadi pengen kesana lagi,desa banget dingin sejuk pokoknya pengin kesana,desa banget dingin sejuk pokok pengin kesana,Pentingsari,
"Desanya masih asri dan banyak homestay disediakan disini, sayang warung jajanannya sedikit,",desanya asri homestay disediakan sayang warung jajanannya,desa asri homestay sedia sayang warung jajan,Pentingsari,
Pemilik homestay nya baik orang nya ramah ramah,pemilik homestay ramah ramah,milik homestay ramah ramah,Pentingsari,
Pas kemah di situ Susana nya enakkk. Pas pulang kangen pengen kemah di situ lagi.,pas kemah situ susana enakkk pas pulang kangen pengin kemah situ,pas kemah situ susana enakkk pas pulang kangen pengin kemah situ,Pentingsari,
"Tempat yg bagus, sejuk penduduknya humble...cocok dah buat homestay",bagus sejuk penduduknya humble cocok homestay,bagus sejuk duduk humble cocok homestay,Pentingsari,
Tempatnya enak untuk berkegiatan dan penduduknya ramah,tempatnya berkegiatan penduduknya ramah,tempat giat duduk ramah,Pentingsari,
bau ikan asin,bau ikan asin,bau ikan asin,Pentingsari,
"tempat nyaa seruuu bangettt yang pasti banyak banget kenangan di sanaa, jadi gamon sama Jogja dehh 😁",seru banget banget kenangan sanaa gamon jogja,seru banget banget kenang sanaa gamon jogja,Pentingsari,
Desanya sejuk,desanya sejuk,desa sejuk,Pentingsari,
Sangat asri dan sejuk,asri sejuk,asri sejuk,Pentingsari,
"Wargamya ramah-ramah, baik hati, homestay harga terjangkau, makanannya enak-enak. Terima kasih 🙏",wargamya ramah ramah hati homestay harga terjangkau makanannya terima kasih,wargamya ramah ramah hati homestay harga jangkau makan terima kasih,Pentingsari,
"Tempatnya sangat terorganisir menurut saya. Aman, nyaman, asri, cocok untuk makrab bersama teman-teman",tempatnya terorganisir aman nyaman asri cocok makrab teman teman,tempat organisir aman nyaman asri cocok makrab teman teman,Pentingsari,
"tempatnya enak, adem, gak terlalu ramai juga",tempatnya adem ramai,tempat adem ramai,Pentingsari,
"Dua malam dua hari berada di desa wisata Pentingsari merupakan momen-momen yang akan terus saya rindukan. Keramah tambahan warganya, obrolan malam di beranda teras rumah ditemani alunan melodi binatang malam yang semakin menambah kesyahduan malam di desa pentingsari

Dan kegiatan dan destinasi wisata yang tidak pernah habis untuk memikat siapapun yang pergi untuk datang berkunjung kemari

Berkunjung kemari seperti membuat kami berada dekat dengan rumah yang bentangan kilometer nun jauh disana

Semoga kelak bisa kembali hadir kembali di tengah-tengah keramahan dan keharmonisan masyarakat Pentingsari",malam desa wisata pentingsari momen momen rindukan keramah tambahan warganya obrolan malam beranda teras rumah ditemani alunan melodi binatang malam menambah kesyahduan malam desa pentingsari kegiatan destinasi wisata habis memikat pergi berkunjung kemari berkunjung kemari rumah bentangan kilometer nun disana semoga kelak hadir tengah tengah keramahan keharmonisan masyarakat pentingsari,malam desa wisata pentingsari momen momen rindu ramah tambah warga obrol malam beranda teras rumah tani alun melodi binatang malam tambah syahdu malam desa pentingsari giat destinasi wisata habis mikat pergi kunjung kemari kunjung kemari rumah bentang kilometer nun sana moga kelak hadir tengah tengah ramah harmonis masyarakat pentingsari,Pentingsari,
Pas kesana nda ada pengurus nya...,pas kesana indak pengurus,pas kesana indak urus,Pentingsari,
rute jln tiap hari,rute jalan,rute jalan,Pentingsari,
Siiipppp,siiipppp,siiipppp,Pentingsari,
Dusun yang asri sejuk dan juga berbudaya,dusun asri sejuk berbudaya,dusun asri sejuk budaya,Pentingsari,
Istimewa,istimewa,istimewa,Pentingsari,
Mantapp untuk acara ngafemm,mantap acara ngafemm,mantap acara ngafemm,Pentingsari,
"Pertama kali kesini, tempat yang bagus, desa wisata yg menyenangkan, menyegarkan dan asri. Ada warung untuk makannya, ada mushala, ada tempat camping, ada lapangan dan beberapa aktivitas lainnya.",kesini bagus desa wisata menyenangkan menyegarkan asri warung makannya mushala camping lapangan aktivitas,kesini bagus desa wisata senang segar asri warung makan mushala camping lapang aktivitas,Pentingsari,
"Salah satu Desa wisata di Sleman, Jogja",salah desa wisata sleman jogja,salah desa wisata sleman jogja,Pentingsari,
"MasyaAllah tiba tiba keinget jaman SMA 8 yogyakarta, 2009-2012 pernah 2x homestay disini, bahkan acara foto yearbook aku ambil tema disini 🥰 kapan2 kalo ada sempat ke Jogja ajak suami dan anak main kesini insyaAllah..
Pertama aku dapat tempat di rumah (udah lupa) nama bapak ibu yg punya rumahnya, yg deket kopi madukoro, misal kesana pas musim manggis pasti pulange dibawain manggis se kresek. Yg kedua nggak ada yang diingat sama sekali aku kebagian tempat di rumah bapak ibu yang mana, atau sama ya waktu ituu aah lupaaa..
Yang jelas memorinya dapet banget, suasananya, setiap mau main ke tempate temen lewatin kebon kanan kiri yang gelap kalo udah sore, ngajarin anak2 SD (kaya KKN gitu), outbound, belajar tentang komoditas lokal dari penanaman , panen, sampe pengolahan, setiap malam kumpul di joglo yang jauh dari rumah inap aku, kalo mau pergi kudu tunggu2an sama temen2 yang lain, belajar masak di pawon pake kayu (ya ini mah sering liat di rumah nenek), nggak kerasa udah hampir 15 tahun yang lalu ya aku ke Dewi Peri ini. Sukses selalu ya.. Semoga makin banyak dikenal, makin ramai pengunjungnya..",masyaallah jaman yogyakarta homestay acara foto yearbook ambil tema kalo jogja ajak suami anak main kesini insyaallah rumah lupa nama rumahnya kopi madukoro kesana pas musim manggis pulange dibawain manggis kresek kebagian rumah waktu aah lupaaa memorinya banget suasananya main tempate teman lewatin kebon kanan kiri gelap kalo sore mengajari anak sd kayak kkn outbound belajar komoditas lokal penanaman panen pengolahan malam kumpul joglo rumah inap kalo pergi kudu tunggu an teman belajar masak pawon pakai kayu rumah nenek kerasa tahun dewi peri sukses semoga dikenal ramai pengunjungnya,masyaallah jaman yogyakarta homestay acara foto yearbook ambil tema kalo jogja ajak suami anak main kesini insyaallah rumah lupa nama rumah kopi madukoro kesana pas musim manggis pulange dibawain manggis kresek bagi rumah waktu aah lupaaa memori banget suasana main tempate teman lewatin kebon kanan kiri gelap kalo sore ajar anak sd kayak kkn outbound ajar komoditas lokal tanam panen olah malam kumpul joglo rumah inap kalo pergi kudu tunggu an teman ajar masak pawon pakai kayu rumah nenek rasa tahun dewi peri sukses moga kenal ramai unjung,Pentingsari,
Desanya silent tp penuh dinamika di dalamnya..ada progres yg pelan  tapi pesat yg didapat..,desanya silent penuh dinamika dalamnya progres pelan pesat,desa silent penuh dinamika dalam progres pelan pesat,Pentingsari,
"Tempatnya nyaman, banyak ilmu yang didapat",tempatnya nyaman ilmu,tempat nyaman ilmu,Pentingsari,
"warganya ramah2, homestay nya bersih, makanannya enak",warganya ramah homestay bersih makanannya,warga ramah homestay bersih makan,Pentingsari,
"Banyak ilmu yang dapat diperoleh dari sini desa wisata penting sari
Mantab",ilmu diperoleh desa wisata sari mantab,ilmu oleh desa wisata sari mantab,Pentingsari,
Sangat menyenangman berada di Desa ini. Warga2nya sangat ramah dan tempatnya asri serta banyak kegiatan yang bisa dilakukan.,menyenangman desa warga ramah tempatnya asri kegiatan,menyenangman desa warga ramah tempat asri giat,Pentingsari,
"Untuk olahraga bersepeda, hawanya sejuk",olahraga bersepeda hawanya sejuk,olahraga sepeda hawa sejuk,Pentingsari,
Seneng,senang,senang,Pentingsari,
Pendompo nya,pendompo,pendompo,Pentingsari,
"Nyaman,ramah, dan seru",nyaman ramah seru,nyaman ramah seru,Pentingsari,
nyaman makanan enak,nyaman makanan,nyaman makan,Pentingsari,
Tempat yg menarik. Suasana desa yang tenang dan teduh. Homestay-nya murah 100rb-an. Buat yg ingin merasakan bermalam di desa boleh dicoba.,menarik suasana desa tenang teduh homestay murah ribu an merasakan bermalam desa dicoba,tarik suasana desa tenang teduh homestay murah ribu an rasa malam desa coba,Pentingsari,
Best  Education Vacation,best education vacation,best education vacation,Pentingsari,
Sejuk asri,sejuk asri,sejuk asri,Pentingsari,
"Desa wisata yg lengkap untuk dijelajahi.. Camping groundnya yg harus antri sudah cukup jd bukti banyaknya peminat yg kemari. Semoga pengelola bisa menambah, menjaga & memperbaiki prasarana yg kurang memadai..",desa wisata lengkap dijelajahi camping groundnya antri bukti banyaknya peminat kemari semoga pengelola menambah menjaga memperbaiki prasarana memadai,desa wisata lengkap jajah camping groundnya antri bukti banyak minat kemari moga kelola tambah jaga baik prasarana pada,Pentingsari,
Suasana pedesaan nan natural dan alami dengan udara segar yang sangat tepat dalam membawa nuansa kegiatan di alam dalam bentuk Live In bagi para siswa sekolah khususnya SMP agar wawasan dan pengalaman mereka terhadap lingkungan menjadi lebih luas serta membentuk karakter yang tangguh dan peduli.,suasana pedesaan nan natural alami udara segar membawa nuansa kegiatan alam bentuk live siswa sekolah wawasan pengalaman lingkungan luas membentuk karakter tangguh peduli,suasana desa nan natural alami udara segar bawa nuansa giat alam bentuk live siswa sekolah wawas alam lingkung luas bentuk karakter tangguh peduli,Pentingsari,
"Seru bangett, orang orangnya ramah",seru banget orangnya ramah,seru banget orang ramah,Pentingsari,
Tempatnya adem dan asri,tempatnya adem asri,tempat adem asri,Pentingsari,
"Tempatnya sejuk banyak pohon, warga nya ramah, akses masuk mudah, jalan bagus",tempatnya sejuk pohon warga ramah akses mudah jalan bagus,tempat sejuk pohon warga ramah akses mudah jalan bagus,Pentingsari,
Keren,keren,keren,Pentingsari,
Seru,seru,seru,Pentingsari,
Terima.kasih kepada seluruh warga DS. PETINGSARI..WPNDERFUL PLACE..,terima kasih warga ds petingsari wpnderful place,terima kasih warga ds petingsari wpnderful place,Pentingsari,
"kemarin studytour kesana tempatnya bisa dijadikan tempat berlibur, sangat asri tempatnya, sejuk, orang disana ramah ramah, pemilik homestay sangat ramah sekali, banyak sekali tempat yang bisa dikunjungi di dalamnya, semogaa bisa kesana lagi, thank u pengalamannya desa pentingsari",kemarin studytour kesana tempatnya dijadikan berlibur asri tempatnya sejuk disana ramah ramah pemilik homestay ramah dikunjungi dalamnya semoga kesana thank pengalamannya desa pentingsari,kemarin studytour kesana tempat jadi libur asri tempat sejuk sana ramah ramah milik homestay ramah kunjung dalam moga kesana thank alam desa pentingsari,Pentingsari,
"Tempat ibadah kurang,ga ada fasilitas seperti tikar",ibadah fasilitas tikar,ibadah fasilitas tikar,Pentingsari,
"seruuu bangetttt + orang nya ramah ramah, anw aku anak sman 5 bekasi💝",seru banget ramah ramah anw anak sman bekasi,seru banget ramah ramah anw anak sman bekas,Pentingsari,
"Sangat bagus
Induk Semangnya sangat baik dan ramah, udaranya sejuk dan banyak pengalaman yang saya dapatkan di sini. Semoga kapan-kapan saya bisa ke sini lagi👍",bagus induk semangnya ramah udaranya sejuk pengalaman dapatkan semoga,bagus induk semang ramah udara sejuk alam dapat moga,Pentingsari,
"Belajar dialamnya
Mendapatkan pengalaman baru
Seru pokoknya.....",belajar dialamnya pengalaman seru pokoknya,ajar alam alam seru pokok,Pentingsari,
Kerennn    masyarakatnya sangat bersahabat... Buat explore aktivitas anak2  keren,keren masyarakatnya bersahabat explore aktivitas anak keren,keren masyarakat sahabat explore aktivitas anak keren,Pentingsari,
"Buat study tour mantep sih ini,ada acara susur sungai,membatik,cara pembuatan kopi,makanan lokal,bikin wayang,dll",study tour mantap acara susur sungai membatik pembuatan kopi makanan lokal bikin wayang dll,study tour mantap acara susur sungai batik buat kopi makan lokal bikin wayang dll,Pentingsari,
"Cocok untuk study tour atau kunjungan yang berkelompok,pemandanganya juga gokill",cocok study tour kunjungan berkelompok pemandanganya gila,cocok study tour kunjung kelompok pemandanganya gila,Pentingsari,
oke,oke,oke,Pentingsari,
Mantap!!!,mantap,mantap,Pentingsari,
"Berasa malas pulang deh klo udh sampai di sini... Ramah, makanannya enak, homestay nya nyaman, bersih",berasa malas pulang kalo ramah makanannya homestay nyaman bersih,asa malas pulang kalo ramah makan homestay nyaman bersih,Pentingsari,
Ngangenin! Biar bintang yang berbicara.,ngangenin biar berbicara,ngangenin biar bicara,Pentingsari,
bakso tempat warungnya wenak tenan buintang lima wenak poll!!!!!!!!!!!!!!!,bakso warungnya tenan buintang poll,bakso warung tenan buintang poll,Pentingsari,
Lumayan untuk mengenang masa kecil dikampung,lumayan mengenang dikampung,lumayan kenang kampung,Pentingsari,
Desa Wisata Pentingsari,desa wisata pentingsari,desa wisata pentingsari,Pentingsari,
"Desa wisata dengan view pepohonan hijau,",desa wisata view pepohonan hijau,desa wisata view pohon hijau,Pentingsari,
"Desa wisata ini sering digunakan buat wisata edukasi dan outbond
Wisatawan kebanyakan dari anak sekolah maupun kampus dan disana bisa belajar membuat eko enzym, anyaman tikar, bermain gamelan, mengolah kopi dll
Ada beberapa homestay juga buat menginap disana 👍",desa wisata wisata edukasi outbond wisatawan kebanyakan anak sekolah kampus disana belajar eko enzym anyaman tikar bermain gamelan mengolah kopi dll homestay menginap disana,desa wisata wisata edukasi outbond wisatawan banyak anak sekolah kampus sana ajar eko enzym anyam tikar main gamelan olah kopi dll homestay inap sana,Pentingsari,
"Tempatnya cozy banget, adem, cocok buat acara keluarga besar",tempatnya cozy banget adem cocok acara keluarga,tempat cozy banget adem cocok acara keluarga,Pentingsari,
sejuk dan asri,sejuk asri,sejuk asri,Pentingsari,
"Desa wisata yg menawarkan keindahan alam serta pengalaman membatik,memainkan gamelan,susur sungai, warga ramah sekali.",desa wisata menawarkan keindahan alam pengalaman membatik memainkan gamelan susur sungai warga ramah,desa wisata tawar indah alam alam batik main gamelan susur sungai warga ramah,Pentingsari,
"Desa yg asri, penduduk yg ramah, suasana yg sejuk, memberikan ketenangan dan kenyamanan 🥰",desa asri penduduk ramah suasana sejuk ketenangan kenyamanan,desa asri duduk ramah suasana sejuk tenang nyaman,Pentingsari,
Bagus tempatnya,bagus tempatnya,bagus tempat,Pentingsari,
Asik buat outbond . Kembali ke alam . Makanannya khas ndeso,asik outbond alam makanannya khas ndeso,asik outbond alam makan khas ndeso,Pentingsari,
"Tempatnya nyaman,sejuk dgn nuansa pedesaan.",tempatnya nyaman sejuk nuansa pedesaan,tempat nyaman sejuk nuansa desa,Pentingsari,
Suasana alam buat outbound sangat cocok recomended buat cari hawa sejuk disini,suasana alam outbound cocok recomended cari hawa sejuk,suasana alam outbound cocok recomended cari hawa sejuk,Pentingsari,
Good environment,good environment,good environment,Pentingsari,
inspiratif sekali... mantap!   banyak memberi ilham bagi daerah2 lain utk bangkit dari 'kegelapan'.   semangat utk maju dgn kegotongroyongan dalam mengexplore potensi dan kearifan lokal.,inspiratif mantap ilham daerah bangkit kegelapan semangat maju kegotongroyongan mengexplore potensi kearifan lokal,inspiratif mantap ilham daerah bangkit gelap semangat maju kegotongroyongan mengexplore potensi arif lokal,Pentingsari,
"Tempat wisata tema sawah dan desa

Saya bilang disini orang2nya sangat ramah dan baik... mereka benar2 tau bagaimana memfasilitasi tamu dengan baik.

Selain menanam padi ada juga wisata flying fox, camp, dan arung jeram

Maksimal banget klo kesini bersama keluarga dan teman2",wisata tema sawah desa bilang ramah tau memfasilitasi tamu menanam padi wisata flying fox camp arung jeram maksimal banget kalo kesini keluarga teman,wisata tema sawah desa bilang ramah tau fasilitas tamu tanam padi wisata flying fox camp arung jeram maksimal banget kalo kesini keluarga teman,Pentingsari,
Desa wisata alam pedesaan sederhana dengan masyarakat yang hebat,desa wisata alam pedesaan sederhana masyarakat hebat,desa wisata alam desa sederhana masyarakat hebat,Pentingsari,
Tempat yang tenang untuk menyepi,tenang menyepi,tenang nyepi,Pentingsari,
"Desa ini tenang banget. Banyak homestaynya. Cocok untuk kegiatan mahasiswa dan remaja belajar budaya masyarakat setempat dan camping bareng.Harus tinggal disana untuk merasakan desa ini. Tanpa ada kunjungan/acara desa ini sepi tidak ada aktivitas,",desa tenang banget homestaynya cocok kegiatan mahasiswa remaja belajar budaya masyarakat camping bareng tinggal disana merasakan desa kunjungan acara desa sepi aktivitas,desa tenang banget homestaynya cocok giat mahasiswa remaja ajar budaya masyarakat camping bareng tinggal sana rasa desa kunjung acara desa sepi aktivitas,Pentingsari,
kegiatan homestay yg seru ada membatik..nari.. bikin kopi..dan mendesa pokoknyaaa...,kegiatan homestay seru membatik menari bikin kopi mendesa pokoknyaaa,giat homestay seru batik tari bikin kopi desa pokoknyaaa,Pentingsari,
"twmpatnya super duperr cozy bgtt, ada kolam ikannya yg cantikk",twmpatnya super duperr cozy banget kolam ikannya cantik,twmpatnya super duperr cozy banget kolam ikan cantik,Pentingsari,
Tempat yg nyaman sejuk dn menyegarkan.,nyaman sejuk menyegarkan,nyaman sejuk segar,Pentingsari,
"Tempat wisata yang sangat menarik untuk dikunjungi. Tempat wisata ini dikelola oleh kelompok pemuda.

Tersedianya beragam anemitas di desa wisata pentingsari akan membuat anda semakin banyak menghabiskan waktu pada kawasan ini.

Beberapa atraksi wisata yang biasa disajikan adalah gamelan jawa, pengolahan kopi tradisional dan kesenian rakyat lainnya.

Tersedinya lapangan yang luas, memungkinkan anda untuk melakukan kegiatan camping, fun games dan kegiatan untuk grup besar lainnya.

Sajian khas kuliner pedesaan akan memanjakan selera anda. Semoga anda bisa meluangkan waktu untuk mengunjungi desa wisata pentingsari.",wisata menarik dikunjungi wisata dikelola kelompok pemuda tersedianya beragam anemitas desa wisata pentingsari menghabiskan waktu kawasan atraksi wisata disajikan gamelan jawa pengolahan kopi tradisional kesenian rakyat tersedinya lapangan luas kegiatan camping fun games kegiatan grup sajian khas kuliner pedesaan memanjakan selera semoga meluangkan waktu mengunjungi desa wisata pentingsari,wisata tarik kunjung wisata kelola kelompok pemuda sedia agam anemitas desa wisata pentingsari habis waktu kawasan atraksi wisata saji gamelan jawa olah kopi tradisional seni rakyat tersedinya lapang luas giat camping fun games giat grup saji khas kuliner desa manja selera moga luang waktu unjung desa wisata pentingsari,Pentingsari,
"Nyaman, sejuk, cocok utk acara pelatihan2. Kemarin ikut Kuliah Thibbun Nabawi Spraylogi HPAIC TN. Haji Ismail Ahmad",nyaman sejuk cocok acara pelatihan kemarin kuliah thibbun nabawi spraylogi hpaic tn haji ismail ahmad,nyaman sejuk cocok acara latih kemarin kuliah thibbun nabawi spraylogi hpaic tn haji ismail ahmad,Pentingsari,
Tempatnya asri sejuk,tempatnya asri sejuk,tempat asri sejuk,Pentingsari,
Adem bener,adem,adem,Pentingsari,
"Bisa dijadikan salah satu opsi untuk camping/makrab dll. Ada mushola, pendopo, ruang kesehatan, dan toilet. Untuk reservasi bisa dichat kontak atau langaung datang ke sana. Belum sempat pakai karena kemarin naru survei.",dijadikan salah opsi camping makrab dll mushola pendopo ruang kesehatan toilet reservasi dichat kontak langaung pakai kemarin naru survei,jadi salah opsi camping makrab dll mushola pendopo ruang sehat toilet reservasi dichat kontak langaung pakai kemarin naru survei,Pentingsari,
"Sejuk tempatnya , enak untuk camping ground acara komunitas dan lainnya, makanan enak 👍🏻",sejuk tempatnya camping ground acara komunitas makanan,sejuk tempat camping ground acara komunitas makan,Pentingsari,
Getring Jasa Armada Indonesia Tbk,getring jasa armada indonesia tbk,getring jasa armada indonesia tbk,Pentingsari,
"Desa wisata yang asri, hijau, dan penduduk yang ramah... Cocok sekali untuk jalan-jalan di akhir pekan, khususnya bagi yang merindukan suasana pedesaan yang asri.",desa wisata asri hijau penduduk ramah cocok jalan jalan pekan merindukan suasana pedesaan asri,desa wisata asri hijau duduk ramah cocok jalan jalan pekan rindu suasana desa asri,Pentingsari,
Kurang puas,puas,puas,Pentingsari,
Pemandunya ramah dan asik,pemandunya ramah asik,pandu ramah asik,Pentingsari,
Tempatnya adem ayem menyejukkan.,tempatnya adem ayem menyejukkan,tempat adem ayem sejuk,Pentingsari,
"Suasana asri,nyaman,aman dan ditambah keramahan penduduknya👍👍👍",suasana asri nyaman aman ditambah keramahan penduduknya,suasana asri nyaman aman tambah ramah duduk,Pentingsari,
Tempat dan suasana yang nyaman.. Homestay nya cozy lingkungan sekitar juga asik..,suasana nyaman homestay cozy lingkungan asik,suasana nyaman homestay cozy lingkung asik,Pentingsari,
Menarik,menarik,tarik,Pentingsari,
Kopinya mantap,kopinya mantap,kopi mantap,Pentingsari,
"Wisata desa yg begitu mengasyikan,,keramahan warga nya,kebersihannya,dan kearifan lokal nya tetap terjaga",wisata desa mengasyikan keramahan warga kebersihannya kearifan lokal terjaga,wisata desa asyik ramah warga bersih arif lokal jaga,Pentingsari,
"Desa wisata yg keren , pengelola ramah dan komunikatif",desa wisata keren pengelola ramah komunikatif,desa wisata keren kelola ramah komunikatif,Pentingsari,
"Camping di pekarangan... Lokasinya masuk jalan kecil di desa, fasilitas cukup oke, kamar mandi bersih walau WCnya jongkok. Ada cafe yang sedia minuman rempah yang enaak dan murah meriah. Masakan catering nya masakan rumahan yang rasanya enak pas di lidah.
Bagus untuk acara2 komunitas dan grup besar.",camping pekarangan lokasinya jalan desa fasilitas oke kamar mandi bersih wcnya jongkok cafe sedia minuman rempah enaak murah meriah masakan catering masakan rumahan pas lidah bagus acara komunitas grup,camping pekarang lokasi jalan desa fasilitas oke kamar mandi bersih wcnya jongkok cafe sedia minum rempah enaak murah riah masakan catering masakan rumah pas lidah bagus acara komunitas grup,Pentingsari,
Sangat nyaman,nyaman,nyaman,Pentingsari,
Desa wisata tempat yg sejuk banyak homestay nya,desa wisata sejuk homestay,desa wisata sejuk homestay,Pentingsari,
"tempatnya asikk parahh.. udara juga masih seger, warga sekitar juga ramah ramah.. suka banget pokonya..",tempatnya asikk parah udara segar warga ramah ramah suka banget pokoknya,tempat asikk parah udara segar warga ramah ramah suka banget pokok,Pentingsari,
"Desa wisata ini salah satu desa wisata yang sudah maju, terbukti dari beberapa desa dari tempat lain terkadang melakukan kunjungan belajar ke desa ini, selain suasananya yang khas pedesaan, disini juga tersedia berbagai macam menu makanan yang enak enak, ada juga yang menjajakan minuman tradisional daerah tersebut. Harganya pun cukup terjangkau. Recommended lah kalau semisal ada yang ingin membuat event di desa ini. Terimakasih 😊",desa wisata salah desa wisata maju terbukti desa terkadang kunjungan belajar desa suasananya khas pedesaan tersedia menu makanan menjajakan minuman tradisional daerah harganya terjangkau recommended event desa terimakasih,desa wisata salah desa wisata maju bukti desa terkadang kunjung ajar desa suasana khas desa sedia menu makan jaja minum tradisional daerah harga jangkau recommended event desa terimakasih,Pentingsari,
"bagus bt ajk ank2 camping, agar bisa mandiri..",bagus ajk anak camping mandiri,bagus ajk anak camping mandiri,Pentingsari,
"yang mau Camp bisa nginep di homestay bisa udaranya dingin, soal makan ada sekitaran situ, bersih, Warganya Welcome banget",camp nginep homestay udaranya dingin makan sekitaran situ bersih warganya welcome banget,camp nginep homestay udara dingin makan sekitar situ bersih warga welcome banget,Pentingsari,
Adem nemen lik... cocok kanggo turu-mangan-dolan-mangan-turu 😆😆😆,adem nemen lik cocok kanggo turu mangan dolan mangan turu,adem nemen lik cocok kanggo turu mangan dolan mangan turu,Pentingsari,
"Tempat menggelar acara seni,kemping dll, akses jalan yang berliku liku sehingga perlu penunjuk arah serta lokasi parkir yang cukup terbatas adalah salah satu kendala nya",menggelar acara seni kemping dll akses jalan berliku liku penunjuk arah lokasi parkir terbatas salah kendala,gelar acara seni kemping dll akses jalan liku liku tunjuk arah lokasi parkir batas salah kendala,Pentingsari,
"penduduk nya ramah2, pedesaan banget adem sejuk, produksi kopinya enak banget dan murah.... recommend bgt buat healing😘😘😘",penduduk ramah pedesaan banget adem sejuk produksi kopinya banget murah recommend banget healing,duduk ramah desa banget adem sejuk produksi kopi banget murah recommend banget healing,Pentingsari,
