review,review_text,rating,author,date,nama desa wisata
keren sih ini pengurus rw nya bisa mempunyai gagasan dan berproses menjadikan desa wisata walaupun akses nya lumayan jauh dari jalan raya propinsi akan tetapi mampu mengundang banyak tamu untuk menyelenggarakan acara gathering dan pertemuan di tempat ini yg perlu di tambahi adalah toko kelontong menyediakan snack dan makanan ringan rokok kopi 2 hari kami mengadakan acara di desa pulesari ini dan menginap 1 malam bagi yg ada agenda menginap jangan lupa bawa jaket dan selimut karena kalau malam hari terasa dingin karena kami tidak menyelenggarakan outbound jadi belum bisa memberikan review mengenai lokasi tracking dan keseruan healing with nature nya so sukses terus buat desa pulesari terus berbenah menata dan membangun untuk selalu memberikan pengalaman terbaik untuk para tamu yang hadir,"Keren sih ini Pengurus RW nya bisa mempunyai gagasan dan berproses menjadikan Desa wisata. Walaupun akses nya lumayan jauh dari jalan raya propinsi akan tetapi mampu mengundang banyak tamu untuk menyelenggarakan acara Gathering dan pertemuan di tempat ini. Yg perlu di tambahi adalah toko kelontong menyediakan snack dan makanan ringan, rokok, kopi.
2 hari kami mengadakan acara di Desa Pulesari ini dan menginap 1 malam. Bagi yg ada agenda menginap jangan lupa bawa jaket dan selimut karena kalau malam hari terasa dingin.
Karena kami tidak menyelenggarakan outbound jadi belum bisa memberikan review mengenai lokasi, tracking dan keseruan healing with Nature nya.
So, Sukses terus buat Desa Pulesari, terus berbenah, menata dan membangun untuk selalu memberikan pengalaman terbaik untuk para tamu yang hadir.",4,Jatmiko Guava,2025-05-16T09:42:10.826Z,Pulesari
desa wisata yg apik tersedia lokasi utk out bound,Desa wisata yg apik. . tersedia lokasi utk out bound,4,Siswadi Boncis,2025-05-13T12:50:08.306Z,Pulesari
tempatnya representatif jalan nga asik banget,"Tempatnya representatif
Jalan nga asik banget",5,AyahNgaji TV,2025-05-13T11:47:09.250Z,Pulesari
mungkin kedepannya kalo yg ice breaking yg coret muka jangan pake wajan gosong ya karna kulit setiap orang itu beda dan kita ngga tau seberapa banyak uang yang mereka keluarkan untuk merawat kulit wajah mereka,"mungkin kedepannya kalo yg ice breaking yg coret muka jangan pake wajan gosong ya, karna kulit setiap orang itu beda"" dan kita ngga tau seberapa banyak uang yang mereka keluarkan untuk merawat kulit wajah mereka",3,Jihan Fadhilahh,2025-05-10T12:33:40.644Z,Pulesari
cocok buat family day atau komunitas yang ingin refresh dari rutinitas kota nyusuri sungai atau river tracking sangat membantu memulihkan gelombang elektromagnet dan sel sel positif di dalam otak,"Cocok buat family day atau komunitas yang ingin refresh dari rutinitas kota. Nyusuri sungai atau river tracking, sangat membantu memulihkan gelombang elektromagnet dan sel-sel positif di dalam otak.",5,Candra Syaeful R,2025-04-29T00:18:28.877Z,Pulesari
pernah kesini satu pabrikk dan salah satu nya aq dapat sangat berharga karena pengalaman,Pernah kesini satu pabrikk dan salah satu nya aq dapat sangat berharga karena pengalaman...,4,Ranto Suranto,2025-04-19T04:38:33.903Z,Pulesari
lumayan seru tapi rintangannya aksterim banget juga waktu itu di pundaknya temen aku ada laba laba yang lumayan gede,Lumayan seru tapi rintangannya aksterim banget😖 juga waktu itu di pundaknya temen aku ada laba laba yang lumayan gede😖😡,3,Ismalia Isma,2025-04-17T09:31:16.793Z,Pulesari
tempatnya recomend banget air pegunungan yg dingin sejuk serta pendamping ramah pokoknya kamu akan mendapatkan pengalaman tantangan yg menarik kususnya bagi anak2 yg suka petualang,Tempatnya recomend banget air pegunungan yg dingin & sejuk serta pendamping ramah. Pokoknya kamu akan mendapatkan pengalaman & tantangan yg menarik kususnya bagi anak2 yg suka petualang.,5,Ariyanto,2025-04-09T12:51:37.920Z,Pulesari
desa wisata yang dikelola masyarakat mantab aktraksi susur sungai nya anak anak suka,desa wisata yang dikelola masyarakat. Mantab aktraksi susur sungai nya. anak-anak suka,5,krishnoy,2025-04-02T23:41:36.138Z,Pulesari
sangat bagus tempatnya dan stafnya ramah ramah kegiatannya sangat serruuh dan mantapppppp,"Sangat bagus tempatnya dan stafnya ramah ramah
Kegiatannya sangat serruuh
Dan mantapppppp",4,Ade abdullah Uran,2025-03-08T03:14:04.644Z,Pulesari
sangat cocok untuk acara outbound baik untuk anak2 maupun dewasa pelayanan yang sangat memuaskan dan ramah wahana air yang menyenangkan serta games2 yang seru,Sangat cocok untuk acara outbound baik untuk anak2 maupun dewasa. Pelayanan yang sangat memuaskan dan ramah. Wahana air yang menyenangkan serta games2 yang seru.,5,Titik Ruswanti,2025-03-06T22:56:23.731Z,Pulesari
desanya asri banget cocok buat outbond air di sungainya jernih udaranya segar belum terkontaminasi dgn polusi masyarakat desa dan pengelola desa wisata sangat welcome dengan tamu di dekat sini juga ada sentra durian bisa sekalian hunting,"Desanya asri banget, cocok buat outbond.. Air di sungainya jernih & udaranya segar belum terkontaminasi dgn polusi.. Masyarakat desa dan pengelola desa wisata sangat welcome dengan tamu.. Di dekat sini juga ada sentra durian, bisa sekalian hunting.. 😁",5,Arifin Sidiq,2025-03-04T22:29:07.099Z,Pulesari
tempat nya asri adem dan warga d sana baik2 sekali,"Tempat nya asri, adem, dan warga d sana baik2 sekali..",5,Meitina Pratiwi,2025-03-01T10:12:48.301Z,Pulesari
desa wisata yg keren bersihh nyaman recomended,"Desa wisata yg keren, bersihh.. nyaman
Recomended",5,Ahmad Mutaqin Habibi,2025-02-26T11:50:15.423Z,Pulesari
outbond anak2 dari sekolah lama beberapa tahun yg lalu anak2 suka dan menikmati dari sekolah menggunakan bus yang diparkir di parkiran mobumen jogja kembali dengan 9bus dari pagi hingga menjelang sore sudan sampai tiba kembali membawa baju ganti dan dianjurkan sepatu sendal saja utk outbond ini,"Outbond anak2 dari sekolah lama beberapa tahun yg lalu,anak2 suka dan menikmati, dari sekolah menggunakan bus yang diparkir di parkiran Mobumen Jogja Kembali dengan 9bus dari pagi hingga menjelang sore Sudan sampai tiba kembali, membawa baju ganti dan dianjurkan sepatu sendal saja utk outbond ini",4,Aprilummu FakhriFattanFatirFaqih,2025-02-25T15:18:53.725Z,Pulesari
tempat nyaman banyak joglo2 yg disewakan untukmacara outbond,Tempat nyaman... banyak joglo2 yg disewakan untukmacara outbond,5,Ratih Budi Arifiyanti,2025-02-25T14:21:14.255Z,Pulesari
tempat bersih fasilitas baik lokasi outbond airnya menyegarkan,"Tempat bersih
Fasilitas baik
Lokasi outbond airnya menyegarkan",4,Arif Muttaqin,2025-01-30T01:59:21.087Z,Pulesari
desa wisata pulesari adalah destinasi yang luar biasa untuk menikmati keindahan alam dan budaya lokal terletak di kawasan yang sejuk dan dikelilingi pemandangan pegunungan desa ini memberikan suasana yang sangat tenang dan menyegarkan salah satu aktivitas seru yang bisa dilakukan di sini adalah susur sungai dengan halang rintang pengunjung diajak menjelajahi sungai sambil melewati berbagai tantangan yang menguji keberanian dan kekompakan seperti melompat dari batu besar atau menyusuri jembatan kayu aktivitas ini sangat cocok bagi para pencinta petualangan yang ingin merasakan keseruan dan keindahan alam dari sudut yang berbeda secara keseluruhan desa wisata pulesari adalah tempat yang tepat untuk melarikan diri dari hiruk pikuk kota dan menikmati waktu berkualitas di alam yang indah,"Desa Wisata Pulesari adalah destinasi yang luar biasa untuk menikmati keindahan alam dan budaya lokal. Terletak di kawasan yang sejuk dan dikelilingi pemandangan pegunungan, desa ini memberikan suasana yang sangat tenang dan menyegarkan.

Salah satu aktivitas seru yang bisa dilakukan di sini adalah susur sungai dengan halang rintang. Pengunjung diajak menjelajahi sungai sambil melewati berbagai tantangan yang menguji keberanian dan kekompakan, seperti melompat dari batu besar atau menyusuri jembatan kayu. Aktivitas ini sangat cocok bagi para pencinta petualangan yang ingin merasakan keseruan dan keindahan alam dari sudut yang berbeda.

Secara keseluruhan, Desa Wisata Pulesari adalah tempat yang tepat untuk melarikan diri dari hiruk-pikuk kota dan menikmati waktu berkualitas di alam yang indah.",5,Erwin Wijanarko,2025-01-29T14:33:37.028Z,Pulesari
sangat menyenangkan dengan masyarakat yang ramah ramah dan area lingkungan yang bersihh tracking sungai yang sangat menyenangkan dengan berbagai wahanan begitu pula dengan fun games nyaaa sangat menyenangkan home stay dan pendopo yang sangat luass dan bersihhh,"Sangat menyenangkan dengan masyarakat yang ramah ramah dan Area Lingkungan yang bersihh, tracking sungai yang sangat menyenangkan dengan berbagai wahanan begitu pula dengan fun games nyaaa  sangat menyenangkan. Home stay dan pendopo yang sangat luass dan bersihhh👌🏻👌🏻",5,Marlina Bunga,2025-01-21T01:44:59.720Z,Pulesari
dua tahun yg lalu berkunjung bawa rombongan outbond ber 50 org dr mulai pertama mulai sampe akhir terkesan diabaikan trainner tdk mumpuni dan sepertinya koordinasi antar tim pengelola kurang memadai yg lebih mengecewakan lg pertama booking sdh ditawarkan dokumentasi sekalian akhirnya kami mau pd prakteknya setelah selesai acara kami plg ditunggu 3hr tdk ada kabar tentang dokumentasi akhirnya sy wa dgn pengelola di nmr yg dl km reservasi jawabannya mengecewakan malah melempar ke org yg katanya mengurus dokumentasi akhirnya setelah dilempar kesana kemari dan menunggu sekitar 5hr dpt jawabannya dokumentasi error katanya ada kerusakan kamera yg terkirim hanya foto di awal kegiatan tok dan hanya beberapa logikanya km pesan foto dan video kl misal dr awal ada kerusakan hrsnya tau dong ya secara itu kegiatan hampir 2 jam dan hrsnya kl bertanggung jawab jgn sampai km yg bertanya hrsnya ada inisiatif dr sana untuk memberitahu sy komplain pengelola tdk terima dan tdk mau disalahkan akhirnya tanpa pengembalian dana ataupun sekedar permintaan maaf nmr sy di blokir sekelas desa wisata terstruktur pelayanan seperti ini cukup sekali dan sejak itu gak lg2 kesana pdhal sy bs 3 kali dlm setahun pasti menangani outbound ternyata mengecewakan,"Dua tahun yg lalu berkunjung bawa rombongan outbond ber 50 org, dr mulai pertama mulai sampe akhir terkesan diabaikan trainner tdk mumpuni dan sepertinya koordinasi antar tim pengelola kurang memadai
Yg lebih mengecewakan lg pertama booking sdh ditawarkan dokumentasi sekalian akhirnya kami mau, pd prakteknya setelah selesai acara kami plg ditunggu 3hr tdk ada kabar tentang dokumentasi akhirnya sy WA dgn pengelola di nmr yg dl km reservasi jawabannya mengecewakan malah melempar ke org yg katanya mengurus dokumentasi, akhirnya setelah dilempar kesana kemari dan menunggu sekitar 5hr dpt jawabannya dokumentasi error katanya ada kerusakan kamera, yg terkirim hanya foto di awal kegiatan tok dan hanya beberapa, logikanya km pesan foto dan video kl misal dr awal ada kerusakan hrsnya tau dong ya, secara itu kegiatan hampir 2 jam dan hrsnya kl BERTANGGUNG JAWAB jgn sampai km yg bertanya hrsnya ada inisiatif dr sana untuk memberitahu...sy komplain pengelola tdk Terima dan tdk mau disalahkan akhirnya tanpa pengembalian dana ataupun sekedar permintaan maaf nmr sy di blokir....
Sekelas desa wisata terstruktur pelayanan seperti ini, cukup sekali dan sejak itu gak lg2 kesana pdhal sy bs 3 kali dlm setahun pasti menangani outbound ternyata MENGECEWAKAN",1,Mutiara Nurmadina,2025-01-11T08:26:23.862Z,Pulesari
selain untuk outbond bisa juga joglo disewa untuk acara resepsi,Selain Untuk Outbond bisa juga Joglo Disewa untuk Acara Resepsi,5,No Set,2025-01-11T06:24:22.730Z,Pulesari
main di sungai bersama anak2 semua happy tempatnya sejuk sungainya pas buat bermain anak ada guide yg mendampingi recomended untuk liburan keluarga,"Main di sungai bersama anak2, semua happy
Tempatnya sejuk, sungainya pas buat bermain anak.
Ada guide yg mendampingi
Recomended untuk liburan keluarga",5,Mohammad Davi,2024-12-28T06:25:01.547Z,Pulesari
wahana air kurang menarik di sungai ke 2,wahana air kurang menarik di sungai ke 2,2,Anggaaa Rwarrr,2024-12-26T03:37:16.875Z,Pulesari
lagi medun 1 langkah tangga langsung di bengoki pegawene sing go klambi biru lemu mbak bayar 20rb kalau sudah turun tangga tak jawab iyoo engko tak bayar dan akhirnya saya naik lgs tak bayar jelas tulisan tidak ada peringatan lgs di bengoki kegiatan outbond pule sari tertutup marai ngagoli ora masalah dwete le bayar cuma ngopo ra ngekei tulisan selain peserta paket dilarang masuk malah di bengoki orang akan lebih paham jika ada tulisan ora di suarani po di tulisi orang tua tidak boleh ikut turun karena paket buat anak2 yg daftar paket outbond aq mung ngeterke anakqu ora neg aq rep melu nyemplung pokoke ra rekomendasi buanget neng pulesari saya di sini sudah 3x lagi iki medun jupuk foto seko sebelah tangga bawah kon bayar,"lagi medun 1 langkah tangga langsung di bengoki pegawene sing go klambi biru lemu, "" mbak bayar 20rb kalau sudah turun tangga"". tak jawab, iyoo engko tak bayar, dan akhirnya saya naik lgs tak bayar, jelas tulisan tidak ada peringatan... lgs di bengoki kegiatan outbond Pule sari tertutup. marai ngagoli... ora masalah dwete le bayar, cuma ngopo Ra ngekei tulisan selain peserta paket dilarang masuk... malah di bengoki... orang akan lebih paham jika ada tulisan ora di suarani... po di tulisi orang tua tidak boleh ikut turun karena paket buat anak2 yg daftar paket outbond... aq mung ngeterke anakqu ora  neg aq Rep Melu nyemplung,, pokoke Ra rekomendasi buanget neng Pulesari..  saya di sini sudah 3x lagi Iki medun jupuk foto seko sebelah tangga bawah Kon bayar....",1,Cleopatra Cleopatra,2024-12-26T03:18:30.164Z,Pulesari
cocok sekali untuk outbond anak2 yg jauh dari kebisingan kota suasana desa yg nyaman,"Cocok sekali untuk outbond anak2 yg jauh dari kebisingan kota, suasana desa yg nyaman",5,Endah Ika,2024-12-24T03:22:01.008Z,Pulesari
desa wisata yang asri sejuk dan cocok untuk jalan jalan susur dungai,desa wisata yang asri sejuk dan cocok untuk jalan jalan susur dungai,5,Kopi Si Ndoro,2024-12-22T15:15:14.038Z,Pulesari
mantap masih asri petugas banyak yg dampingi jd kami merasa aman dan nyaman,Mantap... Masih asri... Petugas banyak yg dampingi jd kami merasa aman dan nyaman,5,anita vaza,2024-12-21T21:32:47.426Z,Pulesari
bagus untuk agenda outbond mantap,"Bagus . untuk Agenda outbond..
Mantap..",5,Krisna Andre,2024-12-21T02:20:19.855Z,Pulesari
seruuu bangett susur sungai di desa ini bikin nagihhh ga mau brenti maen air,Seruuu bangett susur sungai di desa ini. Bikin nagihhh ga mau brenti maen air,5,Noveti Endriyani,2024-12-17T11:04:52.557Z,Pulesari
rekomendasi untuk kegiatan outbond tempatnya sejuk asri dan tentunya banyak pilihan paket yang murah,"Rekomendasi untuk kegiatan Outbond, tempatnya sejuk, asri dan tentunya banyak pilihan paket yang murah",5,Ade Bimo,2024-12-10T11:13:07.008Z,Pulesari
tempat bersih dan rindang ada agenda susur sungai pendopo sound system dan makanan yang disediakan cukup mengakomodir kegiatan,"Tempat bersih dan rindang, ada agenda susur sungai, pendopo, sound system, dan makanan yang disediakan cukup mengakomodir kegiatan",5,Aga Widyantoro Nur Ikhsan,2024-12-09T01:24:13.952Z,Pulesari
tempat yg asik buat out bond,Tempat yg asik buat out bond,5,Enggar Kurniawan,2024-11-12T00:52:23.446Z,Pulesari
lumayan bagus area parkir luas saran outbound jg tersedia untuk menginap juga ada,Lumayan bagus area parkir luas saran outbound jg tersedia untuk menginap juga ada,4,Ris Anto,2024-10-30T10:22:01.506Z,Pulesari
desa wisata pulesari sangat cocok untuk wisata edukasi,Desa wisata pulesari sangat cocok untuk wisata edukasi,1,Sudarsono Sudarsono,2024-10-19T13:54:44.195Z,Pulesari
desa wisata pulosari,Desa wisata pulosari,5,Dede ardiansyah Putra,2024-09-19T08:17:21.452Z,Pulesari
desa wisata yg sejuk cocok bgt bt outbond,Desa wisata yg sejuk cocok bgt bt outbond,5,Lies rosanita Khomas,2024-09-11T03:00:22.682Z,Pulesari
bagus untuk bermain anak,Bagus untuk bermain anak,5,hendrawan hen,2024-09-04T03:26:27.151Z,Pulesari
tempatnya seru pengelolanya juga baik acara di dampingi dari awal sampai akhir,"Tempatnya seru..
Pengelolanya juga baik..
Acara di dampingi dari awal sampai akhir",5,widha tyas,2024-09-01T13:06:44.772Z,Pulesari
mantap rekomendasi yang pas untuk kegiatan outbond dan bisa memilih paket bisa petik salak juga,"Mantap, rekomendasi yang pas untuk kegiatan outbond dan bisa memilih paket. Bisa petik salak juga",5,Novita dwi susanti,2024-08-25T07:12:58.869Z,Pulesari
bagus dan asri,Bagus dan Asri,5,Soegeng Wijadi,2024-08-20T04:11:49.967Z,Pulesari
seru sekali dengan mc yg super bikin ketawa,Seru sekali dengan mc yg super bikin ketawa,5,Alfi Rosyid,2024-08-10T12:58:24.551Z,Pulesari
tempat wisata yang asri dan asyik banyak wahana permainan di air yang bikin permainan jadi lebih seru,Tempat wisata yang asri dan asyik. Banyak wahana permainan di air yang bikin permainan jadi lebih seru,5,Lulu Innafisah,2024-08-07T15:31:27.177Z,Pulesari
fun games nya fun banget outbound nya anak2 dan ibu nya senang sungai nya so far amaannn rasa makanan mohon ditingkatkan lagi kamar mandi nya memadai,"Fun games nya fun banget, outbound nya anak2 dan ibu nya senang, sungai nya so far amaannn... rasa makanan mohon ditingkatkan lagi... Kamar mandi nya memadai.",4,marva raqilla,2024-07-28T21:18:54.603Z,Pulesari
unik menarik suasana desa jawa yg rumah2 nya bersih sungai kecilnya jg bersih mengenang masa kecil yg suka berpetualang,Unik menarik suasana desa Jawa yg rumah2 nya bersih sungai kecilnya jg bersih... Mengenang masa kecil yg suka berpetualang....,5,Keiko Cam,2024-07-27T11:54:04.765Z,Pulesari
diberdayakan oleh warga sekitar dikelola dg baik suasana desa yg masih asri dg orang orang yg ramah dan sangat membantu,"Diberdayakan oleh warga sekitar. Dikelola dg baik, suasana desa yg masih asri dg orang orang yg ramah dan sangat membantu.",4,Ratih Purnamasari,2024-07-25T10:16:13.592Z,Pulesari
favorit lah untuk kegiatan acara outbound bareng2 seperti pusahaan keluarga sekolah yayasan dll karena suasana sejuk asri dan tentunya murah,"Favorit lah untuk kegiatan acara Outbound bareng2 seperti pusahaan, keluarga, sekolah, yayasan dll... Karena suasana sejuk, asri, dan tentunya murah",5,Aship Barhoya,2024-07-14T14:19:19.062Z,Pulesari
suasana sejuk dan air sungainya masih bersih,Suasana sejuk dan air sungainya masih bersih,5,Arif Pramana,2024-07-04T12:48:02.055Z,Pulesari
menarik sekali pengelola baik dan ramah anak2 diajak bermain utk melatih konsentrasi yang lebih menarik waktu susur sungai top,"Menarik sekali. Pengelola baik dan ramah. Anak2 diajak bermain utk melatih konsentrasi.
Yang lebih menarik waktu susur sungai, top.....👍👍👍",5,Yupi Rahayu,2024-06-25T22:39:59.054Z,Pulesari
pengurus nya sungguh sombong sekali tidak sekali pun kami ditemui untuk koordinasi lama sekali kami penyelenggara kegiatan bawa peserta 110 orang di kenakan biaya makan 120pax info nya hitung nya lewat cctv aneh ketemu juga model kaya gini di jogja,"pengurus nya sungguh sombong sekali, tidak sekali pun kami ditemui, untuk koordinasi lama sekali, kami penyelenggara kegiatan bawa peserta 110 orang, di kenakan biaya makan 120pax, info nya hitung nya lewat cctv, aneh ketemu juga model kaya gini di jogja",2,eri kembara,2024-06-02T08:30:03.194Z,Pulesari
tempat outbond atau gathering di turi fasilitasnya lengkap terdapat pendopo ada tracking ke sungai fasilitatornya ramah dan selalu sigap mendampingi makanannya enak dan tempat parkirnya luas,"Tempat outbond atau gathering di Turi. Fasilitasnya lengkap, terdapat pendopo, ada tracking ke sungai, fasilitatornya ramah dan selalu sigap mendampingi, makanannya enak, dan tempat parkirnya luas.",4,Nurrohma Ningrum,2024-05-28T10:45:12.299Z,Pulesari
kemarin habis dari sana maaf bgt harus bilang kalau tempat istirahat nya kurang nyaman kotor kaya gak di sapu banyak sarang laba laba nya di genteng knp gak di bersihkan dulu tiker kotor kamar mandi kotor bau pesing bgt makanan hambar tolong di perbaiki semuanya,"kemarin habis dari sana, maaf bgt harus bilang kalau tempat istirahat nya kurang nyaman, kotor, kaya gak di sapu, banyak sarang laba-laba nya di genteng knp gak di bersihkan dulu, tiker kotor, kamar mandi kotor bau pesing bgt, makanan hambar, tolong di perbaiki semuanya",3,Widi Navita sari,2024-05-22T07:04:29.358Z,Pulesari
cukup bagus banyak varian paket utk acara outbond dan refreshing edukasi harga murah dg vasilitas snak pemandu dan berakhir makan siang mushola tempat wudhu bagus rapi cukuo bersih l,Cukup bagus banyak  varian paket utk acara outbond dan refreshing  edukasi..harga murah dg vasilitas snak  pemandu dan berakhir makan siang ..mushola tempat wudhu bagus rapi cukuo bersih...l,5,UMMAH Griya Sehat Cantik Muslimah (GSCM),2024-05-15T21:37:24.791Z,Pulesari
3 4 mei 2024 kami ada event di sini untuk penginapannya kamarnya bersih dan nyaman untuk pelayanan baik seru banget buat acara makrab kampus atau karya wisata ada sesi susur sungai dan ice breaking satu hal yang sesikit minus di taste rasa makanan sayuran yg disugukan adalah sayur khas desa banget dan aku paling suka makanan khas pedesaan dan ekspektasi saya rasanya bakalan enak banget seperti sayur lodeh maupun sayur daun singkong namun 3 kali makan rasa sayurannya hambar banget jadi kedepan untuk bagian konsumsi memperbaiki rasa sayurannya supaya seimbang antara fasilitas dan juga penyajian makanannya,"3-4 mei 2024 kami ada event di sini, untuk penginapannya kamarnya bersih dan nyaman. Untuk pelayanan baik,seru banget buat acara makrab kampus atau karya wisata, ada sesi susur sungai dan ice breaking. Satu hal yang sesikit minus di taste/rasa makanan. Sayuran yg disugukan adalah sayur khas desa banget dan aku paling suka makanan khas pedesaan, dan ekspektasi saya rasanya bakalan enak banget seperti sayur lodeh maupun sayur daun singkong. Namun 3 kali makan, rasa sayurannya hambar banget, jadi kedepan untuk bagian konsumsi memperbaiki rasa sayurannya, supaya  seimbang antara fasilitas dan juga penyajian makanannya",5,rindi astika yuliana,2024-05-12T20:22:49.572Z,Pulesari
desa wisata yang sangat asri bersih dan indah dengan udara yang sejuk di lereng gunung merapi menyajikan wisata alam nuansa pedesaan di kelilingi perkebunan salak pondok dan berbagai wahana permainan dan pendidikan,"Desa wisata yang sangat asri bersih dan indah, dengan udara yang sejuk di lereng gunung merapi menyajikan wisata alam nuansa pedesaan di kelilingi perkebunan salak pondok dan berbagai wahana permainan dan pendidikan.",5,Vika naura Isnaini,2024-05-10T07:54:31.191Z,Pulesari
desa wisata banyak pohon salaknya tempatnya luas sejuk nyaman banyak wahana untuk outbound tracking sungai dll ada pemandunya juga kebersihannya terjaga seruu deh pokoknya,"Desa Wisata, banyak pohon salaknya, tempatnya luas,sejuk, nyaman, banyak wahana untuk outbound,tracking sungai dll,ada pemandunya juga,  kebersihannya terjaga, seruu deh pokoknya.",5,Dwiki Aprilianto,2024-05-07T17:18:19.546Z,Pulesari
sangat menyenangkan saya kesana dalam rangka jalan2 karyawan disana melakukan kegiatan outbond dan lain lain,"Sangat menyenangkan, saya kesana dalam rangka jalan2 karyawan. Disana melakukan kegiatan outbond dan lain lain.",5,Ronal Dallas,2024-03-13T09:30:07.427Z,Pulesari
outbond disini seru dan bisa refresh,Outbond disini seru dan bisa refresh,4,Istiqomah Nugroho,2024-03-10T12:05:54.819Z,Pulesari
desa yg bersih dgn pemandangan kebun salak lahan parkir jika person ingin berjalan2 warung makan sepertinya tidak ada,"Desa yg bersih dgn pemandangan kebun salak.
Lahan parkir jika person ingin berjalan2 & warung makan sepertinya tidak ada.",4,happy day,2024-03-01T23:25:29.991Z,Pulesari
terlalu pelosok dan serem kalau jalan malam,Terlalu pelosok dan serem kalau jalan malam,2,Faridz Raya,2024-02-16T06:55:55.120Z,Pulesari
tempat untuk rekreasi sambil beredukasi dan menyatu dengan alam,tempat untuk rekreasi sambil beredukasi dan menyatu dengan alam,5,Mahasti adityasari,2024-02-12T03:29:51.156Z,Pulesari
sangat menyenangkan diawali dengan tim dari pokdarwis yang sangat lucu mengawali dengan ice breaking yang bikin terbahak bahak bahagia tempat outbond yang asyik berbagai macam permainan yang menantang dilanjutkan susur sungai dengan suasana alam yg adem dan menyejukkan dengan aliran sungai yang segar di tengah perkebunan salak benar benar refresing,"Sangat menyenangkan.. Diawali dengan tim dari Pokdarwis yang sangat lucu, mengawali dengan ice breaking yang bikin terbahak-bahak bahagia.. Tempat outbond yang asyik, berbagai macam  permainan yang menantang, dilanjutkan susur sungai dengan suasana alam yg adem dan menyejukkan dengan aliran sungai yang segar di tengah perkebunan salak. Benar-benar refresing.",5,Rosa Fitriana,2024-02-03T15:05:22.877Z,Pulesari
tempat untuk outbound yg bagusss tempatnya asri airnya jernih mantapppp,"Tempat untuk outbound yg bagusss, tempatnya asri, airnya jernih. Mantapppp",5,AYUNDHA NURHAYATI,2024-02-02T00:53:30.320Z,Pulesari
tempatnya asri serta kebersihannya terjaga alami air sungainya pun dari sumber jd masih jernih wahana outbound susur sungainya mantab seru dan aman pokoknya,Tempatnya asri serta kebersihannya terjaga alami. Air sungainya pun dari sumber jd masih jernih. Wahana outbound susur sungainya mantab. Seru dan aman pokoknya.,5,Nikolas Caristra,2024-01-29T08:36:52.124Z,Pulesari
tempat yg asik buat keluarga dan rombongan out bound,"Tempat yg asik buat keluarga dan rombongan, out bound",5,Medi Ipung Chanel,2024-01-26T12:54:07.811Z,Pulesari
