review,nama desa wisata
tempat nya bagus kamar mandi bersih disediakan beberapa pendopo untuk menampung beberapa kelompok wisatawan fasilitas lengkap permainannya banyak dan sangat asik tapi pemandu sangat kurang baik dalam menjalankan tugas pemandu tidak komunikatif tidak dijelaskan apa yg harus dilakukan untuk safety permainan tidak dijelaskan apa yg tidak boleh dilakukan tidak dijelaskan bagaimana step by step cara melewati tracking sungai yg ada beberapa rintangan pemandu juga tidak membawa perlengkapan apapun saat mendampingi tracking sungai tidak membawa beberapa perlengkapan yang mungkin di butuhkan wisatawan saat ada hal yg tidak diinginkan terjadi sayang sekali tempat sebagus ini pemandunya kurang baik dalam menjalankan tugas sepertinya butuh diberi training agar dapat meningkatkan kualitas dan memberikan pelayanan yg lebih baik untuk pengunjung,Pulesari
dapet toiletnya gak nyaman karena banjir dan kotor overall okelah harga murah juga,Pulesari
banyak spot dan pendopo yang bisa di booking untuk acara gathering makrab dll ada wisata petik salak outbound susur sungai dll paket lengkap,Pulesari
tempat nya bagus spot nya luas ada out bond dan banyak pendopo,Pulesari
tempatnya sejuk nyaman cocok buat kegiatan d luar rumah outbond atw yg ingin menikmati alam pedesaan org2 eo nya juga ramah2 kocak2 makanannya mungkin requat ya kmren itu enak sayur lodeh ayam goreng peyek teri rebin mantap,Pulesari
bisa booking lewat wa dan bayar dp bisa transfer tempatnya luas ada beberapa pendopo tidak hanya untuk outbound saja juga bisa untuk menginap,Pulesari
tempat outbound yang cukup bagus parkir luas thx u,Pulesari
bagus banget tempatnya masyarakatnya juga sangat ramah pengelola tempat wisata juga sangat bertanggung jawab kalau misalnya ada yang sakit di bantuin kegiatan mahasiswa,Pulesari
lokasi mudah ditemukan meski jalannya berliku pelayanan ramah menu makanan cukuplah untuk standart kocek paket yg kami keluarkan,Pulesari
lumayan bagus sayang belum tertata dg rapi wahana supaya ditambah krn kelihatan sdh usang alangkah baiknya sdh memenuhi standar keselmatan dr badan yg berwenang dinas parowosata kab sleman dan sdh ber isn terima kasih,Pulesari
salah satu desa wisata yang cukup bagus penataan lokasi yang baik cukup bersih lokasi outbond di sungai yang sangat asri trainner outbond yang interaktif,Pulesari
pemandu sangat tidak ramah,Pulesari
pemandu sangat tidak ramah dan kurang profesional mungkin bisa di tingkatkan lagi untuk pelayanannya,Pulesari
tempat nyaman pengurusnya ramah cocok untuk acara kantor,Pulesari
kompak warganya asri desanya buanyak dan seru permainan nya ada outbond budaya alam kuliner tinggal pilih sehat2 selalu buat pengelolanya,Pulesari
tempat outbond yang seruuu bisa susur sungai juga tempatnya luassss pendoponya banyakk banyak toilet juga di rumah warga cocok buat rombongan bus parkirnya uuga luas makanan disini yang masak buibu dasawisma gitu keren banget bisa jadi desa wisata kalau mau beli oleh oleh biasanya ada yang jual masyarakat sekitar salak jadi andalan kemarin beli 1 kg 7 ribu salak pondoh biasa yang salak pondoh madu 10 ribu pinter nawar aja sii sama penjualnyaa,Pulesari
selalu sedia air putih ya teman teman karena capeknya tidak kerasa karena full permainan air tau tau kering ni tenggorokan,Pulesari
sangat tidak memuaskan dari model rute perjalanan susur sungai nya aliran sungai yang sangat kotor sisi kanan kiri juga ada getah kuning yang keluar entah dari mana asalnya tour guide nya tidak ramah sama sekali pengarahan yang disampaikan tidak informatif semua disuruh mandiri dari segi fasilitas juga tidak memuaskan kedepannya kalau memang mau membuat desa wisata alangkah lebih baiknya di perhatikan kondisi alam sekitar juga dan jangan asal memanfaatkan terlalu berlebihan,Pulesari
tempat outbond yg seruu tp sayang tdk ada warung makan yg nyaman,Pulesari
hari sabtu lumayan ramai pengunjung akses jalan lumayan macet kalau all pake mobil,Pulesari
bagus sangat alami wahana dan fasilitas okeeee semuaa,Pulesari
dulu sempat main ke sini lokasi asik buat bangun pagi lihat merapi disediakan tempat buat main api malam2 dan terapi ikan airnya seger khas pegunungan,Pulesari
tempatnya sering buat event event ada tempat untuk outbond2,Pulesari
