review,cleaned_review,cleaned_review_stemmed,review_text,rating,author,date,nama desa wisata,provinsi
"Wisata group Raja Ampat bersama teman-teman, salah satunya ke kampung wisata Sauwandarek. Di sini kita dapat melakukan diving atau snorkeling, banyak ikan dan karang laut yang cantik dan masih alami.
Di sini juga terdapat perkampungan nelayan yang cukup ramai, terdapat beberapa tempat ibadah dan juga di sini terdapat Kantor Pelayanan PLN.",wisata group raja ampat teman teman salah satunya kampung wisata sauwandarek diving snorkeling ikan karang laut cantik alami perkampungan nelayan ramai ibadah kantor pelayanan pln,wisata group raja ampat teman teman salah satu kampung wisata sauwandarek diving snorkeling ikan karang laut cantik alami kampung nelayan ramai ibadah kantor layan pln,"Wisata group Raja Ampat bersama teman-teman, salah satunya ke kampung wisata Sauwandarek. Di sini kita dapat melakukan diving atau snorkeling, banyak ikan dan karang laut yang cantik dan masih alami.
Di sini juga terdapat perkampungan nelayan yang cukup ramai, terdapat beberapa tempat ibadah dan juga di sini terdapat Kantor Pelayanan PLN.",5,Muhlison R,2026-04-11T13:08:23.757Z,Sauwandarek,Papua Barat
"Snorkling di sini pakai paket raja ampat.
Ikan2nya banyak, ga takut manusia hehehe",snorkling pakai paket raja ampat ikan takut manusia hehehe,snorkling pakai paket raja ampat ikan takut manusia hehehe,"Snorkling di sini pakai paket raja ampat.
Ikan2nya banyak, ga takut manusia hehehe",5,Rina Rusdiana,2025-12-21T05:34:06.562Z,Sauwandarek,Papua Barat
Tempat snorkeling bagus,snorkeling bagus,snorkeling bagus,Tempat snorkeling bagus,5,M. Wahyu Arya Putra,2025-11-14T09:15:53.687Z,Sauwandarek,Papua Barat
Spot snorkling dan diving yang bagus.,spot snorkling diving bagus,spot snorkling diving bagus,Spot snorkling dan diving yang bagus.,5,Auditha Sugara,2025-09-07T09:31:24.878Z,Sauwandarek,Papua Barat
"Salah satu destinasi pariwisata paling menarik di Raja Ampat dengan menari² bersama ikan² di laut, pokoknya puas deh ❤",salah destinasi pariwisata menarik raja ampat menari ikan laut pokoknya puas,salah destinasi pariwisata tarik raja ampat tari ikan laut pokok puas,"Salah satu destinasi pariwisata paling menarik di Raja Ampat dengan menari² bersama ikan² di laut, pokoknya puas deh ❤",5,Jeine Mokalu,2025-08-01T04:41:05.971Z,Sauwandarek,Papua Barat
"Desa wisata yang berbeda dari kesan wisata karena benar-benar tenang dan sederhana. Ada gereja adven, beberapa guesthouse yang start dari 500/malam. Kalau stay di desa ini plis banyak interaksi ssma warga ya, berbagi ilmu dan kalau bisa bawa beberapa hal yang akan berguna. Ini lokasi strategis buat diving dan snorkeling-",desa wisata berbeda kesan wisata tenang sederhana gereja adven guesthouse start malam stay desa plis interaksi ssma warga berbagi ilmu bawa berguna lokasi strategis diving snorkeling,desa wisata beda kesan wisata tenang sederhana gereja adven guesthouse start malam stay desa plis interaksi ssma warga bagi ilmu bawa guna lokasi strategis diving snorkeling,"Desa wisata yang berbeda dari kesan wisata karena benar-benar tenang dan sederhana. Ada gereja adven, beberapa guesthouse yang start dari 500/malam. Kalau stay di desa ini plis banyak interaksi ssma warga ya, berbagi ilmu dan kalau bisa bawa beberapa hal yang akan berguna. Ini lokasi strategis buat diving dan snorkeling-",5,claudya elleossa,2025-07-30T09:01:04.268Z,Sauwandarek,Papua Barat
"Untuk snorkling bagus..ikan n terumbu karangnya masih oke...
Fasilitas toilet lengkap..kurang warung tuk makan ikan bakar aja disitu...",snorkling bagus ikan terumbu karangnya oke fasilitas toilet lengkap warung makan ikan bakar disitu,snorkling bagus ikan terumbu karang oke fasilitas toilet lengkap warung makan ikan bakar situ,"Untuk snorkling bagus..ikan n terumbu karangnya masih oke...
Fasilitas toilet lengkap..kurang warung tuk makan ikan bakar aja disitu...",4,maya kurniawati,2025-06-28T05:17:56.061Z,Sauwandarek,Papua Barat
Tempat berenang dan menyelam yang menyenangkan,berenang menyelam menyenangkan,renang selam senang,Tempat berenang dan menyelam yang menyenangkan,5,Benedictus Roembiak,2025-05-23T07:10:11.416Z,Sauwandarek,Papua Barat
Amazing,amazing,amazing,Amazing,5,just uday,2025-02-20T16:51:26.039Z,Sauwandarek,Papua Barat
"Kampung yang bersih, penduduknya ramah, dermaganya bagus untuk snorkling atau diving.",kampung bersih penduduknya ramah dermaganya bagus snorkling diving,kampung bersih duduk ramah dermaga bagus snorkling diving,"Kampung yang bersih, penduduknya ramah, dermaganya bagus untuk snorkling atau diving.",5,Mohamad Farouk Riza,2025-01-23T12:49:02.828Z,Sauwandarek,Papua Barat
beautiful places,beautiful places,beautiful places,beautiful places,5,Ibenk Lesmana,2024-11-25T11:02:22.580Z,Sauwandarek,Papua Barat
"Disini akan ditemukan keramahan penduduk lokal. Disini juga ditemukan Sukun terenak di dunia, tidak akan bikin batuk setelah makan berapapun karena menggunakan minyak kelapa asli.",ditemukan keramahan penduduk lokal ditemukan sukun terenak dunia bikin batuk makan minyak kelapa asli,temu ramah duduk lokal temu sukun enak dunia bikin batuk makan minyak kelapa asli,"Disini akan ditemukan keramahan penduduk lokal. Disini juga ditemukan Sukun terenak di dunia, tidak akan bikin batuk setelah makan berapapun karena menggunakan minyak kelapa asli.",5,April O'Neil,2024-10-29T09:24:52.056Z,Sauwandarek,Papua Barat
Snorkling splendide !,snorkling splendide,snorkling splendide,Snorkling splendide !,5,cathy maillet,2024-10-07T08:06:25.671Z,Sauwandarek,Papua Barat
Pas buat healing,pas healing,pas healing,Pas buat healing,5,Doni Hernandi,2024-10-01T09:15:54.509Z,Sauwandarek,Papua Barat
"Spot snorkeling yang bagus banget, masih diatas boat saja ikannya sudah kelihatan, biaya masuk dihitung per boat",spot snorkeling bagus banget diatas boat ikannya biaya dihitung boat,spot snorkeling bagus banget atas boat ikan biaya hitung boat,"Spot snorkeling yang bagus banget, masih diatas boat saja ikannya sudah kelihatan, biaya masuk dihitung per boat",5,Fida Rahmadani,2024-08-23T21:51:23.920Z,Sauwandarek,Papua Barat
Untuk Snorkling dan wisata kasih makan ikan,snorkling wisata kasih makan ikan,snorkling wisata kasih makan ikan,Untuk Snorkling dan wisata kasih makan ikan,4,Surya Eka,2024-08-15T01:55:05.993Z,Sauwandarek,Papua Barat
THE BEST OFCOURSE~,the best ofcourse,the best ofcourse,THE BEST OFCOURSE~,5,septiana cuy,2024-06-26T08:00:11.787Z,Sauwandarek,Papua Barat
"Airnya jernih, ikannya banyak banget",airnya jernih ikannya banget,air jernih ikan banget,"Airnya jernih, ikannya banyak banget",5,HE HE,2024-05-31T06:36:46.605Z,Sauwandarek,Papua Barat
Spot snorkeling terbaik di raja ampat. Memiliki keanekaragaman biota laut yang luar biasa. Wisata ini dikeola dengan baik dsn dijaga dengan baik.,spot snorkeling terbaik raja ampat memiliki keanekaragaman biota laut wisata dikeola dsn dijaga,spot snorkeling baik raja ampat milik keanekaragaman biota laut wisata dikeola dsn jaga,Spot snorkeling terbaik di raja ampat. Memiliki keanekaragaman biota laut yang luar biasa. Wisata ini dikeola dengan baik dsn dijaga dengan baik.,5,Vincensius Surya,2024-05-09T09:54:06.670Z,Sauwandarek,Papua Barat
Salah satu kamapung yg sangat nyaman dan masih asri di raja ampat,salah kamapung nyaman asri raja ampat,salah kamapung nyaman asri raja ampat,Salah satu kamapung yg sangat nyaman dan masih asri di raja ampat,5,Dive Driver,2024-04-11T03:20:09.308Z,Sauwandarek,Papua Barat
Famous for Indonesian Sakura!,famous for indonesian sakura,famous for indonesian sakura,Famous for Indonesian Sakura!,5,yongsin yang,2024-04-04T14:08:46.976Z,Sauwandarek,Papua Barat
Sangat bagus tempat nya.,bagus,bagus,Sangat bagus tempat nya.,5,Sebastian Suebu,2024-01-10T00:34:53.763Z,Sauwandarek,Papua Barat
Posto incantevole.,posto incantevole,posto incantevole,Posto incantevole.,5,Gianluca Ballini,2023-12-30T09:51:49.563Z,Sauwandarek,Papua Barat
"Seminggu yng lalu abis darisini, indah bangeet dan asri 😍. Sepulang darisana kena ombak gede perjalanan pulangnya. tapi amazing lah tak terbayarkan pengalamannya.",seminggu habis darisini indah banget asri sepulang darisana ombak gede perjalanan pulangnya amazing terbayarkan pengalamannya,minggu habis darisini indah banget asri pulang darisana ombak gede jalan pulang amazing bayar alam,"Seminggu yng lalu abis darisini, indah bangeet dan asri 😍. Sepulang darisana kena ombak gede perjalanan pulangnya. tapi amazing lah tak terbayarkan pengalamannya.",5,Wulandari Wulandari,2023-12-26T05:05:16.400Z,Sauwandarek,Papua Barat
"Tempatnya baguuus bangett, airnya jernihh, terumbu karang, ikan2 juga bisa terlihat jelass .. ♥️♥️🥰
dan jugaaa Spot snorkling yang sangat bagus, ikan ikan warna warnii berada mendekat dengan sendirinya. Ragam ikan yang sangat indah dengan ukuran kecil sampai besar.. nice place 😍♥️👍",tempatnya bagus banget airnya jernihh terumbu karang ikan jelass spot snorkling bagus ikan ikan warna warnii mendekat ragam ikan indah ukuran nice place,tempat bagus banget air jernihh terumbu karang ikan jelass spot snorkling bagus ikan ikan warna warnii dekat ragam ikan indah ukur nice place,"Tempatnya baguuus bangett, airnya jernihh, terumbu karang, ikan2 juga bisa terlihat jelass .. ♥️♥️🥰
dan jugaaa Spot snorkling yang sangat bagus, ikan ikan warna warnii berada mendekat dengan sendirinya. Ragam ikan yang sangat indah dengan ukuran kecil sampai besar.. nice place 😍♥️👍",5,DON' SI,2023-12-25T13:35:51.245Z,Sauwandarek,Papua Barat
"Kampung Sauwandarek adalah sebuah desa wisata yang terletak di Pulau Maswar, Distrik Meos Mansar, Kabupaten Raja Ampat, Provinsi Papua Barat. Desa ini berjarak sekitar 15 kilometer dari Waisai, ibu kota Kabupaten Raja Ampat.

Kampung Sauwandarek merupakan salah satu destinasi wisata yang cukup populer di Raja Ampat. Desa ini menawarkan keindahan alam yang mempesona, mulai dari pantai yang berpasir putih, laut yang biru jernih, hingga terumbu karang yang eksotis.

Pantai Kampung Sauwandarek Raja Ampat
Pantai di Kampung Sauwandarek memiliki pasir putih yang lembut dan air laut yang biru jernih. Pantai ini sangat cocok untuk bersantai, berenang, atau snorkeling.

Selain pantai, Kampung Sauwandarek juga memiliki keindahan bawah laut yang menakjubkan. Di sini, wisatawan dapat melihat berbagai jenis terumbu karang, ikan, dan hewan laut lainnya.

Keindahan bawah laut Kampung Sauwandarek Raja Ampat
Kampung Sauwandarek juga dikenal sebagai desa wisata religi. Mayoritas penduduk di desa ini adalah pemeluk agama Kristen Protestan Advent Hari Ketujuh. Di desa ini terdapat sebuah gereja yang dibangun dengan gaya khas Papua.

Selain keindahan alam dan budayanya, Kampung Sauwandarek juga dikenal dengan keramahan penduduknya. Penduduk di desa ini sangat ramah dan senang menyambut wisatawan.

Ada beberapa aktivitas yang dapat dilakukan wisatawan saat berkunjung ke Kampung Sauwandarek, antara lain:

Bersantai di pantai
Berenang
Snorkeling
Diving
Menjelajahi desa
Belajar tentang budaya Papua
Kampung Sauwandarek merupakan destinasi wisata yang cocok untuk wisatawan yang ingin menikmati keindahan alam dan budaya Papua. Desa ini menawarkan berbagai aktivitas yang dapat dinikmati oleh wisatawan dari berbagai kalangan. Pesan: Ketika mengunjungi Kampung Sauwandarek atau tempat-tempat alami seperti ini di Papua Barat Daya, penting untuk menghormati alam dan budaya setempat. Jaga kebersihan dan jangan membuang sampah sembarangan.",kampung sauwandarek desa wisata terletak pulau maswar distrik meos mansar kabupaten raja ampat provinsi papua barat desa berjarak kilometer waisai kota kabupaten raja ampat kampung sauwandarek salah destinasi wisata populer raja ampat desa menawarkan keindahan alam mempesona pantai berpasir putih laut biru jernih terumbu karang eksotis pantai kampung sauwandarek raja ampat pantai kampung sauwandarek memiliki pasir putih lembut air laut biru jernih pantai cocok bersantai berenang snorkeling pantai kampung sauwandarek memiliki keindahan laut menakjubkan wisatawan jenis terumbu karang ikan hewan laut keindahan laut kampung sauwandarek raja ampat kampung sauwandarek dikenal desa wisata religi mayoritas penduduk desa pemeluk agama kristen protestan advent ketujuh desa gereja dibangun gaya khas papua keindahan alam budayanya kampung sauwandarek dikenal keramahan penduduknya penduduk desa ramah senang menyambut wisatawan aktivitas wisatawan berkunjung kampung sauwandarek bersantai pantai berenang snorkeling diving menjelajahi desa belajar budaya papua kampung sauwandarek destinasi wisata cocok wisatawan menikmati keindahan alam budaya papua desa menawarkan aktivitas dinikmati wisatawan kalangan pesan mengunjungi kampung sauwandarek alami papua barat daya menghormati alam budaya jaga kebersihan membuang sampah sembarangan,kampung sauwandarek desa wisata letak pulau maswar distrik meos mansar kabupaten raja ampat provinsi papua barat desa jarak kilometer waisai kota kabupaten raja ampat kampung sauwandarek salah destinasi wisata populer raja ampat desa tawar indah alam pesona pantai pasir putih laut biru jernih terumbu karang eksotis pantai kampung sauwandarek raja ampat pantai kampung sauwandarek milik pasir putih lembut air laut biru jernih pantai cocok santa renang snorkeling pantai kampung sauwandarek milik indah laut takjub wisatawan jenis terumbu karang ikan hewan laut indah laut kampung sauwandarek raja ampat kampung sauwandarek kenal desa wisata religi mayoritas duduk desa peluk agama kristen protestan advent tujuh desa gereja bangun gaya khas papua indah alam budaya kampung sauwandarek kenal ramah duduk duduk desa ramah senang sambut wisatawan aktivitas wisatawan kunjung kampung sauwandarek santa pantai renang snorkeling diving jajah desa ajar budaya papua kampung sauwandarek destinasi wisata cocok wisatawan nikmat indah alam budaya papua desa tawar aktivitas nikmat wisatawan kalang pesan unjung kampung sauwandarek alami papua barat daya hormat alam budaya jaga bersih buang sampah sembarang,"Kampung Sauwandarek adalah sebuah desa wisata yang terletak di Pulau Maswar, Distrik Meos Mansar, Kabupaten Raja Ampat, Provinsi Papua Barat. Desa ini berjarak sekitar 15 kilometer dari Waisai, ibu kota Kabupaten Raja Ampat.

Kampung Sauwandarek merupakan salah satu destinasi wisata yang cukup populer di Raja Ampat. Desa ini menawarkan keindahan alam yang mempesona, mulai dari pantai yang berpasir putih, laut yang biru jernih, hingga terumbu karang yang eksotis.

Pantai Kampung Sauwandarek Raja Ampat
Pantai di Kampung Sauwandarek memiliki pasir putih yang lembut dan air laut yang biru jernih. Pantai ini sangat cocok untuk bersantai, berenang, atau snorkeling.

Selain pantai, Kampung Sauwandarek juga memiliki keindahan bawah laut yang menakjubkan. Di sini, wisatawan dapat melihat berbagai jenis terumbu karang, ikan, dan hewan laut lainnya.

Keindahan bawah laut Kampung Sauwandarek Raja Ampat
Kampung Sauwandarek juga dikenal sebagai desa wisata religi. Mayoritas penduduk di desa ini adalah pemeluk agama Kristen Protestan Advent Hari Ketujuh. Di desa ini terdapat sebuah gereja yang dibangun dengan gaya khas Papua.

Selain keindahan alam dan budayanya, Kampung Sauwandarek juga dikenal dengan keramahan penduduknya. Penduduk di desa ini sangat ramah dan senang menyambut wisatawan.

Ada beberapa aktivitas yang dapat dilakukan wisatawan saat berkunjung ke Kampung Sauwandarek, antara lain:

Bersantai di pantai
Berenang
Snorkeling
Diving
Menjelajahi desa
Belajar tentang budaya Papua
Kampung Sauwandarek merupakan destinasi wisata yang cocok untuk wisatawan yang ingin menikmati keindahan alam dan budaya Papua. Desa ini menawarkan berbagai aktivitas yang dapat dinikmati oleh wisatawan dari berbagai kalangan. Pesan: Ketika mengunjungi Kampung Sauwandarek atau tempat-tempat alami seperti ini di Papua Barat Daya, penting untuk menghormati alam dan budaya setempat. Jaga kebersihan dan jangan membuang sampah sembarangan.",5,Eddy Manibuy,2023-12-22T10:51:26.934Z,Sauwandarek,Papua Barat
"Mampir ke tempat ini bagian dari tur Raja Ampat. Disini melihat ikan hias dengan snorkeling. Lumayan saja sih meskipun variasi ikan nya cuma 3-4 jenis saja. Beda dengan Bunaken, Nusa Lembongan, apalagi Karimun Jawa.",mampir tur raja ampat ikan hias snorkeling lumayan variasi ikan jenis beda bunaken nusa lembongan karimun jawa,mampir tur raja ampat ikan hias snorkeling lumayan variasi ikan jenis beda bunaken nusa lembongan karimun jawa,"Mampir ke tempat ini bagian dari tur Raja Ampat. Disini melihat ikan hias dengan snorkeling. Lumayan saja sih meskipun variasi ikan nya cuma 3-4 jenis saja. Beda dengan Bunaken, Nusa Lembongan, apalagi Karimun Jawa.",3,Ryandi Arjuna,2023-12-11T23:32:31.705Z,Sauwandarek,Papua Barat
Istri saya yang kesini bukan saya,istri kesini,istri kesini,Istri saya yang kesini bukan saya,5,Mohamad Umar Alfarouq,2023-12-08T07:14:44.602Z,Sauwandarek,Papua Barat
"Sauwandarek

Spot snorkeling terbaik dan tempat diving terbaik

Sauwandarek sangat luar biasa di bawah Jetty banyak ikan

Masyarakatnya yang akrab dengan parawisata 👍👍👍❤️❤️",sauwandarek spot snorkeling terbaik diving terbaik sauwandarek jetty ikan masyarakatnya akrab parawisata,sauwandarek spot snorkeling baik diving baik sauwandarek jetty ikan masyarakat akrab parawisata,"Sauwandarek

Spot snorkeling terbaik dan tempat diving terbaik

Sauwandarek sangat luar biasa di bawah Jetty banyak ikan

Masyarakatnya yang akrab dengan parawisata 👍👍👍❤️❤️",4,Erens Geo,2023-12-02T16:21:39.027Z,Sauwandarek,Papua Barat
Keren,keren,keren,Keren,5,Andy Mulyadi,2023-12-02T05:56:00.429Z,Sauwandarek,Papua Barat
"Salah satu spot snorkeling di Raja Ampat. Tidak terlalu ramai, sinyalnya blank spot, cocok bagi yang males ditelepon bos kantornya, hehe",salah spot snorkeling raja ampat ramai sinyalnya blank spot cocok malas ditelepon bos kantornya hehe,salah spot snorkeling raja ampat ramai sinyal blank spot cocok malas telepon bos kantor hehe,"Salah satu spot snorkeling di Raja Ampat. Tidak terlalu ramai, sinyalnya blank spot, cocok bagi yang males ditelepon bos kantornya, hehe",5,Pak Bay,2023-11-23T01:28:30.211Z,Sauwandarek,Papua Barat
Viewnya keren. Sangat cocok buat snorkeling dengan air yang sangat jernih batu karang yang masih terjaga juga ikan-ikannya yang beragam meu dekat dengan manusia,viewnya keren cocok snorkeling air jernih batu karang terjaga ikan ikannya beragam meu manusia,viewnya keren cocok snorkeling air jernih batu karang jaga ikan ikan agam meu manusia,Viewnya keren. Sangat cocok buat snorkeling dengan air yang sangat jernih batu karang yang masih terjaga juga ikan-ikannya yang beragam meu dekat dengan manusia,5,Ruba Nurzaman,2023-10-21T07:17:29.963Z,Sauwandarek,Papua Barat
Kampung lama dari Tahun 2000 sampai 2018 saya keluar ke tepat lain skarang ini,kampung tahun,kampung tahun,Kampung lama dari Tahun 2000 sampai 2018 saya keluar ke tepat lain skarang ini,1,Marsonkbarek Kbarek,2023-10-04T00:29:37.275Z,Sauwandarek,Papua Barat
Buat snorkling asik tempatnya,snorkling asik tempatnya,snorkling asik tempat,Buat snorkling asik tempatnya,5,Agoes Setyadi,2023-07-20T07:34:57.011Z,Sauwandarek,Papua Barat
Tempat yang harus dikunjungi,dikunjungi,kunjung,Tempat yang harus dikunjungi,5,Yunus Kasim,2023-03-18T05:23:45.307Z,Sauwandarek,Papua Barat
Spot yg bagus untuk diving,spot bagus diving,spot bagus diving,Spot yg bagus untuk diving,5,Gito Gito,2023-03-08T21:52:33.784Z,Sauwandarek,Papua Barat
Great jetty dive,great jetty dive,great jetty dive,Great jetty dive,5,Isabel Chaves,2023-01-30T08:15:06.888Z,Sauwandarek,Papua Barat
Tempatnya bagus,tempatnya bagus,tempat bagus,Tempatnya bagus,4,Dedik Agus mahendra,2023-01-07T14:20:12.253Z,Sauwandarek,Papua Barat
"Masyarakat ramah ,religi,alamnya lestari",masyarakat ramah religi alamnya lestari,masyarakat ramah religi alam lestari,"Masyarakat ramah ,religi,alamnya lestari",4,budi wirastyo wirastyo,2022-11-01T03:14:35.931Z,Sauwandarek,Papua Barat
"Pantai dengan view terindah, pantai bersih dan sangat cocok untuk snorkling. Ikannya banyak, besare, banyak jenisnya dan jinak.",pantai view terindah pantai bersih cocok snorkling ikannya besare jenisnya jinak,pantai view indah pantai bersih cocok snorkling ikan besare jenis jinak,"Pantai dengan view terindah, pantai bersih dan sangat cocok untuk snorkling. Ikannya banyak, besare, banyak jenisnya dan jinak.",5,Ipunk Purwanto,2022-05-31T23:50:42.715Z,Sauwandarek,Papua Barat
Sauwandarek,sauwandarek,sauwandarek,Sauwandarek,5,Ahmad Sakum,2022-05-29T23:17:22.711Z,Sauwandarek,Papua Barat
Masyaa Allah bagusnyaa bersiiih ikannya jinak2 .. ayo kita bantu menjaga kebersihan kelestarian Alamnya...,masyaa allah bagusnyaa bersiiih ikannya jinak ayo bantu menjaga kebersihan kelestarian alamnya,masyaa allah bagusnyaa bersiiih ikan jinak ayo bantu jaga bersih lestari alam,Masyaa Allah bagusnyaa bersiiih ikannya jinak2 .. ayo kita bantu menjaga kebersihan kelestarian Alamnya...,5,Ratnaningdyah Deanasari,2022-01-26T09:21:34.945Z,Sauwandarek,Papua Barat
"Tempat yang asik dan ramah untuk berkunjung untuk melepas penat. Tidak ada jaringan di sini jadi kita hanya fokus untuk liburan.
Kalau hari sabtu di larang mandi di pantai karena di kampung ini kebanyakan penduduknya beragama Advent, dimana mereka menganggap hari Sabtu adalah hari Sabat.
Di sini kita bisa memberi makan ikan.",asik ramah berkunjung melepas penat jaringan fokus liburan sabtu larang mandi pantai kampung kebanyakan penduduknya beragama advent dimana menganggap sabtu sabat makan ikan,asik ramah kunjung lepas penat jaring fokus libur sabtu larang mandi pantai kampung banyak duduk agama advent mana anggap sabtu sabat makan ikan,"Tempat yang asik dan ramah untuk berkunjung untuk melepas penat. Tidak ada jaringan di sini jadi kita hanya fokus untuk liburan.
Kalau hari sabtu di larang mandi di pantai karena di kampung ini kebanyakan penduduknya beragama Advent, dimana mereka menganggap hari Sabtu adalah hari Sabat.
Di sini kita bisa memberi makan ikan.",4,Chacha Thoe,2022-01-18T08:40:33.495Z,Sauwandarek,Papua Barat
"Desa di pulau Mansuar yg memiliki banyak ikan ikan laut yg indah, dan sering menjadi tempat kunjungan wisatawan domestik.  Dengan penduduknya yg ramah dan strategis berada diantara Raja Ampat dan Waisai. Namun demikian perlu penataan fasilitas umum yg lebih banyak dan souvenir2 khas raja ampat yg dapat menambah daya tarik bagi wisatawan",desa pulau mansuar memiliki ikan ikan laut indah kunjungan wisatawan domestik penduduknya ramah strategis raja ampat waisai penataan fasilitas umum souvenir khas raja ampat menambah daya tarik wisatawan,desa pulau mansuar milik ikan ikan laut indah kunjung wisatawan domestik duduk ramah strategis raja ampat waisai tata fasilitas umum souvenir khas raja ampat tambah daya tarik wisatawan,"Desa di pulau Mansuar yg memiliki banyak ikan ikan laut yg indah, dan sering menjadi tempat kunjungan wisatawan domestik.  Dengan penduduknya yg ramah dan strategis berada diantara Raja Ampat dan Waisai. Namun demikian perlu penataan fasilitas umum yg lebih banyak dan souvenir2 khas raja ampat yg dapat menambah daya tarik bagi wisatawan",4,Bustomi Tomi,2021-11-05T05:25:57.333Z,Sauwandarek,Papua Barat
"Amazinggg
View bawah lautnya terlalu cantik",amazinggg view lautnya cantik,amazinggg view laut cantik,"Amazinggg
View bawah lautnya terlalu cantik",5,Kristhyy Soetopo,2021-10-30T10:36:26.127Z,Sauwandarek,Papua Barat
kereen,keren,keren,kereen,4,Yama,2021-10-25T22:58:24.512Z,Sauwandarek,Papua Barat
Thick fishes,thick fishes,thick fishes,Thick fishes,4,Christoper Tambanua,2021-10-02T16:22:51.770Z,Sauwandarek,Papua Barat
"Tempat yang bagus dan indah serta anak2 yang rajin belajar dan ceria semua.
Jika ada yang wisata kesini, sebaiknya bisa  membawakan anak-anak buku cerita, buku mewarnai, alat tulis, krayon dll. Barang-barang tersebut sangat berguna buat mereka.",bagus indah anak rajin belajar ceria wisata kesini membawakan anak anak buku cerita buku mewarnai alat tulis krayon dll barang barang berguna,bagus indah anak rajin ajar ceria wisata kesini bawa anak anak buku cerita buku warna alat tulis krayon dll barang barang guna,"Tempat yang bagus dan indah serta anak2 yang rajin belajar dan ceria semua.
Jika ada yang wisata kesini, sebaiknya bisa  membawakan anak-anak buku cerita, buku mewarnai, alat tulis, krayon dll. Barang-barang tersebut sangat berguna buat mereka.",5,Nora Y,2021-02-20T10:30:08.823Z,Sauwandarek,Papua Barat
Mantap,mantap,mantap,Mantap,5,Mohamad Candra Bhirawa,2021-01-05T03:53:35.152Z,Sauwandarek,Papua Barat
Nice sunset,nice sunset,nice sunset,Nice sunset,5,BillyAmos17 Epa,2020-02-21T01:07:31.730Z,Sauwandarek,Papua Barat
"Pantai nya indah, bisa buat snorkel jg. Listrik menyala 12 jam setiap hari nya",pantai indah snorkel listrik menyala jam,pantai indah snorkel listrik nyala jam,"Pantai nya indah, bisa buat snorkel jg. Listrik menyala 12 jam setiap hari nya",4,Dzulfikar Muhammad,2020-02-14T02:00:57.806Z,Sauwandarek,Papua Barat
