review_text,rating,author,date,nama desa wisata,provinsi
"Wae Rebo Traditional Village is one of the most famous and most frequently visited traditional villages on Flores Island.

This village is one of many Manggarainese villages in the Greater Manggarai region that still maintains the authenticity of the village as well as its houses formation that inherited from their ancestor for hundreds year. Like other traditional Manggarainese villages, this village consists of Mbaru Gendang or a main traditional house at its center and other traditional houses surrounding on its left and right side so together they form a circular layout. In front of the main house there is a Compang or altar stone that is commonly used in many of rituals to worship their ancestor's spirit.

The uniqueness of Wae Rebo Traditional Village that distinguishes it from other traditional villages is its location lies deep in the valley of Satar Mese mountainous area which can only be reached by trekking.

Accessibilities: To access Wae Rebo Traditional Village, first we need to get into the modern village nearby called Dintor Village, Satar Lenda District, Manggarai Regency, which is about 50km/1.5 hours from Ruteng City or about 100km/3 hours from Labuan Bajo City using motorcycle or car. Half of the roads lead to Dintor are wide and good, the rest are small and badly constructed & maintained. Once we arrived, we have to continue to walk for about 6 km / 2.5 hours from the uphill of modern village nearby. The trekking path lead to Wae Rebo is clear but quite narrow, risky, also draining energy due to the steep of the hill.

Amenities: There are many amenities available around Dintor such as markets, food and beverage vendors, and lodging. Around Wae Rebo, there is only one traditional house that is specifically intended for tourists to stay all in one with breakfast, food and drinks, and also a toilet. For electricity, in Dintor it is always available connected to the power plant, while in Wae Rebo it is not always available only from 6 PM to 12 PM powered by small local generator. For water, there is no need to worry because there are many water springs on the mountain that is always flowing abundantly to all villages.",5,Aswin Nobby,2025-04-18T18:00:16.750Z,Desa Wisata Waerebo,Nusa Tenggara Timur
"Это уникальное место, которое точно стоит посетить. Для полного погружения в атмосферу, почитайте книгу об этой деревне в гостевом доме, а также можно пообщаться с жителями и задать им разные вопросы об их жизни - это будет увлекательный диалог. Рекомендую подниматься с рассветом (или ночевать наверху) - с утра будет меньше облаков и меньше туристов, которые большими толпами приходят с 10-11 утра и позже. До парковки нужно доехать на байке, далее пешком идти 2 часа. В самой деревне нужно сначала дать небольшое символичное пожертвование за церемонию очищения, а далее оплатить вход 200К с человека (в него входит обед).",5,Ivan,2025-04-15T06:52:53.724Z,Desa Wisata Waerebo,Nusa Tenggara Timur
Pokok nya seru deh,5,bumi Tangge,2025-04-14T14:11:06.292Z,Desa Wisata Waerebo,Nusa Tenggara Timur
"Something unique. Worth visiting.
We went up with Komodo Blessing Adventures tours and it was great!

Tapi mereka, orang kampung Waerebo butuh beruba semua lampu putih itu untuk warm white... di malam tidak catik lagi. Harus improve itu... jangan pake lampu putih aja lampu kuning yang kurang keras untuk mata.",5,Paula Huerta,2025-03-29T12:02:36.519Z,Desa Wisata Waerebo,Nusa Tenggara Timur
"Desa terindah yang pernah saya kunjungi, mulai dari viewnya, suasanya dan juga kopinya yang sangat enak sekalihhhh, pokokkknya harus balik lagi ke waerebo🥹🔥🔥",5,Rivan,2025-03-09T01:27:30.472Z,Desa Wisata Waerebo,Nusa Tenggara Timur
"La experiencia de ir a Waerebo, en general, me ha gustado. Son 2 h y 20 minutos de caminata en subida y 1h y 40 minutos de bajada. Les falta aún un poco de atención al turista. Al llegar no nos explicaron nada, solo hicieron una ceremonia de bienvenida que consistió en que el jefe dedica unas palabras en indonesio. No hacen ceremonias ni bailes para los turistas. Sólo las hacen cuando corresponde la celebración del acto por fecha. Una pena. Aún así, muchas noches tocan los tambores y platos para pasarselo bien. Además, también puedes entrar en cada casa y ver como viven: dónde duermen, cocinan, etc. Se dedican mayoritariamente a la producción de café y manualidades varias como sarungs. Por la mañana se ponen temprano a preparar las lonas llenas de café para que seque y para moler los granos en el mortero que tienen delante de las casas.
Ver la salida del sol con este paisaje es increíble.
La comida muy escaso: arroz, espinacas, patatas de gamba, 1 huevo duro y bananas. El desayuno es arroz y un trozo de tortilla.
CONSEJOS:
1) llevar snacks por si os quedáis con hambre o incluso para el trekking.
2) llevar chanclas para pasear por allí. Se os hará más comodo porque para entrar en las casas te tienes que sacar los zapatos y el baño siempre está mojado.
3) repelente de mosquitos.
4) es obligatorio llevar al menos una camiseta de manga corta y pantalon largo como símbolo de respeto a la comunidad.",4,Rosa Maria Rovira Claveras,2025-02-13T13:27:50.235Z,Desa Wisata Waerebo,Nusa Tenggara Timur
"Wae Rebo dengan keunikannya. Buat kamu yang tidak tahan dengan suhu yang dingin jangan lupa jaket ya,,",5,Priska Prylia,2025-02-09T10:46:29.125Z,Desa Wisata Waerebo,Nusa Tenggara Timur
"Magnifique! Certes touristique, droit d'entrée, case pour dormir à plusieurs, montée ardue, route évidemment comme dans l'est de Flores cabossées ....mais voir les étoiles depuis ce petit village perdu, de lever au petit matin et contempler la brume qui le noie reste magique. Certes les villageois sont blasés par l'afflux des touristes et vivent leur vie , semblant indifférents. Comment leur reprocher de tirer avantage dans un pays si pauvre. Mais si on prend la peine de s'y accommoder tout doucement, de prendre juste place à leurs côtés ils sont très accueillants. Ce n'est que mon avis personnel mais je vous conseille d'y aller pour la beauté qui s'en dégage sans forcément attendre milles échanges avec eux.",5,Nirmala,2025-02-08T16:46:59.157Z,Desa Wisata Waerebo,Nusa Tenggara Timur
"tempat yang luar biasa indah dan nyaman dengan nuansa pedesaan dibawah kaki gunung. Walaupun motoran sekitar 5 jam dari Labuan Bajo melewati jalur Lembor dan tracking sekitar kurang lebih 2 jam, tapi semuanya terbayarkan sama keindahannya dan masyarakat disini juga ramah-ramah. Suhu di Wae rebo juga lumayan dingin dan berkabut. Tempat yang sangat recommended untuk melepas penat dan mencari experience baru tinggal dengan suasana pedesaan.",5,Gabriella Natalie,2025-02-03T03:00:55.546Z,Desa Wisata Waerebo,Nusa Tenggara Timur
beautiful place😍,5,nadia mayesa,2025-01-24T15:18:30.518Z,Desa Wisata Waerebo,Nusa Tenggara Timur
"Keren banget pokoknya,pengen kesini lagi",5,Anselmus Roung,2025-01-15T00:04:57.799Z,Desa Wisata Waerebo,Nusa Tenggara Timur
"AMAZING AMAZING experience. From Labuan 4hr drive & 2hr hike. After arriving we had dinner (rice, eggs & veggies) and met the local tribe members in their hut who were very friendly and welcoming. At night they provide a bed, pillow and blanket. Breakfast was provided in the morning (rice and eggs). It was a very comfortable experience in the village. Would recommend to everyone however it is not accessible. Hike is long but was not bad (we had a 8yo local doing it with us in his flip flops).",5,Rezinhaaa,2025-01-12T04:59:46.053Z,Desa Wisata Waerebo,Nusa Tenggara Timur
"Siapkan fisik dan materi apalagi kalo kamu jauh dr jakarta.
Tempatnya indah bangeeettt.
Pokonya kamu haru kesini minimal sekali seumur hidup",5,Syifa erdhe,2024-12-28T03:22:32.441Z,Desa Wisata Waerebo,Nusa Tenggara Timur
"Beautiful small village in the middle of mountain, enjoy the night with no light pollution, you can see clear sky full of stars.

For ticket information you can stay in the house pay around Rp330k/$25 for one night, and don't forget bring cash money.

You can bring your snacks and share with local kids",5,riki afifuddin,2024-12-20T01:39:05.650Z,Desa Wisata Waerebo,Nusa Tenggara Timur
"Der Ort ist sehr touristisch geprägt,  obwohl acht Familien dort wohnen. Der Anmarsch besteht aus 5km Motorradfahrt und 3h Aufstieg zum Dorf. Bei Ankunft gibt es eine zwei Minuten Zeremonie. Abstieg dauert 2h plus Motorradfahrt. Die Übernachtung in der ""romantischen Rundhütte"" entpuppte sich als 20 Betten Schlafsaal. Alkohol und Rauchen sind verboten. Zu kaufen gibt es nur am Eingang Wasser und Softgetränke, keine Kekse. Bei Bedarf Reserven mitnehmen,  sowie Wechselwäsche. Frühstück und Abendessen sind gut und ausreichend.",4,Andy Her,2024-11-18T03:28:13.531Z,Desa Wisata Waerebo,Nusa Tenggara Timur
"I would advise to hike from morning so you would arrive at least at the top still in the afternoon.

Especially if you are not an active sporty person, you might want to take it slow when hiking, like me, I took around 4 hours arrived at the village. I started at around 2 pm and arrived around 6 pm, it's started foggy around 4.30 pm. It was very beautiful though foggy forest with many big and small trees (you even can find coffee trees on the sides). There were really big bamboo trees!

If I remember it correctly there are 3 posts. From the starting point to first post, it's a paved rocky road, easy to step in but pretty steep, at least for me.

From 1st to 2nd post you will hike on unpaved ground. Be careful when it's raining, can be slippery. I would suggest you rent a stick to help you keep your balance.
2nd to 3rd post, the track was pretty similar, but the trees were bigger, so giving a better shade from the sun. I did not even feel hot. You will breath a clean air the deeper you go up to the village.
3rd to the village, there were part where the walk path was getting narrower. But you could still across it.",5,silvia oktarina,2024-11-17T09:39:58.462Z,Desa Wisata Waerebo,Nusa Tenggara Timur
Bagus view dan pelayanannya,5,Irsach Karll Ardans,2024-11-07T11:27:30.389Z,Desa Wisata Waerebo,Nusa Tenggara Timur
"Das sollte man vorher Wissen! Ca. 7 1/2 Kilometer und 800 Höhenmeter größtenteils steiler Anstieg auf befestigten und unbefestigten Weg.
Die Anstrengung wird mit einem schönen Ausblick auf das Dorf belohnt
Die Übernachtung für 325.000 im Schlafsaal ist Geschmackssache",5,D,2024-11-04T23:42:01.539Z,Desa Wisata Waerebo,Nusa Tenggara Timur
"Ada biaya yang harus dikeluarkan sebesar 325.000 per orang untuk menginap dan 50.000 per grup yang diserahkan pada saat upacara penyambutan. Dapet makan malam dan makan pagi. Menunya nasi, sayur, telur, kerupuk. Kerupuk talasnya enak. Bisa dibeli juga yang Mateng atau mentah seharga 25.000 sekantong kecil. Ada toilet duduknya",5,Dwi Yasunah,2024-11-04T13:22:08.019Z,Desa Wisata Waerebo,Nusa Tenggara Timur
Ferry good,5,Efan Nopang (Efan),2024-11-03T12:09:17.212Z,Desa Wisata Waerebo,Nusa Tenggara Timur
Amazing experience. A very bumpy 10 mins The scooters to get to the start of the hike and then the hike up for the first half is very strenuous so make sure you're fit and healthy. Once there it's nice to disconnect and relax. The food is mainly rice and egg with some veg which is nice. When I was up there we saw pig sacrifices which was interesting to see.,5,Rhys Davies,2024-10-29T06:17:06.725Z,Desa Wisata Waerebo,Nusa Tenggara Timur
"Stunning village, looks just like the photos. Opportunity to spend the night for 350k including dinner and breakfast. Don’t bother hiring a guide for the hike, it’s easy and took me 1h45 to do alone. Be prepared for the most gruelling drive to get there. The road is AWFUL, wouldn’t recommend unless you’re an experienced driver. Also bear in mind the drive from Labuan Bajo said 3h on Google maps but took me 6h!!! Cos of the state of the roads it takes basically double the time. Was a long day of bumpy driving :(",5,Anya Claire,2024-10-26T14:09:33.337Z,Desa Wisata Waerebo,Nusa Tenggara Timur
🫶🏻,5,Inka Christina Sinurat,2024-10-26T09:38:47.826Z,Desa Wisata Waerebo,Nusa Tenggara Timur
Ini merupakan wisata kampung di atas awan yang saya kunjungi,5,Firman Firmansyah,2024-10-21T13:20:42.908Z,Desa Wisata Waerebo,Nusa Tenggara Timur
"Great place, good people, beautiful scenary. Worth visiting",5,Dahlia Halimuko,2024-10-16T00:27:09.465Z,Desa Wisata Waerebo,Nusa Tenggara Timur
Good,4,Singer Osman Goni,2024-10-14T02:35:36.977Z,Desa Wisata Waerebo,Nusa Tenggara Timur
kalo ke bajo wajib ke sini,5,eko hosmi,2024-09-25T00:22:21.367Z,Desa Wisata Waerebo,Nusa Tenggara Timur
Visitare questo luogo incantevole significa immergersi nel puro stile di vita indonesiano di un tempo ( ma anche recente ). Ci si arriva dopo circa 2.5 ore di cammino attraversando una affascinante foresta. Il sentiero in parte rifatto durante la pandemia è ben tenuto nonostante le piogge. Per chi dorme al villaggio si deve accontentare di una capanna dormitorio / ristoro comune con altre persone. Tutte le capanne sono all’interno avvolte da un fumo generato dai bracieri interni utilizzati sia per cucinare che per affumicare appositamente l’interno in modo da preservarlo nel tempo. Si mangia per terra e i bagni sono quel che sono. Consiglio di portarsi una zanzariera e repellente utile per la notte. Il tutto è molto “wilde” ma a mio avviso esperienza unica! Dimenticavo…Producono un ottimo caffè!,5,Giramondo,2024-09-09T12:11:24.807Z,Desa Wisata Waerebo,Nusa Tenggara Timur
"tracking 2 jam yg terbayarkan dengan sangat puas, 2 jam itu termasuk sangat cepat sampai yah.  untuk teman"" yg mau kesini upayakan lari"" h-3 sebelum kesini soalnya jalurnya menguras tenaga. motor bisa sampai parkiran atas dengan tanjakan yg lumayan dan beberapa titik di jalan kurang bagus. dan minesnya di desa terakhir warganya maksa agar kita naik ojek dengan tarif 100k perorang.",5,Khairul Imam,2024-09-05T13:34:19.083Z,Desa Wisata Waerebo,Nusa Tenggara Timur
Rumah adat yang sangat cantik 😘😘,5,Marselina Ani,2024-09-03T14:34:22.148Z,Desa Wisata Waerebo,Nusa Tenggara Timur
"Journey to the paradise, indah banget kampung ini",5,yunan morfosis,2024-08-29T08:11:13.904Z,Desa Wisata Waerebo,Nusa Tenggara Timur
"Die Fahrt von Labuan Bajo mit unserem privat-Fahrer war sehr gut! Tolle Landschaft, unterwegs schöne Zwischenstopps.
Das Dorf an sich, welches zum Unesco Weltkulturerbe zählt ist auch recht schön, allerdings dem Massentourismus verfallen.
Wir waren recht enttäuscht und fühlten uns “ ausgenommen”.
Klar das es was kostet, jedoch wird für jede Kleinigkeit extra berechnet.
Wir hatten Glück, dass unser lokaler Fahrer moderatere Preise für uns ausgehandelt hatte.
Die Wanderung nach oben ist sehr schön.
Sind nachmittags rauf und morgens vor dem inkludierten Frühstück wieder nach unten gegangen.
Abendessen : Reis mit Brühe und einem gekochten Ei.

Unbedingt genügend Wasser mitnehmen!
Idealerweise einen Hüttenschlafsack und trockene Wechsel Kleidung dabei haben.

Fazit: teuerstes Matratzenlager unserer gesamten Indonesien -Reise",3,alpenkind,2024-08-27T06:01:21.992Z,Desa Wisata Waerebo,Nusa Tenggara Timur
Sangat bagus,5,Venan Hadu,2024-08-23T20:21:38.863Z,Desa Wisata Waerebo,Nusa Tenggara Timur
"Quelle déception!

Je ne sais pas par où commencer tellement j’ai été déçu par cet endroit.
Le village en lui même est joli mais est devenu une machine à cash, ce qui enlève tout son charme: vous payez 50000 IDR en arrivant pour la cérémonie d’accueil, qui n’est rien d’autres que 2 phrases que le chef du village prononce pour demander votre protection durant votre présence (elle dure entre 5 et 10 secondes). On vous emmène ensuite à la « guesthouse » pour vous faire payer l’entrée au village qui coûte 200000 IDR par personne; ce prix inclut le droit de rester dans le village pour la journée ainsi que le repas de 12h et un café (bon a savoir si vous prévoyez de réaliser l’ascension à l’aube pour redescendre au fin de matinée). Le repas que nous avons eu était compose de riz blanc, d’un bouillon de légumes et d’une omelette, très décevant vis à vis du prix global payé.
Il est également possible de passer une nuit à la guesthouse et de repartir le lendemain matin pour 325000 IDR par personne (dîner et petit déjeuner inclus), mais vous dormirez dans une grande pièce avec tous les autres touristes. A titre d’exemple lorsque nous avons visité le village, 48 personnes avaient dormi au village la veille, je vous laisse faire les calculs et vous représenter l’authenticité du lieu.

La randonnée pour accéder au village est assez dure (1h40 pour monter avec 2 pauses pour des personnes avec une bonne condition physique) mais nous avons eu la chance de croiser des singes à l’aller et au retour, qui n’hésitent pas à s’approcher assez près pour vous observer.

De plus, la route pour accéder à la ville de denge (au pied de la montagne) est CATASTROPHIQUE que ce soit depuis labuan bajo ou depuis ruteng. La route est principalement constituée de galets (voir photo) et il y a énormément de trous et de gravillons. Comptez au moins 1h de trajet avec ces conditions d’un côté ou de l’autre. Enfin, pas de possibilité de trouver du carburant sur ces routes. Il faudra en prendre avant, ou à denge pour 25000 IDR la bouteille.

Au niveau du parking à scooter au départ de la randonnée, des locaux malhonnêtes nous ont demandé 20000 IDR de parking au retour (nous avions commencé l’ascension à 7h et personne n’était présent), ne payez pas ce sont juste des conducteurs de taxi moto qui attendent leurs clients.

Bref, en résumé cela prend beaucoup de temps et d’argent pour quelque chose de décevant, ça devait être sympa au début mais c’est devenu Disneyland. D’autres villages plus accessibles peuvent peut être valoir davantage le coup.

Ps: Pas besoin de prendre un guide, nous n’en avons pas eu besoin et ceux que nous avons croisé ne donnaient pas vraiment d’informations à leurs clients.",1,Pierre-Yves Gielen,2024-08-21T06:16:17.992Z,Desa Wisata Waerebo,Nusa Tenggara Timur
"Mauvaise expérience dans sa globalité. Une visite très moyenne qui nécessite pourtant beaucoup de temps et d’argent.

Concernant la route pour arriver à la ville de Dintor/Denge : le sentier côtier est difficilement praticable, en scooter cette partie nous a pris 2h sur la partie ouest (direction Labuan Bajo) et 1h sur la partie est (direction Ruteng).

Concernant les environs du village Wae Rebo :
Les logements dans la ville de Dintor/Denge sont chers par rapport à la qualité des installations (400k à 500k pour un couple pour une nuit avec dîner et petit déjeuner).
De plus, nous avons eu de nombreuses mauvaises expériences avec les habitants de Dintor/Denge et de la route vers l’ouest jusque Lembor. Des chauffeurs de taxi motos nous demandent 20k de stationnement alors que c’est gratuit, vol d’effets personnels sur le scooter, prix de l’essence augmenté en raison de notre origine, enfants qui ne cessent de demander de l’argent,…
Comportements qui tranchent avec le reste du voyage, pendant lequel nous avons expérimenté l’accueil et la bienveillance des indonésiens.

Concernant la visite du village traditionnel de Wae Rebo : Depuis le point référencé « Wae Rebo Village Trail Head » sur Google Maps et accessible en scooter, la randonnée pour le village a duré 1h40 de montée et 1h30 de descente (saison sèche). La première partie de la randonnée (30 min) est aménagée et très raide, la seconde partie (1h) est un sentier de terre et pierre qui montent beaucoup moins mais est légèrement glissant (attention dans la descente).
Une fois le café passé, si vous descendez au centre du village traditionnel, vous devez vous présenter et payer l’entrée.
Il y a deux façons de visiter le village :
-la « visite » en journée pour laquelle vous payez 200k pour l’entrée et 25k pour la « cérémonie d’accueil » du chef du village (1 courte phrase prononcée assis dans la maison principale). Vous aurez un café d’accueil et un déjeuner basique (œuf, riz, bouillon).
-la nuit dans le village pour laquelle vous payez 325k pour l’entree, la cérémonie, le les repas et la nuit.
Lors de notre visite en août 2024, 12 personnes ont fait la visite de journée et 48 personnes ont dormi dans le village la veille.
Il n’y a pas d’interaction avec les habitants qui voient défiler des touristes en continu et n’ont peut être plus l’envie de partager.
Une vieille dame attend qu’on l’a photographie pour ensuite demander d’acheter des bracelets en souvenir.
Le tourisme a certainement transformé la vie des habitants du village, il est difficile de savoir ce qu’il reste des traditions, si ce n’est les 7 maisons conservés et entretenus.
L’endroit est néanmoins très beau, le cadre montagneux et l’architecture des maisons en font un endroit atypique.
Les touristes qui n’ont pas souhaité payer les frais d’entrée, qu’ils considéraient trop élevés pour un passage rapide, ont été repoussés en haut du village traditionnel.",1,MICHEL Eva,2024-08-21T06:10:02.158Z,Desa Wisata Waerebo,Nusa Tenggara Timur
"Paradiso fuori dal mondo.
La fatica per arrivarci ne vale la pena.",5,Santax Frank,2024-08-19T15:35:20.199Z,Desa Wisata Waerebo,Nusa Tenggara Timur
Money making gimmic,1,Sabrina Lakhan,2024-08-16T05:05:07.091Z,Desa Wisata Waerebo,Nusa Tenggara Timur
"Hidden gem. Desa wisata exclussive, karena butuh effort khusus untuk bisa kesana. Arsitektur unik bangunan, timeless",4,bonita santi,2024-08-11T20:01:21.582Z,Desa Wisata Waerebo,Nusa Tenggara Timur
"Waerebo, sebuah desa adat terpencil dan misterius di Kabupaten Manggarai, Nusa Tenggara Timur. Terletak di ketinggian 1.200 meter di atas permukaan laut. Di kampung ini terdapat 7 rumah utama atau yang disebut sebagai Mbaru Niang.
Untuk sampai ke lokasi butuh perjuangan ekstra karena harus jalan kaki 1-2 jam,
Siapkan air secukupnya saat tracking,
Bila perlu gunakan tongkat sebagai alat bantu,
Tempatnya sangat indah, nyaman dan tenang penuh kedamaian",5,Jackson Nh,2024-08-03T02:46:59.626Z,Desa Wisata Waerebo,Nusa Tenggara Timur
"Wae Rebo salah satu desa adat tercantik yang pernah aku datangi.
Perjalanan panjang dari Labuan Bajo terbayar dengan pemandangan indah nya,
Pengalaman pertama aku Trekking 5km, rekomendasi untuk orang yang bener2 cinta nature, semoga keindahan alam nya akan selalu terjaga",5,Mellisa Christine,2024-08-02T07:13:34.136Z,Desa Wisata Waerebo,Nusa Tenggara Timur
Bercengkrama dan berolahraga santai dengan anak-anak desa Waerebo,5,Mulyadi Supanjang,2024-08-02T00:23:25.157Z,Desa Wisata Waerebo,Nusa Tenggara Timur
"Muy buena experiencia, hay locales abajo que cobran estacionamiento (es gratis!) arriba hay que pagar 200.000 por la ceremonia, a un buen ritmo sin parar son 50 minutos",5,nicolas delano,2024-07-30T10:42:37.843Z,Desa Wisata Waerebo,Nusa Tenggara Timur
Perjalanan yang sangat menyenangkan dan  bertemu dg orang-orang yang luar biasa hangat dan bersahabat,5,ismaniar syafrudin,2024-07-30T06:56:57.392Z,Desa Wisata Waerebo,Nusa Tenggara Timur
"For the people who want to do the trekking by themselfs. It is an very easy to follow trekking. In our opinion there is no need for guides. We did it by ourselfs. The first part is paved but slippery and steep. And the second part is unpaved but less steep.
We did it in 1:40 up an 1:30 down.

With an scooter you can drive to Dende, there is a car parking. Thereafter you can drive a bit with a scooter uphill, the road is paved but full of putholes and loose gravel. If good experienced you can manage.

Local guides where hanging on our scooter when we came back.

Come as early as possible! Less people and also no locals asking for money.",5,Jasper dW,2024-07-29T09:39:17.801Z,Desa Wisata Waerebo,Nusa Tenggara Timur
"Beautiful traditional houses in the middle of the forest and hills. Entrance fee is 50.000 IDR which you pay after a ""ceremony"" which is a short talk where the village head asks his ancestors for permission to enter the village. You can also sleep overnight with diner and breakfast for 325.000 IDR. Then you sleep with 25 people in a traditional house. The diner and breakfast was disappointing: rice with egg. It was also very disappointing that there was not any initiative from the local villagers to tell something or show something about their village. There is a small shop that sells their locally produced products: coffee, vanilla, cinnamon, honey, and wine. To reach this village you must walk about 75 minutes (the first half is the steepest part). There are 3 rest points on the way.",4,Travel Here Youtube,2024-07-28T23:53:06.854Z,Desa Wisata Waerebo,Nusa Tenggara Timur
"Trecking 2,5 - 3 jam, jalan trecking melalui hutan dan menanjak. Suhu malam hari dingin sekali, sorenya berkabut, banyak turis asingnya. Syahdu sekali bikin betah. Beli kopi dari petani langsung 1 cangkir kopi bubuk arabika harga 50 rb. Kopinya enaaaak.",5,Lintang Cahya A,2024-07-23T03:52:46.099Z,Desa Wisata Waerebo,Nusa Tenggara Timur
Tempat yang sangat bagus.,5,Oktavianus Tosima,2024-07-22T18:55:31.949Z,Desa Wisata Waerebo,Nusa Tenggara Timur
"Luar biasa suasana di Wairebo, masih alamai",5,Darius Uren,2024-07-20T12:53:50.133Z,Desa Wisata Waerebo,Nusa Tenggara Timur
