review_text,rating,author,date,nama desa wisata,provinsi
"TERLALU KEREN SIH 😍

BIAYA
NAIK OJEK KE POS 1 : 100K PP
NGINAP : 325K
ACARA ADAT : 50K/grup
SEWA TONGKAT : 10K
KELAPA MUDA : 25K

LISTRIK CUMA JAM 6 SORE SAMPAI JAM 10 MALAM , PERSIAPKAN POWERBANK DLL, TIDAK ADA SINYAL DISANA",5,Yusdwika Saputro,2025-07-26T11:56:40.177Z,Desa Wisata Waerebo,Nusa Tenggara Timur
Do it without organizing an expensive tour and you won't be disappointed. Don't arrive too early if you are staying overnight because it can get a little bit boring when you are on your own. Stay overnight and enjoy the sunset. Don't miss the beautiful sandy beach on your way back to labuan badjo or ruteng. Its right below Joses homestay.,5,Raphael Brunnbauer,2025-07-17T09:37:03.570Z,Desa Wisata Waerebo,Nusa Tenggara Timur
"Desa terbaik, pemandangan yg luar biasa bagus. Salah satu destinasi impian sedari dulu",5,Fitria Indriani,2025-07-15T01:57:29.429Z,Desa Wisata Waerebo,Nusa Tenggara Timur
"My honest, no sugar-coating review here.

You’ve read enough about Wae Rebo in other review. Here’s my review from different perspectives, as a guest/hiker, as a parent, as someone from medical background, to help you set your expectations right.

Points that made the hike worthwhile:
1) the pavement covered about 1/3 of the route. Hats off to the villagers for their efforts on building the pavement in such a challenging, treacherous topography.
2) the village people and kids are really friendly.
3) view are spectacular - you have seen how instagramable it is in the photos.
4) the accommodation provides clean bedding and blanket

Issues of concern:
1) safety
-  hikers do not complain about the basic facilities — this is what we signed up for. The stairs to the outdoor washroom / bath, was  covered in mud, many fell or had a near-fall.
- they could have clear up the muddy stairs to prevent falls.
- Dinner was in another house, it was raining heavily & pitch dark. The ground was muddy and slippery, no lighting/ torchlight was provided. Handphone light wasn’t sufficient in this pitch dark environment. A few of us slipped.
- the person in-charge of tourism could have adopted sustainable energy with solar panel or just a simple gesture of providing a torch light.

2) guest experience
- during the welcome ceremony, we were told by the host this is where we are welcomed like a family member, we will sit and eat together. Fact - you will be eating with groups of hikers, none of the locals will join in. There’s no engagement / conversation with any of the locals. We were rushed through the dinner & breakfast as there was a second batch. If you have been to some nice, small home stay with personalize experience and hospitable hosts, this felt uncomfortable. It felt as if we are being ‘processed’ through instead of hosted as a guest.
- we figured there was easily 120-150 tourists / hikers around. Possibly it’s overcapacity for the village/ hosts to cope. Maybe they should allow respective group to dine in their own house instead of making everyone dine in one house and having to rush us off.

- it was raining heavily at night, We were asked to walk over to the other house for dinner. Our raincoat was broken and our clothes were wet. The host could have offered us umbrella to walk across, instead, they walked off with their umbrella after notifying us of dinner time. Simple gesture as such would have made us feel so much better by not getting wet in the rain again, and slept in cold wet clothes at 12 degree celsius.

3) bring toddlers / kids
- we met some parents with really young toddlers(below 1). I wouldn’t say it’s absolute NO, but this is not the easiest place to hike up and the nearest medical facility / clinic are far out in the village at the base of the mountain. Do weigh in and out the risks.

4) medical / physical limitations
- if you have severe hip , knee arthritis and have trouble with walking longer distance on daily basis/ going up and down the staircase, this place is not for you. The inclination & elevation, are merciless towards your joints. The slippery last 2/3 of the route ( if it rains), is challenging for the balance.

5) what I read from Google review vs my personal experience
- view 5/5
- meal: ok
- experience in the village 3/5

Tips:
1) if you are not a regular hiker with fairly good fitness level but still determined to take this hike, get a guide to pace you.

2) raincoat - get a full-length raincoat from the base of the mountain / the sundry shop in the village.

3) rehydration stick / isotonic drink - you will need this

4) staying dry & warm at night - night temperature at Wae Rebo can be as low as 12 degrees Celsius. Layer up. Pack your clothes in plastic bag / double ziplock bag in case you need to hike in the rain for 2.5 hours like us.

5) stay overnight at Wae Rebo Lodge & hike up early morning to avoid the rain that usually starts by mid noon.

It’s still a beautiful place worth your time as long as expectation is well-managed. Hope this helps. Cheers ~",3,Jacinta Lim,2025-07-10T06:45:00.758Z,Desa Wisata Waerebo,Nusa Tenggara Timur
very unique place,5,Kaila Rahmani,2025-07-03T00:30:40.998Z,Desa Wisata Waerebo,Nusa Tenggara Timur
"Things to note before you come:
1. Good physical condition is required to reach this village, the journey could be arduous depending on your fitness level as the hike may take about 2-3hrs
2. Bring enough cash. There's no digital payment or internet connection along the way to the village, you'll need cash to pay the guide, motorbike taxi, ceremony fee, and staying fee.
3. Bring necessary equipment to hike and staying overnight like spare clothes, toiletries, snacks, water that fit into a backpack.
4. Now there's wifi in the village thanks to starlink, but it's very limited and you have to pay for it, but it's like 20k only, just visit their coffee shop in the village and say you want to use wifi.
Hope it helps on your journey ahead.",5,Danny Kwan,2025-06-26T15:23:39.382Z,Desa Wisata Waerebo,Nusa Tenggara Timur
"It's a paradise village on the mountain.
A very unique 7 traditional ""cone-roof"" houses.
They only have coffee farm around, so all otherthings daily must carry by motorbike and continue about 2 hours hike by foot.
They only charged 325k for a bed/blanket/pillow in guesthouse for all guests with 2 times meals (dinner and next morning breakfast), 50k for welcome ceremony entered the village area.
Less than 400k rupiah (us$25 / €22) for 2D1N.

IF YOU STILL COMPLAINING ABOUT THAT PRICE,
YOU REALLY A HORRIBLE CHEAPSKATE PERSONALITY!",5,Marko Smith,2025-06-19T00:23:15.196Z,Desa Wisata Waerebo,Nusa Tenggara Timur
"I will share my experience from Dintor to Waerebo. Dintor is the nearest village to Waerebo and it's where all visitors start their journey.

Firstly from Dintor you'll hv to go to the Waerebo trailhead which takes 10-15 mins. A local can send you to this entrance for IDR 50k. You can also ride your own bike there as there's plenty of parking space. The road up there is pretty rough so my advice is just relax and pay someone to send you there. It's not alot of money.

The hike to Waerebo from the entrance is 4.5-5km according to my smartwatch. Waerebo is 1100m above sea. However, the actual hike is only abt 500m elevation gain. It took me 80mins to get to Waerebo from the entrance. From pos5 onwards it's pretty much flat or downhill trail. If you're a trail runner, you can start running from this point onwards. Completing the hike in less than 1 hour is very doable.

If you consistently workout and hike twice a week, 2-3km uphill hikes with minimum 500m elevation then this waerebo hike is a piece of cake. I highly recommend you to do some training before coming here. If you have zero running or hiking experience, then expect to take 3-6 hours.

Waerebo was ok. The fee was IDR 50k for welcome rituals and IDR 200k for food and hangout. Food was so basic I'm tempted to call it lousy. Rice with egg and crackers. I did a day trip because I thought there's probably nothing to do up there aside for taking photos, play with the dogs and daydream. I think they also sell t shirts for IDR 200k - 500k. Can't recall exactly.

If you don't want to be disappointed, I highly recommend you do lots of hiking training before the trip. I can't imagine myself spending 3-4 hours (6-8 return) on a one way hike up just for the pyramid shaped village. I'm quoting 3-4 hours because that's what everyone writes in their reviews.

In the end, I only spent a total of 3+ hours at Waerebo, including hiking up and back to the starting point.",3,Jann Han Lim,2025-06-15T01:32:01.048Z,Desa Wisata Waerebo,Nusa Tenggara Timur
Pemandangan yang sangat indah,5,Fitra Rahmansyah,2025-06-12T09:04:29.459Z,Desa Wisata Waerebo,Nusa Tenggara Timur
"This place is very nice and very challenging for those who love nature like me, the first time I went to Wae Rebo with some of my guests it felt like going back to the past because the characteristics of the people in Wae Rebo are very traditional with the traditional customs of Mangarai which makes Wae Rebo village very much in demand by tourists, the existence of the Wae Rebo traditional village which is challenging is because it is located in the middle of the foot of the mountains there are also 7 traditional houses in the shape of a cone surrounding the field or the Mangarai people usually call it natas. we walked from the village by spending 4 hours tracking until we arrived at Wae Rebo village. there the air is very cool and the natural beauty is very pronounced, for nature lovers like me this will be considered like the heaven of Mangarai because of the uniqueness of the village plus the people are very friendly and we are cooled with authentic Wae Rebo coffee.  Even though the journey is very challenging because we have to pass through several bumpy and rocky roads and also have to do tracking, it will all be paid off with the unique and perfect view of the traditional village of Wae Rebo.",5,Astika Pinas,2025-06-12T06:52:41.038Z,Desa Wisata Waerebo,Nusa Tenggara Timur
"Butuh perjuangan untuk sampai ke Waerebo. Perjalanan panjang dari labuan bajo sekitar 4- 6 jam. Pendakian butuh 1,5 jam atau lebih. Sedia jas hujan karena sering hujan bila mulai siang dan berkabut.",5,Ria Susmadewi,2025-06-11T08:35:36.000Z,Desa Wisata Waerebo,Nusa Tenggara Timur
"Amazing place, wonderful view, humble villagers. It can be a place to calm your body and mind bcs out of crowd and servis. Enjoying millions of stars, cold wind and nature voices",5,Swarman Siahaan,2025-06-11T06:26:38.285Z,Desa Wisata Waerebo,Nusa Tenggara Timur
"Wae Rebo is a beautiful and idyllic village to look at, but unfortunately, it feels more like a money-making operation than a cultural experience. I had expected a genuinely warm welcome and to learn more about the history of the village. Instead, we felt unwelcome, despite the fact that visitors contribute to the local income.

When I respectfully wrapped a cloth around my shorts to show consideration for their culture, I was also met with harsh criticism. The man who welcomed us angrily said, “Show some respect! Think of our values!” even though I believed I was doing exactly that: embracing those very values. It’s a real shame that this gesture wasn’t appreciated but instead criticized.

My friend borrowed a sarong, also to show respect for the culture, its norms and values, but she was laughed at because she didn’t know how to tie it properly. She was then laughed at again for apparently tying it “like a man.” There was little interest in us, and very little help or interaction. The villagers didn’t seem open to engaging and appeared to take no joy in sharing their culture with visitors, which was truly disappointing.

That said, we were still happy to have done the hike and to see the village. But we would recommend skipping the overnight stay, it’s not worth the money and very uncomfortable.",2,Joy Beekelaar,2025-06-03T08:30:04.871Z,Desa Wisata Waerebo,Nusa Tenggara Timur
The best experience ever!!!! 😭✨🔥,5,Agatha O C,2025-06-01T21:39:07.246Z,Desa Wisata Waerebo,Nusa Tenggara Timur
Wisata yg harus dikunjungi di Pulau Flores.,5,Bendvri Silitonga,2025-06-01T13:41:23.362Z,Desa Wisata Waerebo,Nusa Tenggara Timur
"Kalau kamu nyari pengalaman budaya yang autentik dan suasana yang bikin hati adem, Wae Rebo adalah jawaban terbaik! 🏡🌄 Perjalanan menuju desa ini memang bukan buat yang lemah nyali, karena kamu harus trekking sekitar 2,5 sampai 3 jam melewati hutan lebat dan jalur naik turun yang cukup menguras tenaga. Tapi perjalanan itu ibarat investasi yang sangat berharga karena kamu bakal dapetin pengalaman hidup yang sulit dilupakan. 🚶‍♀️⛰️

Setibanya di Wae Rebo, kamu langsung disambut oleh rumah adat Mbaru Niang yang bentuknya unik banget—kerucut tinggi dengan anyaman bambu dan atap daun lontar yang terasa seperti menghubungkan kita ke leluhur. Suasana desa terasa damai dan mistis, apalagi saat kabut turun perlahan, memberi nuansa magis seolah kamu masuk ke dunia lain yang penuh kedamaian dan tradisi. 🌫️🏠

Orang-orang lokalnya ramah dan hangat, mereka dengan senang hati bercerita tentang budaya dan sejarah desa mereka. Kopi lokal yang mereka sajikan juga nggak boleh dilewatkan—aroma dan rasanya benar-benar bikin kamu pengen nambah terus! ☕😍 Malam hari, jangan harap ada suara bising, karena hanya ada suara alam dan gemerlap bintang di langit yang jernih. 🌌✨

Tempat ini benar-benar mengajarkan kita untuk menghargai tradisi dan cara hidup yang sudah ada sejak zaman nenek moyang, sambil menikmati keindahan alam yang luar biasa. Kalau kamu butuh digital detox dan pengen merasakan ketenangan sejati, Wae Rebo adalah surga tersembunyi yang wajib masuk bucket list kamu! 🙌💚",5,Ardhani 2326,2025-05-25T12:32:46.852Z,Desa Wisata Waerebo,Nusa Tenggara Timur
"Hier ein Guide mit allen Infos um im Dorf zu übernachten. Habe mit meiner Freundin hier übernachtet:

Planung:
Keine Reservierung möglich/nötig. Die haben immer genug Betten übrig. Haben, soweit ich weiß, jeden Tag auf.

Anreise:
Mit dem Roller kann man bis zum Google Standort „Wae Rebo Village Trail Head“ fahren. Der letzte Kilometer ist anspruchsvolles Terrain, aber machbar. 1-2 Kilometer vor dem Standort ist ein Haus mit einer offenen Schranke. Die Leute werden versuchen dir einzureden, dass man nicht durchfahren darf. Man darf jedoch durchfahren. Wir sind einfach schnell dran vorbeigefahren ohne anzuhalten. Falls man sich den Weg nicht zutraut kann man sich auch ab dem Haus fahren lassen oder laufen.

Man sollte ca. 13 Uhr mit der Wanderung starten. Diese dauert 2,5 Stunden bis zum Village.

Wir haben zuvor bei „Blasius Monta Homestay“ zu Mittag gegessen (50.000 pro Person). Hier kann man auch Übernachten oder Zeug lagern. Wir haben hier unsere Helme gelagert, weil wir diese nicht mitnehmen wollten beim Wandern.

Am „Warebo Village Trail Head“ sollte man alles ins Helmfach tun und nichts offen liegen lassen.

Ankunft im Dorf:
Wenn man am Ende der Wanderung im Dorf ankommt kann man eigentlich nichts falsch machen.
Man wird gleich abgeholt von einem Einwohner.
Am Anfang gibt es eine Willkommens-Zeremonie. Hier gibt man eine Spende an das Dorf. Unser Hostel meinte 25.000 pro Person sind angemessen.
Die Übernachtung inkl. Abendessen und Frühstück kostet 325.000.

Weiteres:
Im Dorf gibt es keinen Handy Empfang.
Keine Kurzen Hosen, besonders bei Frauen. Im Dorf nur lange Hose. Außerdem ist es auch relativ kalt. Lange Hose & Pulli/Jacke sind optimal.
Man schläft in einem großen Bettenlager ca. 23 Personen, wenn volles Haus. Alles war sauber und in Ordnung. War nichts eklig. Man darf aber auch keinen Luxus erwarten.
Die Einwohner kochen Wasser ab, womit man seine Trinkflasche auffüllen kann.

Fazit:
Wir fanden es ein sehr tolles Erlebnis uns können es weiterempfehlen.",5,Erik,2025-05-23T06:17:57.937Z,Desa Wisata Waerebo,Nusa Tenggara Timur
"Desa diatas gunung yg sangat indah dan sangat terjaga.. dari kota labuan bajo harus naik kendaraan sekitar 3-4jam, lalu sampai di parkiran naik ojek ke pos pendakian pertama.. setelah itu tracking kurang lebih 2 jam.. semua terbayar dengan pemandangan yg sangat epiccc",5,Riska Maida,2025-05-22T14:10:23.036Z,Desa Wisata Waerebo,Nusa Tenggara Timur
"Wae Rebo is truly a magical place, a hidden village in the mountains that feels like stepping into another world. Surrounded by lush greenery and misty hills, the beauty of the landscape is absolutely breathtaking. The traditional Mbaru Niang houses are not only unique in architecture but also full of cultural meaning, standing as a symbol of unity and heritage.

What makes Wae Rebo even more special is its people. The community is warm, welcoming, and deeply connected to their traditions. They live in harmony with nature, grow their own coffee and spices, and welcome guests with genuine hospitality. Staying overnight was a humbling experience, sharing meals, joining the evening gathering, and waking up to the peaceful sounds of nature.

This is not just a place to visit, but a way to reconnect with culture, simplicity, and serenity. Highly recommended for anyone seeking an authentic and meaningful experience in Flores.",5,Mohamad Redzuan Mohamad Nizam,2025-05-19T15:00:39.474Z,Desa Wisata Waerebo,Nusa Tenggara Timur
Adem ayeh,5,Adel Mus,2025-05-19T00:39:41.356Z,Desa Wisata Waerebo,Nusa Tenggara Timur
"Waerebo, berkendara kurang lebih 5jam untuk sampai desa kaki gunung, lanjut ojek ke pos 1.  Terdapat 7 pos yg di lewati untuk sampai ke sana. Medan yg lumayan, krn pas naik kena hujan. 5kilo dengan waktu stengah jam akhirnya sampe ke desa atas. Dimulai dengan acara adat penyambutan di rumah utama, lanjut disuguhkan kopi hasil panen warga di rumah t4 makan. Pemandangan sangat indah skali, baik menuju malam ataupun di pagi hari. Ke sana bisa ikutan open trip, bisa juga mandiri. Kalau opentrip smua trima beres. Untuk yg mandiri, boleh bawa kendaraan sendiri ataupun nyewa sampai ke parkiran desa kaki gunung, lanjut ngojek warlok 100rb PP, tiket masuk ke desa adat 325rb (include nginap 1 malam dan makan 2 kali), ole² beragam mulai 10rb, ada jg sewa tongkat di bawah 10rb PP. Selain kisah hidup warga Waerebo yg dpt kita pelajari, menikmati alam yg memanjakan mata pun sangat memberi perasaan membahagiakan. Untuk anak² di sana, sebisa mungkin tdk diberi jajan, atau boleh ijin dlu sama orang tua mreka yah, kmarin bawa buku² dan alat tulis ke sana mreka senang trimanya.",5,A. SALMA LARASATI,2025-05-19T00:10:20.131Z,Desa Wisata Waerebo,Nusa Tenggara Timur
"This village has been rebuilt years ago. It is not the original. The real village is in another side where it has road connections and schools. In conclusion, this is just a replica of the old ways and living in such huts. It is 3 hours 1 way hike up and a motorbike ride of 15 mins. Got to knock bamboo bell to inform village chief upon your arrival. Later, they will bless you in the main hut. Everyone will stay, sleep and eat together with no privacy in another hut at 8pm. There is only electricity from 6pm to 10pm where you can charge your power banks and battery. There is a warung at the entrance where they sell instant noodles, tea and coffee. There is paid wifi there. Everyone got to eat together, food isn't that fantastic. There is no meat but vegs. It is just for the experience. There are 3 toilets cum bathroom and are really basic. No hot water. At night, mosquitoes will visit you  when you sleep at 10pm where all lights are out and everyone snores. Prep your phones lights or headlamps. Good for 1 night stay at most. I call this tourist entertainment.",4,Lee Kokliang,2025-05-16T04:53:09.302Z,Desa Wisata Waerebo,Nusa Tenggara Timur
Rumah adat wae rebo,5,Rafael Andries Tino,2025-05-15T16:08:28.224Z,Desa Wisata Waerebo,Nusa Tenggara Timur
"Tourist scam, foreigners have to pay way too much (compared to Indonesian) and you're not allowed to actually explore the village or talk to the locals
If you just wanna have an insta pic, go for it - otherwise go i.e. to Bena Village in Bajawa",1,Maximilian Lang,2025-05-14T12:45:25.356Z,Desa Wisata Waerebo,Nusa Tenggara Timur
"Kamoung adat di kabupaten Manggarai Flores, yang special, perjalanan trekking menjadikan tempat ini semakin menarik, setelah menyusuri hutan akhirnya bertemu kampung kecil dwngan bentuk bangunan yang unik. Tradisi yang selalu terjaga.  Membuat perjalanan ke kampung ini menjadi kenangan  perjalanan yang indah.
Semoga selalu terjaga keasrian hutan dan budayanya",5,hasrizal,2025-05-12T08:39:25.804Z,Desa Wisata Waerebo,Nusa Tenggara Timur
"Absolutely avoid during the rainy season!

The trek turned into a nightmare as a tropical downpour fell on us during 1 hour of the trek, the path became extremely dangerous and we arrived drenched despite wearing rain gear (our stuff still isn't dry 48h later and our phones and tablets could have died).

The hike is nice and the village is beautiful, but that's where it ends. Prices are extremely expensive to visit the village or to stay and eat there, and none of the locals interact with the tourists (let's not even mention the ""welcome ceremony of the village chief"", which is a real joke). They try to extort money from tourists at all costs (example: sarong rental 100.000 !!!).

Overall, a rather disappointing experience",3,Estelle Platiau,2025-05-04T10:01:22.200Z,Desa Wisata Waerebo,Nusa Tenggara Timur
"Tempatnya sangat memuaskan mata, walaupun perjalanan dari pos pertama hingga pos 7 atau pos terahir sangatlah jauh atau melelahkan bayangkan 1200 DPL? Itu sangat tinggi bukan, tapi semua itu akan terbayarkan jika sudah melihat betapa cantiknya desa WAE REBO🥰🥰
Buat yg belum pernah kesini, wajib coba deh😍😍👍",5,Erfin Samsop,2025-04-29T15:47:19.690Z,Desa Wisata Waerebo,Nusa Tenggara Timur
"Besides the uniqueness of the culture, experience, and local politeness;
It is by far the best stargazing place. Especially when all lights went off...",5,Alfian Noor,2025-04-29T03:30:49.248Z,Desa Wisata Waerebo,Nusa Tenggara Timur
"Balade très agréable, village très beau ; pour le reste c'est du racket sur fond pseudo folklorique, sans compter l’énorme perte de temps, la cérémonie est une vaste blague simple excuse pour prendre un petit billet supplémentaire, la nuit et le repas sont similaires à un escape game grotesque et bon marché, tous entassés au sol dans une case à ingurgiter un repas maigre et insipide sous la surveillance d’un local debout le visage fermé ... Je ne vais pas m’étendre plus sur le sujet de crainte de devenir vraiment désagréable et bien des commentaires avant le mien font état des désagréments rencontrés. Si vous envisagez d’y aller faites le par vos propres moyens, sans pseudo guide qui ne sert à rien, et surtout ne tombez pas dans le piège de rester la nuit, faites en sorte de faire l’aller-retour dans la journée.",2,Pablo,2025-04-26T05:47:48.562Z,Desa Wisata Waerebo,Nusa Tenggara Timur
"Great experience. I went there with Happy Bajo because I’m traveling solo and not in the mood to drive a motorbike alone there. But I saw some people go there by their own and the village people still welcomed them and you can pay them directly.

The pathway to the village is around 5 km with the last 2 km is relatively flat or downhill but it was worth the sweat.

The village is very beautiful, the people are nice. I slept like a baby in one of the hut, I even took a bath in with water from the spring water, cold but it was very refreshing after the hike.

I regret not buying coffee from them. I bought bracelets from the cute kids.",5,Barbara,2025-04-21T06:52:06.093Z,Desa Wisata Waerebo,Nusa Tenggara Timur
"Disappointed. The whole “experience” felt like a scam. First you need a local guy (sorry, “guide”) to take you to the village, it’s 300.000, although if you’re Indonesian from another island you can pass freely 😐 then you pay 50.000 for the ceremony where they tell you close to nothing about the village and lecture you not to speak to anyone in the village and not to interact with the animals, not to take pictures and a few more “not to”, after that they shove you into another hut with some food and coffee being served and invite you to join. I thought that was nice and welcoming but after I was done I got a bill for 200.000 🥲 (the most expensive rice, omelette and boiled cucumbers in my life). Again, if you’re Indonesian you don’t have to pay  for food either 👍 I brought sweets and origami for the kids in the village hoping to play with them a little and wasn’t even allowed to give it to them directly. Ended up spending 30 min in the village and left. Not recommended. So many similar villages around the island with easier access and more welcoming people, go to Bajawa instead.",1,Katherine,2025-04-20T22:42:57.920Z,Desa Wisata Waerebo,Nusa Tenggara Timur
